,title,score,id,subreddit,url,num_comments,body,created
712,"[LPT] When you send an email money transfer or if you send them frequently, Check the status of the transfer to make sure the recipient has deposited it.",2,epqx0t,LifeProTips,https://www.reddit.com/r/LifeProTips/comments/epqx0t/lpt_when_you_send_an_email_money_transfer_or_if/,1,[Canada]  If both parties forget the financial institution may charge you a “transfer reclaim” fee,1579243013.0
713,LPT Bank account that helps to fight medical debts,0,epqg7e,LifeProTips,https://www.reddit.com/r/LifeProTips/comments/epqg7e/lpt_bank_account_that_helps_to_fight_medical_debts/,2,"betterbank.app - not really a LPT, I just saw this website and thought our American friends here might make use of it.",1579241092.0
714,"LPT: when visiting your grandparents, ask them to teach you something that's interesting or important to them. Chatting is fine, but asking for something specific shows you care about them, and gives them a chance to feel purpose",813,epq2md,LifeProTips,https://www.reddit.com/r/LifeProTips/comments/epq2md/lpt_when_visiting_your_grandparents_ask_them_to/,29,,1579239543.0
715,"lPT: When refilling a hot water bottle, be sure to re-use the water already in it. Not only does it save water but it saves boiling too much water unnecessarily.",0,epq04t,LifeProTips,https://www.reddit.com/r/LifeProTips/comments/epq04t/lpt_when_refilling_a_hot_water_bottle_be_sure_to/,2,,1579239251.0
716,"LPT: If you hurt someone (verbally or physically) in an accidental way, wait some time before asking to be forgiven. If you do not wait they might have a negative answer to your apologies and you might even make it worse.",18,eppn9r,LifeProTips,https://www.reddit.com/r/LifeProTips/comments/eppn9r/lpt_if_you_hurt_someone_verbally_or_physically_in/,9,"Edit: Do not delay it by a lot, give them just enough time to cool down so they can have a proper conversation.",1579237750.0
717,"LPT: Want to teach kids about saving money? Try the Penny Challenge: Day 1 - Save $0.01, Day 2 - Save $0.02; Day 100 - $1, Day 365 - $3.65. In the end, they will have saved $667.95!",8,eppm51,LifeProTips,https://www.reddit.com/r/LifeProTips/comments/eppm51/lpt_want_to_teach_kids_about_saving_money_try_the/,5,,1579237622.0
718,LPT: Need to clean up your email inbox? Copy and paste the company's zip code in your search to find every email from them.,35,epp892,LifeProTips,https://www.reddit.com/r/LifeProTips/comments/epp892/lpt_need_to_clean_up_your_email_inbox_copy_and/,5,"I've used this trick to clean out the clutter in my email inbox. If you're receiving too many emails from specific companies or organizations and decide to unsubscribe and don't need their emails anymore, you can just search their zip code or any other information that would be specific to them. *Usually* zip codes are at the bottom of the email.

This doesn't always work as planned, some companies, especially tech companies from Silicon Valley will share zip codes. But it does work 80-90% of the time.",1579236032.0
719,LPT: kicking a wall can get rid of snow on shoes better and faster than stomping.,22,epow7n,LifeProTips,https://www.reddit.com/r/LifeProTips/comments/epow7n/lpt_kicking_a_wall_can_get_rid_of_snow_on_shoes/,14,,1579234653.0
720,LPT about making easy money,0,epow57,LifeProTips,https://www.reddit.com/r/LifeProTips/comments/epow57/lpt_about_making_easy_money/,20,"I don't know if this is the right subreddit, but I really like photography and people call me talented when it comes to it, buuuuut I don't have a professional camera, I'm taking pictures on my phone. I want to buy a camera but I need to earn some money. The camera is called Nikon d3500, I think that is a good and cheap beginner camera. Here in Romania is around 2500 lei, which is about 580 something dollars. So, I'm 16 yrs old and I need money, any tips for a teenager to make money?
If you want to find more about me you can ask me",1579234643.0
721,LPT: Cut an onion under/near the stove vent to cut down the eye irritation tremendously. The irritating chemicals are pulled up and away.,11,epofre,LifeProTips,https://www.reddit.com/r/LifeProTips/comments/epofre/lpt_cut_an_onion_undernear_the_stove_vent_to_cut/,7,"Fairly new here, so hope this isn’t common knowledge.",1579232751.0
722,LPT: Memory/Bandwidth Usage - Youtube Music Streaming - set resolution to lowest possible for less browser usage,1,epodly,LifeProTips,https://www.reddit.com/r/LifeProTips/comments/epodly/lpt_memorybandwidth_usage_youtube_music_streaming/,4,"I use Google Chrome (memory hog) for all internet usage but have Youtube music streaming on Edge. Switching YT from 1080p to 144p showed a positive memory change and frequent streaming pauses cleared up. If you have a crappy system like I do at work, this might make a difference & speed things up.
 [PIC](https://i.imgur.com/BBtShph.png)",1579232498.0
723,"LPT: If you are non-american and have difficulty with using voice assistant, just fake an American accent and it'll probably pick up what you're trying to say much better.",1,epo6ew,LifeProTips,https://www.reddit.com/r/LifeProTips/comments/epo6ew/lpt_if_you_are_nonamerican_and_have_difficulty/,5,,1579231650.0
724,"LPT: When warming up food in the microwave, make your food in the shape of a doughnut with a hole in the middle.",29,epo0km,LifeProTips,https://www.reddit.com/r/LifeProTips/comments/epo0km/lpt_when_warming_up_food_in_the_microwave_make/,10,"Some foods this is not possible however some food, spaghetti for example are easy to do this with. If you make the food into a doughnut shape and flatten it as much as possible it will heat up much more evenly. If you want to go one step further, turn the power to 50% and microwave it for twice as long!",1579230929.0
725,LPT: Don't be scared of credit cards early in your life. Building your credit and establishing a credit history early is an easy way to make your life better down the road.,19,epny6a,LifeProTips,https://www.reddit.com/r/LifeProTips/comments/epny6a/lpt_dont_be_scared_of_credit_cards_early_in_your/,15,"I see a lot of posts about people trying and failing to get approved for a loan for one reason or another because of bad credit or no credit history. Inevitably in the comments I see the OP saying that they ""have a credit card but don't use it because they're scary."" I felt the same way when I was younger before I understood how credit and credit cards really worked, so I thought I'd maybe help some people and dispel some of the fears around credit cards. 

The fear around credit cards comes from hearing all the nightmare stories about people tanking their credit when they were young and they're screwed for the rest of their life. And while that's definitely possible to do, it doesn't just happen out of nowhere on its own. Those people whose credit was ruined early in life saw that they had a $4000 credit limit on their card and didn't think what it would take to pay that off and just racked up a ton of debt. If you use a card wisely and stay within your means, credit cards can help you a lot now and especially down the road. 

First let's talk about how your credit works and how credit card companies make money off of you. Your credit is based on a lot of things in some weird formula that really nobody knows exactly. Essentially there's a thing called your debt to income ratio, which is literally how much debt you have total compared to how much money you make. There are some debts that are excluded in this for whatever reason, but this ratio is usually how creditors determine whether you get approved or what the terms of your loan are going to be. The messed up thing is that they, the credit companies, want you to have debt because people with no debt are somehow less appealing and I'm not sure why that is. Credit card companies want people to get their cards and use them a lot because they get a percentage of each purchase made with your card on the back end, and then they also make money off of the interest they charge the consumers. So your goal should be to use your credit card, have some small amount of ""debt"" each month that you're making good payments on (if it's something like a car or mortgage loan) or you're paying it off every month so as to bypass the interest, then you make more ""debt"" the next month and so on. 

If you have a checking account with a bank I would apply for a credit card through that bank, look for a card with good rewards and then see what happens. You won't get declined for having no credit or no credit history, credit card companies look to acquire new customers in young people and, in their eyes, take advantage of some of the people that misuse credit cards and rack up debt. But you, the smart consumer, can take advantage of this and build your credit positively. I would suggest going in to the bank and sitting down with an employee that can go over all the important details of a card i.e. interest rate, billing cycle, rewards, penalties and whatever else. Most Bank credit cards all have around the same interest rates, however some cards may have lower interest rates but no rewards, I would stay away from those as they are usually used for things like balance transfers or large purchases that you don't want to take a loan out for, but all that is a different conversation. 

So, you got approved, probably for like a $2000 credit limit, now what? Well, the big thing to keep in mind is how the interest rate applies to your purchases and paying your card off early. Basically, if you go to the store and buy something with the credit card there isn't any interest applied until the second month that the balance is on the card, meaning that if you buy something and pay it off every month you won't be charged interest and it's basically like paying cash, but you are building credit and also you get rewards points with most cards that can go towards gift cards and stuff. My suggestion would be to use your credit card in place of your debit card and then just pay off your credit card every month and you're good to go. People run in to problems when they use their credit card and don't pay it off every month and just make minimum payments. The minimum payments are set to benefit the credit card companies more than the consumer as they barely cover the interest, so essentially they're set to pay off the card in the longest possible time which causes you to pay a ton in interest, which is again where the credit card companies make their money. 

Finally, don't be afraid to apply for credit cards. People say that credit applications mess with your credit, and while that can be true if you're applying for seven cards a day, applying for one here and there won't negatively impact your credit after a short while. The only time you should definitely NOT apply for any new lines of credit is when you're applying for a mortgage, and your mortgage loan officer should tell you the same thing when you're going through the application. 

One thing I will caution everyone on is big box and retail store credit cards, so things like Best Buy or American Eagle or Walmart. On the surface they're the same as a bank credit card, but they always have these ""zero interest for X months"" promotions. These, again, can be used to your advantage if you do it right, but nobody at the store will tell you this and a lot of people get screwed because they didn't read the fine print on the card agreement during the application. Almost all retail stores have an interest rate on their card of upwards of %30, their promotions for no interest bypass that interest for the allotted time, but only if the balance is paid IN FULL by the end of the promotion time period, if you fail to do so you'll owe the interest for the entire promotional period even if you only owe like $10. So let's say you buy a $1200 TV from Best Buy and they offer a 0% interest for 12 months promotion if you use a Best Buy card. Obviously you should take it, but when you do just set automatic payments up for $101 per month to make sure that the balance is paid by the end of the 12 month period. You're essentially paying the same as you would if you just threw $1200 cash down and paid for it there, only it's spread out over 12 months, you build credit, and you kept that big chunk of money in your pocket. Win win.

All in all, new adults generally don't get educated about how to properly use credit to your advantage and it hurts them in the long run. I'm no financial guru but I have been through some stuff in my life that has taught me about these things. I went to buy my first car when I was 25 and I got shafter on the interest rate because I had no credit history. But, now a few years later I have a house and a car and a good credit score/history and some manageable debt that I make more than minimum payments on. Hopefully some of the stuff I learned can teach some of you how to use credit to your advantage and how to build it properly. Ask your parents or someone you know that is good with money to sit down and explain this stuff to you first hand if I did a poor job simplifying it, it's usually easier to digest when you see how these things work yourself. Good luck and sorry for any spelling or formatting, this was all typed on my phone.",1579230654.0
726,"LPT: if you can't return lent money in a week, don't borrow it.",0,epntnt,LifeProTips,https://www.reddit.com/r/LifeProTips/comments/epntnt/lpt_if_you_cant_return_lent_money_in_a_week_dont/,5,,1579230138.0
727,LPT: Google Drive hoards all your trash instead of deleting it every 30 days like you might expect (including times when you replace a file with a newer one). If you are running out of storage go to Trash -> Empty Trash,39,epnrm8,LifeProTips,https://www.reddit.com/r/LifeProTips/comments/epnrm8/lpt_google_drive_hoards_all_your_trash_instead_of/,2,"Today I discovered I had accumulated 6GB worth of deleted files in total since about 2013. Be warned this can include anything that was backed up to Google Photos and then deleted as well as previous versions of files (if you happen to need them then restore or download them).

To be honest, if you deleted it, you probably don't need it. That being said it may be worth giving it a quick scroll through just in case.",1579229902.0
728,LPT: Stall handles have notches on the other side of the door- pay attention to which way they're oriented for locked and unlocked positions so in the future you don't need to push on the doors gently to see if it's occupied.,0,epnrg8,LifeProTips,https://www.reddit.com/r/LifeProTips/comments/epnrg8/lpt_stall_handles_have_notches_on_the_other_side/,3,,1579229884.0
729,"LPT: When making a grilled cheese sandwich, cover the pan with a lid. This creates the perfect environment for the cheese to melt but still allows the bread to get golden and crispy.",7,epnr9d,LifeProTips,https://www.reddit.com/r/LifeProTips/comments/epnr9d/lpt_when_making_a_grilled_cheese_sandwich_cover/,5,,1579229861.0
730,"LPT: If you are somehow caught in an avalanche and become disoriented, clear out some space in front of your face and spit. Where ever the spit goes is down.",65,epnnto,LifeProTips,https://www.reddit.com/r/LifeProTips/comments/epnnto/lpt_if_you_are_somehow_caught_in_an_avalanche_and/,40,,1579229473.0
731,"LPT: On iOS, create a shortcut for typing in your email address by going to Settings > General > Keyboard > Text Replacement. Create an entry that uses two letters not commonly used together (""ii"", ""qq"", ""yy"") and have it automatically replace this with your email address for quicker logins, etc.",281,epngwj,LifeProTips,https://www.reddit.com/r/LifeProTips/comments/epngwj/lpt_on_ios_create_a_shortcut_for_typing_in_your/,35,"I use this ALL THE TIME and it saves so much time and also ensures there's no typos in my email address. 

Cheers.",1579228665.0
732,"LPT: if you're cooking anything on an old electric stove (those with the full-metal hotplates) and the hotplate is too hot for what you wanna do, take your pot off, turn it off and put a pot of water on there to cool the plate down",0,epngq0,LifeProTips,https://www.reddit.com/r/LifeProTips/comments/epngq0/lpt_if_youre_cooking_anything_on_an_old_electric/,1,,1579228641.0
733,LPT: Wikipedia is a good source for keeping up with the world's news.,225,epn3e4,LifeProTips,https://www.reddit.com/r/LifeProTips/comments/epn3e4/lpt_wikipedia_is_a_good_source_for_keeping_up/,21,"Not sure how well known this is but, Wikipedia has a dedicated [page](https://en.wikipedia.org/wiki/Portal:Current_events) to current events happening around the world. It's a great source for those wanting to keep in the know for places other than their home country.",1579227054.0
734,"LPT: practice every day tasks with the hand you don't usually use,if you injure your dominant hand it will make life easier.",10,epmzi0,LifeProTips,https://www.reddit.com/r/LifeProTips/comments/epmzi0/lpt_practice_every_day_tasks_with_the_hand_you/,12,,1579226607.0
735,"LPT: When kicking in a door during an emergency, plant your heel near the knob near the frame, whether you're kicking forward, or in a mule-kick style.",5,epmvfk,LifeProTips,https://www.reddit.com/r/LifeProTips/comments/epmvfk/lpt_when_kicking_in_a_door_during_an_emergency/,1,More information on this for those looking for additional tips at [How To Kick in a Door](https://vocal.media/lifehack/how-to-kick-in-a-door).,1579226144.0
736,"LPT: even if you live alone, make sure to take time to cook yourself a nice meal once in a while. It will feel good and is also a great skill to have if you meet someone.",85,epmuvs,LifeProTips,https://www.reddit.com/r/LifeProTips/comments/epmuvs/lpt_even_if_you_live_alone_make_sure_to_take_time/,6,,1579226077.0
737,"LPT: Cancel Netflix straight after you subscribe. You still get your entire month, but there could be a few days after your month expires where you wouldn't watch anything, so you're effectively getting those days for free. Once you want to watch a show again, repeat the process.",0,epmpz7,LifeProTips,https://www.reddit.com/r/LifeProTips/comments/epmpz7/lpt_cancel_netflix_straight_after_you_subscribe/,11,,1579225493.0
738,LPT: Did you watch a video(s) on YouTube that's completely fucked your recommendations? Delete it from your watch history and it wont affect your recommendations anymore.,76,epmm5k,LifeProTips,https://www.reddit.com/r/LifeProTips/comments/epmm5k/lpt_did_you_watch_a_videos_on_youtube_thats/,8,"We've all been there. You click on video that looks interesting, and maybe it is, but either way you end up not particularly wanting to see more of that kind of video. 

I figured this trick out a few years ago after I went on a brief binge of restoration videos and my recommended feed was nothing but restoration videos after. 

Deleting them all from my watch history fixed it.",1579225075.0
739,LPT: Keep Contact Information On Locked Screen,1,epmhpx,LifeProTips,https://www.reddit.com/r/LifeProTips/comments/epmhpx/lpt_keep_contact_information_on_locked_screen/,8,"Take a photo of your backup contact information and save it as your locked screen on your phone. If someone finds your cell tell, they will have all the information they need to return it to you.",1579224592.0
740,"LPT: Use the Notes app to make yourself a to-do list each morning. Then, take a screenshot of it and set it as your lock screen. That way, when you pick up your phone throughout the day, you'll be reminded of what needs to get done.",235,epm0zs,LifeProTips,https://www.reddit.com/r/LifeProTips/comments/epm0zs/lpt_use_the_notes_app_to_make_yourself_a_todo/,33,,1579222657.0
741,"LPT Request: How do I deal with the disgusting, sickening feelings felt after upsetting someone and before them being happy towards you again?",4,epls0l,LifeProTips,https://www.reddit.com/r/LifeProTips/comments/epls0l/lpt_request_how_do_i_deal_with_the_disgusting/,9,,1579221591.0
742,LPT: You can get multi functionality in the Reddit redesign by going to /r/subreddit1+subreddit2,9,eplrwg,LifeProTips,https://www.reddit.com/r/LifeProTips/comments/eplrwg/lpt_you_can_get_multi_functionality_in_the_reddit/,4,"So, for example, you could do https://reddit.com/r/science+everythingscience+technology .  This is a lot easier than having to go back to old.reddit.com to set up multis.",1579221573.0
743,LPT: You can use emojis on a Windows PC by pressing the Windows key + period key together.,18,eplib6,LifeProTips,https://www.reddit.com/r/LifeProTips/comments/eplib6/lpt_you_can_use_emojis_on_a_windows_pc_by/,8,,1579220435.0
744,"LPT: When it's cold out and you're plugging in your car, loop the cord around your drivers side mirror.",5,eplh6i,LifeProTips,https://www.reddit.com/r/LifeProTips/comments/eplh6i/lpt_when_its_cold_out_and_youre_plugging_in_your/,9,"If you do this, it makes it quite obvious as you're walking up to your car that it's still plugged in, and you'll also be able to see it as you sit in your seat as will. Helps prevent driving away and adding to the snow snake problem we see up here every year.",1579220298.0
745,"LPT: When setting reminder for anniversary/birthday, set your reminder title "".... since XXXX,"" therefore you will know what milestone you're celebrating or how old is the birthday person.",0,eplfud,LifeProTips,https://www.reddit.com/r/LifeProTips/comments/eplfud/lpt_when_setting_reminder_for_anniversarybirthday/,1,IMO milestones and their age are just as important and it shows you really care about them. Not to mention then you can buy appropriate gifts for such occasion.,1579220146.0
746,"LPT: Contrary to popular sayings, don't TELL someone you love them but instead make them FEEL you do with your actions. Your actions speak louder than words ever will.",6,eplb9f,LifeProTips,https://www.reddit.com/r/LifeProTips/comments/eplb9f/lpt_contrary_to_popular_sayings_dont_tell_someone/,7,,1579219606.0
747,"LPT: When using a subscription promo you don't intend to keep, check to see if your credit card offers virtual credit card numbers.",16,epksbp,LifeProTips,https://www.reddit.com/r/LifeProTips/comments/epksbp/lpt_when_using_a_subscription_promo_you_dont/,2," You can often set up a temporary card with a set expiration date or charge limit. Doing so gives you an extra guarantee that you won't be charged when the subscription renews. This is not only helpful if you forget to cancel, but when canceling is made purposely difficult. I've found as these deals become more prevalent, canceling has become more convoluted and confusing, often having several screens of ""Wait before you cancel read this!"" messages. More than once I swore I canceled something only to find that the cancel button redirected me to a second or third confirmation screen that I likely closed out of.",1579217245.0
748,LPT: Think of soda like candy instead of a drink. Most sodas like Coke and Pepsi have similar amounts of sugar in them.,120,epkoe2,LifeProTips,https://www.reddit.com/r/LifeProTips/comments/epkoe2/lpt_think_of_soda_like_candy_instead_of_a_drink/,23,"Dr. Pepper - 12oz can, 200 Calories, 54g Carbs
Hershey Bar - 1.55oz, 220 Calories, 24g Sugars",1579216739.0
749,"LPT: If you're feeling low and want to make things in life, try making small changes to your day to improve your current self. The motivation to create new habits for the better can significantly make you feel better than you are feeling right now.",26,epkkjy,LifeProTips,https://www.reddit.com/r/LifeProTips/comments/epkkjy/lpt_if_youre_feeling_low_and_want_to_make_things/,2,,1579216248.0
750,"LPT: If you're an adult, try educating yourself about major events events such as the unfortunate one in Australia right now so that you can pass on the knowledge to kids so that they know how small actions of ours as a whole can lead to severe consequences.",15,epke1o,LifeProTips,https://www.reddit.com/r/LifeProTips/comments/epke1o/lpt_if_youre_an_adult_try_educating_yourself/,14,,1579215438.0
751,LPT go eat a salad!,0,epk8jr,LifeProTips,https://www.reddit.com/r/LifeProTips/comments/epk8jr/lpt_go_eat_a_salad/,8,"Over the years I notice that whenever I am really hungry I crave nothing but the worst foods; pizza, burgers, or fries. In the moment it feels like nothing else will satisfy my hunger. However if I power through and ignore the cravings and eat a salad instead, I find it satisfies my hunger just the same as the bad foods would have. Plus I don't feel like shit afterwards, instead I feel that I gain energy and focus. I never stop craving the bad foods, I suppose that is by design. I just wanted to share this, as it's a really nice feeling when the hunger goes away, and instead of feeling fat and greasy, I feel light and energized.

TLDR: Eating healthy is hard when your hungry, but salads will stop the hunger without the fat.",1579214716.0
752,"LPT instead of playing music, play funny podcasts while working out. Not only does it make the exercise little easier, but you will also be practicing to ""keep smiling and stay calm"" in state of exhaustion.",2,epk5rn,LifeProTips,https://www.reddit.com/r/LifeProTips/comments/epk5rn/lpt_instead_of_playing_music_play_funny_podcasts/,7,Because we tend to become annoying and snappish when we are exhausted.,1579214352.0
753,"LPT: Search Reddit by typing into Ecosia (or Google,etc): site:""www.reddit.com/r/subreddit"" keyword Works amazingly well.",7,epk05q,LifeProTips,https://www.reddit.com/r/LifeProTips/comments/epk05q/lpt_search_reddit_by_typing_into_ecosia_or/,3,"Examples:

site:""www.reddit.com/r/london"" bar restaurant

site:""www.reddit.com/r/lifeprotips"" wine cleaning

site:""www.reddit.com/r/listentothis"" calm jazz

Have fun browsing!",1579213586.0
