,title,score,id,subreddit,url,num_comments,body,created
0,"LPT: As a parent, if you have to keep track of the time your child is waking up during the night, take a screenshot or your iPhone every time you have to get up. That way you don’t need to switch on the light nor need to have pen and paper. You’ll check the result later :-)",4,evstbw,LifeProTips,https://www.reddit.com/r/LifeProTips/comments/evstbw/lpt_as_a_parent_if_you_have_to_keep_track_of_the/,2,,1580359020.0
1,"LPT: When trying to shop for that ""person who has everything"" consider commissioning an artist to create a unique portrait or sketch for them. r/hungryartists has some amazing individuals who can do great work for a reasonable cost.",7,evscjf,LifeProTips,https://www.reddit.com/r/LifeProTips/comments/evscjf/lpt_when_trying_to_shop_for_that_person_who_has/,1,,1580357280.0
2,"LPT when using devices like mobile/laptop, take break every 20 minutes and look away (20 20 20 rule) and after every 30 to 40 minutes take a small walk.",13,evrvui,LifeProTips,https://www.reddit.com/r/LifeProTips/comments/evrvui/lpt_when_using_devices_like_mobilelaptop_take/,5,"My job requires me to sit on computer for long hours. I had severe eye problem few years back. I tried seeing a doctor, changing my glasses and tens of other remedies. But nothing worked. No eye drops, no special lenses. Nothing.

Then one doctor brought my attention to 20 20 20 rule which I already knew. But I always sold it short before. Then I started following this rule. Now I can sit on computer all day long without feeling a thing in my head or eyes. I even made a PowerShell script that reminds me to take a break every 20 minutes.

Too many people find it impractical. That's the reason I made the script. Give your computer the responsibility of reminding you to take a micro break.

Edit: 20 20 20 rule states that every 20 minutes, look away for at least 20 seconds, at an object that's around 20 feet away.",1580355512.0
3,LPT: Reach out to that friend you haven’t spoken to in a while. You never known when you’ll get that call that says they’re gone or when they’ll get the call for you.,8,evrloq,LifeProTips,https://www.reddit.com/r/LifeProTips/comments/evrloq/lpt_reach_out_to_that_friend_you_havent_spoken_to/,3,,1580354386.0
4,"LPT: Use example.com as an example domain in screenshots, tutorials, etc. It was made for that by the IANA!",10,evr4us,LifeProTips,https://www.reddit.com/r/LifeProTips/comments/evr4us/lpt_use_examplecom_as_an_example_domain_in/,3,,1580352487.0
5,"LPT:Just a reminder during tax season that making more money does not ""bump you up"" a tax bracket.",102,evqu6j,LifeProTips,https://www.reddit.com/r/LifeProTips/comments/evqu6j/lptjust_a_reminder_during_tax_season_that_making/,40,"The US income tax system is progressive; meaning that the first $X gross you make gets taxed at the first X%.  If you made more than that, it gets taxed at the next rate until the next dollar cap, and then the next and so forth. 

Don't deny yourself the opportunity to increase your income because you are afraid that ALL of it will be taxed at a higher rate - It wont. 

Do be aware that you may lose certain welfare opportunities if you make more money though. One foot out of poverty can, in some cases, end up costing you more.",1580351288.0
6,"[LPT] If you're earbuds sound louder in one ear, make sure the plastic on the one sounding quiet isn't pushed in.",4,evqhjq,LifeProTips,https://www.reddit.com/r/LifeProTips/comments/evqhjq/lpt_if_youre_earbuds_sound_louder_in_one_ear_make/,5,,1580349804.0
7,"LPT: If you are constantly struggling/failing to wake up, even with an alarm, you probably aren't getting enough natural light in your room",21,evqdtm,LifeProTips,https://www.reddit.com/r/LifeProTips/comments/evqdtm/lpt_if_you_are_constantly_strugglingfailing_to/,8,"Sorry for long winded title and any formatting. Basically during my first year of uni, me and a few of my friends found ourselves waking up at around 6pm everyday, we would go to sleep and it would be dark, and when we woke up it would be dark. Not long after, we all started developing/relapsed with, anxiety, depression etc, and one of my friends even had to drop out after being diagnosed with a really disturbing case of psychosis. After trying everything, from resetting my circadian clock, pulling all nighters, sleeping pills, cutting down smoking and drinking, working out before bed, eating well, specialist alarm apps and necking a can of red bull in a semi-conscious state, I got really frustrated, and the only time I could get into morning lectures was when I had stayed up from the night before, also I did think about keeping window and curtains open at the time but my room was ground floor and faced the courtyard where everyone would congregate, at the time, I didn't understand why I could wake up fine when I was at my parents home, but not during term time. 

Fast forward and I failed my first year, but unlike most of my friends I decided to give it another shot, some mates and I moved out of halls and into a bright open plan apartment. After my first sleep in the new room, I woke up naturally at 8am even though I only had 4 hours sleep, I felt great and rested, and woke up like this pretty much everyday from then on. I racked my brain but couldn't understand what was different, until it finally clicked, the new room had pretty crap blinds which let in most of the natural light, whereas my room in halls had thick blackout curtains. I did a bit of research and yada yada yada it's obvious that exposure to sunlight makes waking up much easier, if not natural, and ever since, waking up has been a breeze (most of the time lol)

Just to add, if you try this and other methods and it doesn't work, maybe get checked for any underlying health conditions, it's possible you may have anemia,  insomnia, or a million and one other things. 

TLDR: if you wake up late or struggle to wake up at all, even with an alarm, try leaving your curtains/blinds open or using a translucent window covering.",1580349385.0
8,LPT: when hauling something with ratchet straps twist them a couple times to prevent vibration in the wind as you drive.,3,evqcgn,LifeProTips,https://www.reddit.com/r/LifeProTips/comments/evqcgn/lpt_when_hauling_something_with_ratchet_straps/,7,,1580349231.0
9,"LPT: If you're buying something that isn't consumable (like a toy) on Amazon and it has a ""Subscribe and Save"" option, that's approximately how long it will last before breaking. Plan accordingly.",0,evq8cd,LifeProTips,https://www.reddit.com/r/LifeProTips/comments/evq8cd/lpt_if_youre_buying_something_that_isnt/,2,,1580348752.0
10,LPT: new to Pc gaming and FPS games? Change the dpi setting of your mouse to around 800 -1000dpi. Your aim and response time should improve dramatically than the default mouse setting.,9,evq5lm,LifeProTips,https://www.reddit.com/r/LifeProTips/comments/evq5lm/lpt_new_to_pc_gaming_and_fps_games_change_the_dpi/,4,,1580348437.0
11,LPT: Save the silica gel packs you get with clothes and put them in your toolbox to prevent your tools from rusting in storage.,715,evpwol,LifeProTips,https://www.reddit.com/r/LifeProTips/comments/evpwol/lpt_save_the_silica_gel_packs_you_get_with/,58,,1580347421.0
12,LPT: Use gmaps without having to look at the screen.u can use haptic feedback to turn left(2 short vibrations followed by one long vibration) and right(one long vibration with 2 short vibrations) almost like morse code,1,evpwe8,LifeProTips,https://www.reddit.com/r/LifeProTips/comments/evpwe8/lpt_use_gmaps_without_having_to_look_at_the/,5,,1580347388.0
13,LPT: When calling members of Congress be nice.,14,evp7em,LifeProTips,https://www.reddit.com/r/LifeProTips/comments/evp7em/lpt_when_calling_members_of_congress_be_nice/,2,"The individuals who you speak with when you call a Congressperson are low level staffers typically on their first job out of college who make little money and don’t have any influence on the policy process. They likely get screamed at for things that are not their fault on a daily basis. Being cordial and direct with them will make your point better-heard. 

Source: buddy of mine used to have this job",1580344433.0
14,"LPT: Simply putting ""New"" at the end of an updated version of sometime (file, server, etc.) will only lead to confusion in the future when it's updated again (e.g. ""New New""). Instead, use version numbers or timestamps or if you need to use ""New"" remember to drop it later on.",20,evp4cm,LifeProTips,https://www.reddit.com/r/LifeProTips/comments/evp4cm/lpt_simply_putting_new_at_the_end_of_an_updated/,8,,1580344059.0
15,"LPT: Chop, store and freeze vegetables and meats before they can go bad. Especially stuff you'd normally trash, like unused broccoli stems, wilting celery, sprouting potatoes, shriveling tomatoes or peppers- etc. Amazingly, they all make great soup stock.",65,evow1v,LifeProTips,https://www.reddit.com/r/LifeProTips/comments/evow1v/lpt_chop_store_and_freeze_vegetables_and_meats/,22,,1580343013.0
16,"LPT : If you have a sore throat after drinking alcohol, eating honey can really sooth your throat.",4,evoryp,LifeProTips,https://www.reddit.com/r/LifeProTips/comments/evoryp/lpt_if_you_have_a_sore_throat_after_drinking/,4,,1580342516.0
17,"LPT: When making coffee from beans you grind straight from the freezer, don't add hot water immediately, as that will shock it and cause a bitter flavor. Add a little warm or tepid water to the grounds first to temper them, wait a few seconds, and then add your hot water.",6,evnld8,LifeProTips,https://www.reddit.com/r/LifeProTips/comments/evnld8/lpt_when_making_coffee_from_beans_you_grind/,6,,1580336998.0
18,"LPT: When having character building conversations with your kids, sit down with them and slice an orange. As they grow, that smell will trigger memories of your life lessons.",74,evmx2i,LifeProTips,https://www.reddit.com/r/LifeProTips/comments/evmx2i/lpt_when_having_character_building_conversations/,28,,1580333573.0
19,"LPT: If you struggle to wake up and get moving in the morning, buy a stress ball or grip strengthener",8610,evm0xz,LifeProTips,https://www.reddit.com/r/LifeProTips/comments/evm0xz/lpt_if_you_struggle_to_wake_up_and_get_moving_in/,550,"I have chronic anemia and ever since I was a little kid, I have never known the feeling of ""waking up rested"". Friends of mine describe waking up and immediately having the energy to jump out of bed. It is always a slow crawl for me to eventually muster the energy and drag myself out.

Last week I bought a grip strength trainer to strengthen my hands and left it on my nightstand. This morning, in my stupor, I decided to put a few rounds into it half-asleep. To my great surprise, I was wide away within 10-15 minutes from this simple act of exertion getting the blood flowing. 

Try it!! It's brainless and all you do is squeeze your hand a bit which pretty much anyone should be able to do! A stress ball should also prove to be an effective alternative

Edit: A couple of things to add, the anemia in question is a genetic mutation called thalassemia. It is the result of a blood mutation that causes my hemoglobin to decompose at an abnormal rate, thus hindering my blood's ability to deliver oxygen to the rest of my body.

While this was the first time I tried this, I posted to LPT because the effect was SO noticeable over everything else I've done to try and alleviate the morning fatigue. Memory foam mattress, getting to sleep earlier, morning wank, sleeping pills, melatonin, all these had a marginal effect if any at all. But today, BAM. I was up and moving around with no issues at all. I'll continue to trial this and keep you posted. I hope that others have success with this tip!",1580328438.0
20,LPT: can’t find your glasses without your glasses? Open your phone camera and look around using that.,9,evlyfy,LifeProTips,https://www.reddit.com/r/LifeProTips/comments/evlyfy/lpt_cant_find_your_glasses_without_your_glasses/,6,"If you are short sighted you can hold the phone close to your face so you can see the screen, and the phone will show what’s around you much more clearly!",1580328018.0
21,LPT Don't pay an additional fee to file US State taxes using popular software,39,evlotq,LifeProTips,https://www.reddit.com/r/LifeProTips/comments/evlotq/lpt_dont_pay_an_additional_fee_to_file_us_state/,15,"Tax time is here in the US and many people use software like Turbo Tax. The most basic income situations for young people are free to file, but for most adults, the Basic or Deluxe version is required. They sell for $29, $39+, figure out your federal and state tax, but then charge you an additional fee at the end to actually file your state return. Don't do that. 

You can go to your state's website (it'll be listed on the state's .gov site) and fill out your tax return directly. You have the amount of your refund/payment shown from the turbo tax software, so go through the steps on the state website. There are help and faq links along the way. If you come up with the same amount due/owed, you've done it correctly and can file the state return there for free. Delete the state return on turbo tax, don't pay to file it. It may seem intimidating, but you may surprise yourself. If you're a basic working adult or homeowner without a small business, it's pretty straightforward.

Edit: You can actually file your federal taxes for free directly on irs.gov also, But people willing/able to do that without software assistance already know that. You'd have to have a firm grasp on tax procedure and basic tax law.",1580326231.0
22,LPT: You can track the progress of Coronavirus 2019-nCov on an interactive map,23,evlmqh,LifeProTips,https://www.reddit.com/r/LifeProTips/comments/evlmqh/lpt_you_can_track_the_progress_of_coronavirus/,3,"As the title says, you can open an interactive map and track in (semi?)  real-time where and how many cases of Coronavirus 2019-nCov are   recorded. Link: [https://gisanddata.maps.arcgis.com/apps/opsdashboard/index.html#/bda7594740fd40299423467b48e9ecf6](https://gisanddata.maps.arcgis.com/apps/opsdashboard/index.html#/bda7594740fd40299423467b48e9ecf6)",1580325846.0
23,LPT: you can hold down the space bar when typing on an iphone to move the cursor around.,78,evlccs,LifeProTips,https://www.reddit.com/r/LifeProTips/comments/evlccs/lpt_you_can_hold_down_the_space_bar_when_typing/,19,,1580323778.0
24,"LPT: If you buy a car and live in an urban area, you should trigger it's alarm so then you know how your car sounds like.",18,evkyz8,LifeProTips,https://www.reddit.com/r/LifeProTips/comments/evkyz8/lpt_if_you_buy_a_car_and_live_in_an_urban_area/,5,,1580321058.0
25,"LPT: If you sell your computer, be sure to save all your important data and format it before passing it, data doesnt magically disappear when moving to a new onwer..",11,evkej3,LifeProTips,https://www.reddit.com/r/LifeProTips/comments/evkej3/lpt_if_you_sell_your_computer_be_sure_to_save_all/,12,"Save your passwords you might have in your chrome browser or in a text file, save all your pictures, documents, music, license keys and so on. Then format your drives. If you dont know how to format a drive, google it up or ask somebody in the right subreddit (computers)  
As mentioned in the title already, computer data doesnt just magically disapper when you sell your system.",1580316708.0
26,"LPT: If an online job offer seems to good to be true, it probably is. Shoot the official website an email to confirm legitimacy before disclosing information. More often than not work from home companies are a scam.",57,evjew7,LifeProTips,https://www.reddit.com/r/LifeProTips/comments/evjew7/lpt_if_an_online_job_offer_seems_to_good_to_be/,8,I’ve been scammed by companies coming to me with fantastic offers multiple times in the past month alone. You’d think I’d have learned by now haha. The thing is most beginner online/work at home jobs are not going to pay you $30+ an hour. Many companies will actually be a fake company posing as a legitimate company to make you feel secure. I recently got an offer and interview from a “legit company” that I was excited for. I sent the company an email to confirm because I was suspicious of a scam and lo and behold it was. I’ve run into this multiple times. Stay safe. :),1580310066.0
27,LPT for iPhone charging cables that are loose. Use a paper clip to clean out the charging port.,1,evj8yb,LifeProTips,https://www.reddit.com/r/LifeProTips/comments/evj8yb/lpt_for_iphone_charging_cables_that_are_loose_use/,4,"So both my iPhones were having the same issue. When I put in the cable to charge them they were just falling out. The phones are about 3 Years old so they work fine otherwise. 

I bought an expensive third party cable and was pretty upset that it wasn't working properly any longer. Then I noticed the cable was sitting at an angle and decided to inspect the inside of the charging port. 

After scraping around in there with a paper clip, I pulled out enough lint and fluff to start a small fire as kindling. It was all compacted in there. 

Note - it wasn't visible when I looked in with a torch. 

So if you keep your phone in your pocket, clean out your charging port. It may save you a trip to the repair shop or having to get a new cable for nothing.",1580309073.0
28,"LPT: If you are doing laundry offsite at your local laundromat make sure to give the inside of the front loading machine a quick spin to ensure all garments, hosiery etc. are completely removed before using the dryer.",6,evj33q,LifeProTips,https://www.reddit.com/r/LifeProTips/comments/evj33q/lpt_if_you_are_doing_laundry_offsite_at_your/,3,,1580308082.0
29,LPT: Eating with someone you want to make a favorable impression on? Use your napkin often.,12,evim7c,LifeProTips,https://www.reddit.com/r/LifeProTips/comments/evim7c/lpt_eating_with_someone_you_want_to_make_a/,5,"Good bet that the person you're with won't let you know when you have food on your face. 

Also, if you take smaller bites, there's less risk of food on your face.",1580305349.0
30,"LPT: When in a foreign country and you are unfamiliar with the new currency, don't ever say ""keep the change"" after a purchase.",0,evhqfs,LifeProTips,https://www.reddit.com/r/LifeProTips/comments/evhqfs/lpt_when_in_a_foreign_country_and_you_are/,13,"It's easy to mess up a conversion in your head and you may accidentally end up tipping way more than you expected. If you want to tip, get your change back first and then hand them a tip only after making sure it's for the amount you want. This is mainly applicable to third world countries.",1580300705.0
31,"LPT: Before asking a question to someone, ask yourself if you could get the information you’re looking for from Google. That’s a way of showing respect for other people’s time that will also prevent you from sounding stupid.",122,evhn7z,LifeProTips,https://www.reddit.com/r/LifeProTips/comments/evhn7z/lpt_before_asking_a_question_to_someone_ask/,62,,1580300249.0
32,"LPT: Keep a simple spreadsheet of all work done or purchases for your car (mileage, date, short description) even if you're the type to keep all paperwork. Even if you don't work on your own car, being able to tell a handy friend or mechanic a brief history of service can be immensely valuable.",11,evhja6,LifeProTips,https://www.reddit.com/r/LifeProTips/comments/evhja6/lpt_keep_a_simple_spreadsheet_of_all_work_done_or/,4,,1580299677.0
33,"LPT If you're thinking of buying a house and want information about the neighborhood, talk with the postal worker.",25,evhcs1,LifeProTips,https://www.reddit.com/r/LifeProTips/comments/evhcs1/lpt_if_youre_thinking_of_buying_a_house_and_want/,8,"It's unlikely the postal worker lives in the neighborhood, but even if they do their insight can be invaluable. When buying our house, I spoke with the postman and learned about our street, and several blocks in various directions. He advised where to avoid walking our dog (because of off roaming animals), which streets were safer for children (had less traffic), and told us where he'd seen packages stolen and cars burglarized.

I've asked advice previously of postal workers that walk the neighborhood and from those who remain in their car. Both have been helpful and unbiased. They won't sugar coat what a realtor might, and they see that same area day after day.",1580298785.0
34,"LPT: If you are learning a language, read everything in the version of that language whenever you can.",12,evh1go,LifeProTips,https://www.reddit.com/r/LifeProTips/comments/evh1go/lpt_if_you_are_learning_a_language_read/,5,"I’m trying to learn Spanish, and I read labels, road signs, directions, and everything in between in the Spanish version. The English version is right next to it, which helps with confusion. Not only does it expand vocabulary and improve reading comprehension, but it has helped me understand grammar rules (like when to use por/para).",1580297237.0
35,LPT: Pick up littered Marlboro boxes and enter the code inside online to earn points for prizes and look like a model citizen cleaning up litter in the process,5,evgfxz,LifeProTips,https://www.reddit.com/r/LifeProTips/comments/evgfxz/lpt_pick_up_littered_marlboro_boxes_and_enter_the/,6,"LPT: Collect littered Marlboro boxes & enter the codes inside online to earn free prizes and look like a model citizen cleaning up litter while you’re at it

la way to clean up litter and get a little gift for it. 

on the inside flap of a pack of marlboro cigs, there’s a little tab that has a code on it you can pull out and enter online to get points to spend on a variety of things. like zippos, bags, hats, bluetooth speaker, visa gift cards, etc. 

i smoke, not marlboro, but i’ll be outside having a cig and i’ll see littered marlboro boxes, so i gather codes that way - and it’s makes me look like a good citizen cleaning up litter. I usually do end up cleaning up everything in the area i’m grabbing codes. i have a box of latex gloves in the car i use for when i change oil and those work perfect 

I just type the code numbers down in the notepad app on my phone and enter them later so i’m not carrying around 20 of these little strips.",1580294350.0
36,"LPT: if you get a new tattoo, cut your finger nails a few days after. It will help you from scratching too hard and picking as it heals.",8,evg83g,LifeProTips,https://www.reddit.com/r/LifeProTips/comments/evg83g/lpt_if_you_get_a_new_tattoo_cut_your_finger_nails/,6,,1580293358.0
37,"LPT Does your house have an odor that you can't figure out where it's coming from? Your sink, your carpets, your curtains/drapes, and the inside of your oven may be four of the hidden culprit's.",30,evfvsi,LifeProTips,https://www.reddit.com/r/LifeProTips/comments/evfvsi/lpt_does_your_house_have_an_odor_that_you_cant/,13,,1580291793.0
38,"LPT: Set your phone lock screen to an image including an alternative phone number, with a message reading ""Please call if found""",9,evfpsv,LifeProTips,https://www.reddit.com/r/LifeProTips/comments/evfpsv/lpt_set_your_phone_lock_screen_to_an_image/,9,"Assuming you have a pincode or fingerprint lock, this will give someone a way to contact you directly. It should make it a lot easier for an upstanding citizen to contact you!",1580291026.0
39,"LPT: If you don't have your glasses and can't look far away, try using your cellphone camera to zoom in and get a better view.",11,evfb55,LifeProTips,https://www.reddit.com/r/LifeProTips/comments/evfb55/lpt_if_you_dont_have_your_glasses_and_cant_look/,6,,1580289207.0
40,"LPT: Keep a ""karaoke songs"" list on your phone. Whenever you find yourself singing along to a song, add it to your list. Next time you sing karaoke, you'll amaze your friends with your great song selections.",119,evepsd,LifeProTips,https://www.reddit.com/r/LifeProTips/comments/evepsd/lpt_keep_a_karaoke_songs_list_on_your_phone/,28,,1580286656.0
41,LPT: keep a visa/ mastercard with a few cents on to sign up for ‘free’ trials,7,evekvl,LifeProTips,https://www.reddit.com/r/LifeProTips/comments/evekvl/lpt_keep_a_visa_mastercard_with_a_few_cents_on_to/,2,,1580286103.0
42,LPT: Always write your account/policy number on a check when you are paying a bill or investing money,18,eved9c,LifeProTips,https://www.reddit.com/r/LifeProTips/comments/eved9c/lpt_always_write_your_accountpolicy_number_on_a/,7,"Put the intended account number in the memo line, even if you're just paying a bill (like the car insurance bill I'm paying right now) that has the invoice along with it. Invoices can get separated from checks, this way there's no question about where the money is supposed to go. Also I used to work in financial services and I've seen what can happen if you don't do this as checks can get lost, or worse, deposited into the wrong account. This gives you leverage if nothing else.",1580285211.0
43,"LPT: When working on a research paper on Word, fill out the info on Add References and you'll easily be able to add citations to your RRL and a bibliography",16,evdzf2,LifeProTips,https://www.reddit.com/r/LifeProTips/comments/evdzf2/lpt_when_working_on_a_research_paper_on_word_fill/,15,,1580283604.0
44,"LPT: If you can't open a pistachio, use the shell of an already opened one as a lever in the crack for easy opening.",24,evcmy1,LifeProTips,https://www.reddit.com/r/LifeProTips/comments/evcmy1/lpt_if_you_cant_open_a_pistachio_use_the_shell_of/,9,,1580278382.0
45,LPT: stick a small piece of coloured tape or paint to the top side of a usb stick/cable. Never struggle with which way it goes in again.,14,evclis,LifeProTips,https://www.reddit.com/r/LifeProTips/comments/evclis/lpt_stick_a_small_piece_of_coloured_tape_or_paint/,14,,1580278235.0
