,title,score,id,subreddit,url,num_comments,body,created
253,"LPT: Need to know what day was exactly # days ago quickly- with no calendar? Google “{#} days ago” and It will return the exact date. This works for future date inquiries too, “{#} days from now”. Go on, try it!",21,eta7f2,LifeProTips,https://www.reddit.com/r/LifeProTips/comments/eta7f2/lpt_need_to_know_what_day_was_exactly_days_ago/,14,"An example search: “45 days now” returns March 9, 2020- that’s when your wife will leave you!! Exciting, right?",1579900211.0
254,LPT Win key + shift + s = snipping tool,6098,et9lz3,LifeProTips,https://www.reddit.com/r/LifeProTips/comments/et9lz3/lpt_win_key_shift_s_snipping_tool/,264,"Then just paste into mail, document etc.  

EDIT: A lot recommend Greenshot, lightshoot and ShareX. I have not tried any of these, but I will give them a try next week.  But for everyone not wanting to download a program, this shortcut still cuts a lot of time.",1579896804.0
255,"LPT: When driving after a bus in local roads (very tight and with several curves) always imagine that you have one or two cars between yours and the bus, this will allow you to visualize the oncoming traffic and the whole road and let you decide the best moment to overtake the bus without any risks.",7,et8d42,LifeProTips,https://www.reddit.com/r/LifeProTips/comments/et8d42/lpt_when_driving_after_a_bus_in_local_roads_very/,5,"There are several buses on local roads and because they're always stopping by the bus stops you may need to overtake it to reach faster to your destination, just by keeping distance you'll ensure that you take the best opportunities to overtake the bus in safety.

I always use this technique.",1579888922.0
256,"LPT: When selling your house, have the title company wire the money to your bank.",24,et82e8,LifeProTips,https://www.reddit.com/r/LifeProTips/comments/et82e8/lpt_when_selling_your_house_have_the_title/,7,"A check from the title company can take 7 to 10 days to clear and your money becomes available. 

Yesterday I sold my house and the wired money was in my bank account and available to spend/invest just 30 minutes after the title company wired out the money.",1579886687.0
257,"LPT: Never buy things for the sake of someone else, even if it is family member, unless it'a gift.",3,et7r6r,LifeProTips,https://www.reddit.com/r/LifeProTips/comments/et7r6r/lpt_never_buy_things_for_the_sake_of_someone_else/,4,My brother got me to buy a lamp for his girlfriend. I bought it with my credit card. My brother literally the same day we retrieved the lamp told me to go to the store for refund because his GF didn't like it. I don't see my refund in my card so I need to go through process. I believe this LPT can also apply for other chores.,1579884387.0
258,LPT: do not recycle used pizza boxes,176,et7fxh,LifeProTips,https://www.reddit.com/r/LifeProTips/comments/et7fxh/lpt_do_not_recycle_used_pizza_boxes/,48,"Talked to a fellow man who works for the trash and sanitation department, he told me people recycle old pizza boxes full of grease and food containments that can ruin an entire dumpster of recycled goods.",1579882055.0
259,LPT: Say Thank You to highlight an action you value not an extraordinary action,14,et7cwd,LifeProTips,https://www.reddit.com/r/LifeProTips/comments/et7cwd/lpt_say_thank_you_to_highlight_an_action_you/,2,,1579881460.0
260,"LPT: If an insurance company declined your claim, a telecom company messes you about or a financial provider lied to you, don't accept their final decisions. There are governing bodies out there that you can escalate your complains to get them resolved, most time in your favor",55,et76kv,LifeProTips,https://www.reddit.com/r/LifeProTips/comments/et76kv/lpt_if_an_insurance_company_declined_your_claim_a/,3,They are called Ombudsman in Australia - unsure what they are called in your countries.,1579880254.0
261,"LPT: If you have swollen your own vomit, drink fresh milk.",0,et6zfy,LifeProTips,https://www.reddit.com/r/LifeProTips/comments/et6zfy/lpt_if_you_have_swollen_your_own_vomit_drink/,7,It actually works. Drinking water barely does the job. Milk clears your throat much better than any other drink.,1579878935.0
262,"LPT: If you are moving/mailing fragile objects, ask your local grocery store for old ads.",5,et6j9j,LifeProTips,https://www.reddit.com/r/LifeProTips/comments/et6j9j/lpt_if_you_are_movingmailing_fragile_objects_ask/,3,"Especially if you go the day their ad changes for the week, they usually have plenty of extras they need to throw away and would be more than happy to give you some.",1579876159.0
263,"LPT: Since you're browsing Reddit right now, you're probably not busy; Perfect time to cancel those subscriptions you've been procrastinating.",126,et6j25,LifeProTips,https://www.reddit.com/r/LifeProTips/comments/et6j25/lpt_since_youre_browsing_reddit_right_now_youre/,23,"Just canceled about $40 a month in subscriptions ~~, basically giving myself a $1 raise after taxes.~~ Thank me later.

&#x200B;

Edit: I'm bad at math. extra $40 a month is still good tho",1579876123.0
264,"LPT: If you drive a modern car with a manual transmission only de-clutch below 1300 rpm when slowing down, modern cars don’t use any fuel when engine braking, putting it in neutral prematurely wastes gas",10,et6gqu,LifeProTips,https://www.reddit.com/r/LifeProTips/comments/et6gqu/lpt_if_you_drive_a_modern_car_with_a_manual/,3,Source-Volkswagen eco-tips,1579875724.0
265,LPT: Don’t waste your money on a diamond ring. Moissanite and even Cubic Zirconia are beautiful and no regular person can tell the difference.,100,et67o8,LifeProTips,https://www.reddit.com/r/LifeProTips/comments/et67o8/lpt_dont_waste_your_money_on_a_diamond_ring/,48,"I have a real diamond ring that my mom gave me after her divorce. I used it for a while when I got married but honestly I preferred a bigger stone. I have 3 non-diamond rings that look real to the average eye, and fit my style much better. The benefits are worth it:

1. The most expensive ring I wear was $25 (all cubic zirconia). So you’re not going to go in debt for it and you can afford a bigger stone if you want one. 

2. If the ring gets lost or stolen it’s not as big of a loss.

3. If you get tired of the style you can easily buy a new one.

4. If you go the lab-created diamond way, they have better color and clarity and are still less expensive than earth diamonds. 

5. Your stone will no doubt be conflict free. 

There are probably more points I haven’t thought of, but you probably get the idea.",1579874244.0
266,LPT practice healthy procrastination. If you are not in a mood of doing something right now just postpone it for sometime/someday later. BUT specifically mention the date/time when you plan to do it. When the time comes your brain will already prepared itself by then.,36,et67bj,LifeProTips,https://www.reddit.com/r/LifeProTips/comments/et67bj/lpt_practice_healthy_procrastination_if_you_are/,3,I'm busy right now so thank me later.,1579874179.0
267,"LPT: Open ended invites go a long way. Instead of asking a new friend if they can or can't do something, let them know what you're doing and tell them that they are welcome to join if they would like to. No pressure.",1440,et5xxb,LifeProTips,https://www.reddit.com/r/LifeProTips/comments/et5xxb/lpt_open_ended_invites_go_a_long_way_instead_of/,77,"I've been extended invitations to things, so many times, where the person inviting me seems to want an immediate yes or no. As an introverted person, this puts me in a difficult position. I've ignored phone calls in the past because of the anxiety that comes with immediate expectations. Instead of, ""can you meet me at O'Neill's on Friday night?"" try, ""I'm going to O'Neill's Friday night. If you would like to join me, that would be great!"" It gives us introverts some time to think over the situation and make an honest decision.",1579872669.0
268,LPT: Easier to type 90 on your microwave than 1:30,46,et5tob,LifeProTips,https://www.reddit.com/r/LifeProTips/comments/et5tob/lpt_easier_to_type_90_on_your_microwave_than_130/,30,"If I'm already lazy enough to microwave, no chance I'm hitting 3 buttons when I could hit 2",1579871993.0
269,LPT: Download all your University PowerPoint lectures for all subjects throughout our schooling,43,et5t5k,LifeProTips,https://www.reddit.com/r/LifeProTips/comments/et5t5k/lpt_download_all_your_university_powerpoint/,5,"These lectures are made by academics - masters and PHD professors. You never know when they may come in handy when you start off in the profession you’ve studied for. Plus, it’ll never hinder, it will only help you.",1579871908.0
270,"LPT: When you’re sick and suffer tissue burns from a runny nose, just apply a post-sunburn lotion and your nose will be as good as new!",23,et5kb2,LifeProTips,https://www.reddit.com/r/LifeProTips/comments/et5kb2/lpt_when_youre_sick_and_suffer_tissue_burns_from/,14,I’m get colds often and always got bothered by how painful my nose gets from tissue burns (+ looks so unattractive with the peeling and all) tried a sample of the LaRoche Posay posthelios melt in gel and it worked wonders. Never suffered from embarrassing tissue burns since 😁,1579870537.0
271,LPT Always choose a credit union over a bank when possible.,72,et5au3,LifeProTips,https://www.reddit.com/r/LifeProTips/comments/et5au3/lpt_always_choose_a_credit_union_over_a_bank_when/,49,"Credit unions have better benefits then banks. No daily minimums, less late fews, fewer random charges, better and more personalized service, better communication, variety of discounts through businesses they work with. Plus a lot of credit unions will give you back ATM fees other banks have charged you.",1579869087.0
272,"LPT: Have a heavy bag at home and tired of the loud noise from the typical chains used for hanging them? Go to a parts or hardware store and buy a 1"" polyester lifting sling and a few shackles to replace the chain. Peace and quiet.",0,et5908,LifeProTips,https://www.reddit.com/r/LifeProTips/comments/et5908/lpt_have_a_heavy_bag_at_home_and_tired_of_the/,9,,1579868803.0
273,"LPT: When you wake up for work in the morning, start your GPS. You'll know exactly how long you have to get ready and if there's any unexpected traffic delays.",6,et55cv,LifeProTips,https://www.reddit.com/r/LifeProTips/comments/et55cv/lpt_when_you_wake_up_for_work_in_the_morning/,3,,1579868249.0
274,"LPT: If you have forgotten people’s numbers due to ease of contacts, write important numbers down on a piece of paper and put it in your phone case/wallet in case your phone dies.",53,et4uaw,LifeProTips,https://www.reddit.com/r/LifeProTips/comments/et4uaw/lpt_if_you_have_forgotten_peoples_numbers_due_to/,12,,1579866652.0
275,"LPT: Do not remove the tags of your new clothes until you actually wear them for the first time - they’re worth more if you don’t ever use and want to resell them, or you might notice imperfections later.",0,et4uan,LifeProTips,https://www.reddit.com/r/LifeProTips/comments/et4uan/lpt_do_not_remove_the_tags_of_your_new_clothes/,1,,1579866650.0
276,"LPT: trying to help someone on r/suicidalthoughts or r/depression but don’t know what to say? Go to OP’s profile and reply to some of their comments on other subs, saying something nice. Sometimes even the smallest bit of positivity can save a life.",2471,et4imk,LifeProTips,https://www.reddit.com/r/LifeProTips/comments/et4imk/lpt_trying_to_help_someone_on_rsuicidalthoughts/,60,,1579865004.0
277,LPT: Keep your phone brightness low,3,et4bd5,LifeProTips,https://www.reddit.com/r/LifeProTips/comments/et4bd5/lpt_keep_your_phone_brightness_low/,6,I don’t know if this has been said before but Try to keep your brightness down it’s a lot easier on the eyes and reduces battery loss. (Your eyes will most likely adjust in no more then 30 minutes),1579863981.0
278,"LPT: If your kids keep losing something like their water bottle, lunch bag, etc after school assign it a name. Wanda the water bottle. Larry the lunch box. Once it has a name it becomes more than an object and they are more likely to make sure it makes it home.",593,et46v7,LifeProTips,https://www.reddit.com/r/LifeProTips/comments/et46v7/lpt_if_your_kids_keep_losing_something_like_their/,38,,1579863373.0
279,"LPT: don't buy muted dark luggage as most people do and its hard to spot your gear on a carousel, top of a bus, on the back of a runner. Get bright lime green or the like",49,et43x4,LifeProTips,https://www.reddit.com/r/LifeProTips/comments/et43x4/lpt_dont_buy_muted_dark_luggage_as_most_people_do/,13,"I recently started using a insanely bright green duffel bag. Took a flight and noticed it being driven to the plane, loaded, unloaded and immediately when it was put on the luggage carousel.",1579862995.0
280,LPT Request: How to rehydrate a dehydrated kitten?,15,et3v10,LifeProTips,https://www.reddit.com/r/LifeProTips/comments/et3v10/lpt_request_how_to_rehydrate_a_dehydrated_kitten/,21,"6 AM in the morning, unfortunately, no available vets at this time so we're hoping to find information because one of our kitties is lying on her side and won't get up or atleast meow to us. She's still breathing and tilting her head side ways when being lifted. We already gave her water through a syringe (no needle) but it doesn't seem to improve her condition.",1579861767.0
281,"LPT: When asked a question that's uncomfortable or hard to answer, it's best to respond with ""Let me think about that and get back to you"" instead of immediately committing to a response",240,et3tbd,LifeProTips,https://www.reddit.com/r/LifeProTips/comments/et3tbd/lpt_when_asked_a_question_thats_uncomfortable_or/,29,"A lot of times in conversations with a boss, co-worker, or report of mine (hell even my wife sometimes)  I get asked a question and the answer could potentially have consequences. 

The initial urge is always to throw out what I think is the best answer at the moment so as not to look dumb. What I have found is quite the opposite. You build much more trust and reputation by simply asking for some time to think about it or to find the answer and get back to them.

Half the time the person will forget they even asked you, the other half the time if I get back to them later with a solid answer which builds even more trust",1579861537.0
282,"LPT: If you're switching to a new veterinarian, consider getting pet insurance before switching. It's possible your new vet will diagnose issues your old vet didn't.",18,et3dpz,LifeProTips,https://www.reddit.com/r/LifeProTips/comments/et3dpz/lpt_if_youre_switching_to_a_new_veterinarian/,1,"When we moved houses, our new vet found issues with our 3 cats (ages 6, 4, 4) that needed correcting. We hadn't gotten pet insurance because we had decided to self insure, but had we gotten insurance even for that year, we would have saved thousands in procedures that we and the new vet found necessary for our cats' health. You can always cancel and self-insure later.",1579859468.0
283,"LPT: If you have an ingrown nail, using dental floss will help.",58523,et2txr,LifeProTips,https://www.reddit.com/r/LifeProTips/comments/et2txr/lpt_if_you_have_an_ingrown_nail_using_dental/,2336,"Doctor showed me this the other day. You slide dental floss under the nail as far as possible and leave a piece on both sides hanging. This will alleviate the pressure and a lot of the pain and after a few days (taking care to change it daily) your nail will start to grow upwards and out of your skin.

Edit: [visual](https://i.redd.it/39j841pg0oc41.png) Courtesy of u/errorcache

Edit 2: Some people only go under the corner that the ingrown is on, it’s a preference thing. Also you just need to put it under the white part of the nail, as well as you can.",1579856922.0
284,LPT: Want to come across as a consummate professional in your chosen profession? Remember the people who you regularly deal with's first and last names and always greet them by their first name.,17,et20xw,LifeProTips,https://www.reddit.com/r/LifeProTips/comments/et20xw/lpt_want_to_come_across_as_a_consummate/,4,"I have worked 20+ odd years in retail and no matter what, I always make it a point to remember the names of people I constantly work with so that when I see them again, if they're not coworkers, to say their name when I see them again.

It makes a good impression every single time with said person and impresses my bosses and coworkers.",1579853230.0
285,"LPT: If you use Google’s services often, set it up so that when you pass away your loved ones can view photos of you enjoying life",22,et1t36,LifeProTips,https://www.reddit.com/r/LifeProTips/comments/et1t36/lpt_if_you_use_googles_services_often_set_it_up/,4,"
If you follow this [link](https://myaccount.google.com/inactive?pli=1), after Google deems that you have been inactive on the account for a long enough period, it can send certain data such as your photos, notes (Keep) and Google drive documents ( as long as it’s not too NFSW)

It can really help your parents suffer less if they see photos of you happy with your friends, or your r/dankchristianmemes.

They may not have many photos of you if you moved away, and it can make the world of difference. 

Please, plan ahead and try and care for your close friends and family after you are gone as much as possible.",1579852254.0
286,LPT: Don’t ever pay for expensive water bottles in hotel rooms. 99.9% of hotels have water dispensers in the gym - bring an empty bottle and fill up there.,57,et1nn8,LifeProTips,https://www.reddit.com/r/LifeProTips/comments/et1nn8/lpt_dont_ever_pay_for_expensive_water_bottles_in/,8,"If you don’t feel comfortable drinking the tap water, just bring your own water bottle(s) and fill up in the hotel gym (there’s almost always a filtered water dispenser there); never pay $8+ for the hotel room water bottles.",1579851598.0
287,LPT: Add your sweetener/creamer to the coffee mug before pouring in the coffee (A) to avoid needing a stirrer since the coffee will naturally mix the additives and (B) to better track the amount of sweetener/creamer you are using each time.,57,et1d8a,LifeProTips,https://www.reddit.com/r/LifeProTips/comments/et1d8a/lpt_add_your_sweetenercreamer_to_the_coffee_mug/,24,"If sugar is your sweetener, then this tip may not be sufficient to preempt the need for a stirrer because sugar doesn't dissolve as quickly as other sweeteners.

The tracking of the sweetener/creamer is more difficult when it is being dispensed from a large container rather than the little individual packages.",1579850311.0
288,"LPT: If you have trouble falling asleep at night, try using a guided meditation app. Even if it doesn't work, you've at least gotten some peaceful meditation time in.",51,et17gq,LifeProTips,https://www.reddit.com/r/LifeProTips/comments/et17gq/lpt_if_you_have_trouble_falling_asleep_at_night/,11,"I also recommend keeping your phone far enough away so that even when the guided meditation ends, you are more likely to continue the peaceful meditation on your own (rather than grabbing your phone to play on it) to help you fall asleep completely.

I've been following this tip a lot lately, and the sleep I get when I fall asleep this way is far more sound than when I watch videos or listen to podcasts to help me fall asleep.",1579849636.0
289,"LPT: On iPhone, if you find that you can’t reduce the screen brightness as much as you’d like, go into ‘Settings’ - ‘Accessibility’ and turn on ‘Zoom’. This reduces your screen brightness considerably.",12,et0y60,LifeProTips,https://www.reddit.com/r/LifeProTips/comments/et0y60/lpt_on_iphone_if_you_find_that_you_cant_reduce/,3,,1579848616.0
290,LPT: use closed captions,443,et0vbc,LifeProTips,https://www.reddit.com/r/LifeProTips/comments/et0vbc/lpt_use_closed_captions/,136,"My life has improved significantly since I started putting English subtitles on all the English programming I watch. It's great for shows or movies where people have accents that are different from yours, but it also makes it much easier to follow along with the plot of complex shows. Plus, sometimes you end up getting little hints of dialogue or sound effects that you might not otherwise have caught that are significant to the plot. 


I first started doing this with the show The Wire because I honestly couldn't understand what half the characters were saying. Baltimore accents are wild and awesome.",1579848276.0
291,"LPT: if you press a metal object(watch, keys, etc) to the door handle before touching it with your hands, you won’t get shocked.",12,et0ewu,LifeProTips,https://www.reddit.com/r/LifeProTips/comments/et0ewu/lpt_if_you_press_a_metal_objectwatch_keys_etc_to/,1,,1579846373.0
292,LPT: If your married or permanently living with someone. You can use their income as well as your own to increase your total available credit and credit score,3,et0bji,LifeProTips,https://www.reddit.com/r/LifeProTips/comments/et0bji/lpt_if_your_married_or_permanently_living_with/,3,"""**Household income and credit card applications**

The Credit Card Act of 2009 requires credit card companies to take “the ability of the consumer to make the required payments” into account when deciding whether to approve an application.

A 2013 amendment to the federal regulations surrounding the Card Act expanded the definition of one’s ability to pay so that people 21 and older can include any income to which they have a “reasonable expectation of access.” This can include income from a spouse, partner or other member of your household. It can also include nonwage income such as savings, trust fund distributions, unemployment compensation and others.

However, people under 21 must still be able to show that they have independent income to qualify for a credit card. If they don’t have independent income, they must have a co-signer.""

https://www.nerdwallet.com/blog/credit-cards/list-spouses-income-applying-credit-card/ 




issuers consider the consumer’s independent ability to pay for applicants who are 21 or older, and permits issuers to consider income and assets to which such consumers have a reasonable expectation of access.

https://files.consumerfinance.gov/f/201304_cfpb_credit-card-ability-to-pay-final-rule.pdf",1579845995.0
293,LPT Request: How to get rid of nail polish smell,4,eszuu0,LifeProTips,https://www.reddit.com/r/LifeProTips/comments/eszuu0/lpt_request_how_to_get_rid_of_nail_polish_smell/,13,My business shares a wall with a nail salon and we get the nail salon smell coming through our walls sometimes. Does anyone have a LPT for neutralizing the smell? Thanks in advance!,1579844049.0
294,LPT fellow men: you don't need to be super beatiful or sexy to be attractive. You need to things: 1. The abillity to defend yourself 2. The abillity to care for yourself.,0,eszljo,LifeProTips,https://www.reddit.com/r/LifeProTips/comments/eszljo/lpt_fellow_men_you_dont_need_to_be_super_beatiful/,5,"This is just the sum up of my experience and knowledge, don't take it for granted, but it helped me decenty.

1: the abillity to defend yourself comes down to your fitness, body language and means of fighting. It doesn't mean that you should be a douche who wants to beat someone, it means you have to stand strong and don't let anyone push you around. Learn using dominant posture, hit the gym or sth. Honestly for me, martial arts' lessons improved them all at once.

2: the abillity to care for yourself consits of general health and hygiene, clothing/accesories
 and economic status (let's not lie to ourselves, it really changes your outlook). This may sound weird at first, but it made sense to our ancestors - if you can care for yourself, you can care for your partner. And so, this is very important and also easily improvable: shower everyday, get a stylish haircut, buy some fitting clothes, ect. Economic status isn't as easy to improve though, but sertain finacial decisions do make a difference.

Well, this turned into hell of an essay, hope it helps.",1579842994.0
295,LPT: In need of a jump start? Call a taxi!,32,esvn75,LifeProTips,https://www.reddit.com/r/LifeProTips/comments/esvn75/lpt_in_need_of_a_jump_start_call_a_taxi/,12,"They’ll be more than happy to make a one way trip and jump start you as long pay them. I usually give £10 to the taxi drivers, done this twice with both being left happy! Especially helpful if no friends or family near by.

Edit: carry your own jumper cables obviously",1579826482.0
296,LPT: NEVER solely rely on a cheat sheet to pass. Study properly. An exam with a cheat sheet is likely harder that one without.,7,esug4p,LifeProTips,https://www.reddit.com/r/LifeProTips/comments/esug4p/lpt_never_solely_rely_on_a_cheat_sheet_to_pass/,6,,1579821341.0
297,LPT Request: Donating Clothing,12,esu9af,LifeProTips,https://www.reddit.com/r/LifeProTips/comments/esu9af/lpt_request_donating_clothing/,23,"Living in the US, did some closet cleaning and have a bunch of clothes to get rid of. Some pretty nice clothes, some designer stuff, etc. Local thrift shop couldn't take a lot of it though, as it's too old. No worries, happy to donate it for free, but here is my concern -- if I'm giving the clothing away for free, I want the eventual recipient (presumably a person in need) to *get* the clothing for free. At GoodWill, I give the clothing for free, but then someone has to pay for them. It doesn't seem right! It's one thing if someone is basically paying me for my clothes, but if I want to do something charitable and truly give them away, surely there must be a way that the people in need don't have to pay to receive them. Even those drop-off bins apparently tend to auction the clothes off as a lot by weight.

Where can I donate my clothes so that the eventual recipients will truly get them free?",1579820507.0
