,title,score,id,subreddit,url,num_comments,body,created
484,"LPT if you're thinking about moving to a new neighborhood and want to find out how the people there are, join a Facebook group for said neighborhood.",4,erjuox,LifeProTips,https://www.reddit.com/r/LifeProTips/comments/erjuox/lpt_if_youre_thinking_about_moving_to_a_new/,4,"Moved to a new neighborhood this summer, and joined a FB group out of curiosity. Plenty of helpful posts, but quite a few nutters too. It's very informative, people love peeping out their windows and post it in the group....",1579583879.0
485,LPT: one of the buttons on a gas pump turns off the sound for ads.,0,erjffh,LifeProTips,https://www.reddit.com/r/LifeProTips/comments/erjffh/lpt_one_of_the_buttons_on_a_gas_pump_turns_off/,13,,1579582185.0
486,LPT Save a top from your ketchup and mustard squeeze bottles so that when someone messes it up you can get your spare and put the yucky one in the dishwasher.,7,erj5yh,LifeProTips,https://www.reddit.com/r/LifeProTips/comments/erj5yh/lpt_save_a_top_from_your_ketchup_and_mustard/,2,,1579581143.0
487,"LPT: If you want to memorize something, listen to a song you know really well while reading through it. In my experience, my brain associates the lines of the thing I'm memorizing with the different parts of the song, so while saying the lines out loud, I know what's coming next!",19,erj1j8,LifeProTips,https://www.reddit.com/r/LifeProTips/comments/erj1j8/lpt_if_you_want_to_memorize_something_listen_to_a/,4,,1579580661.0
488,LPT for editing digital text documents from hardcopy edits.,8,eriyhr,LifeProTips,https://www.reddit.com/r/LifeProTips/comments/eriyhr/lpt_for_editing_digital_text_documents_from/,1,"When you're making changes to a digital text document based on handwritten edits on a paper version of the same document, start at the END of the document. Making changes at the beginning will move all your digital content and make it a lot harder to find all your edits. Starting at the end keeps all the previous text unchanged and easy to locate as you're hunting to find ""there"" so you can change it to ""their"".",1579580319.0
489,"LPT If you believe someone else screwed up or is simply clueless, still treat them with respect. In my experience, odds are about even that you are the one who has erred. You'll end up eating a lot less crow.",92,eriygd,LifeProTips,https://www.reddit.com/r/LifeProTips/comments/eriygd/lpt_if_you_believe_someone_else_screwed_up_or_is/,28,"EDIT for those concerned about my value as an employee: yes, my pct of accuracy is actually quite a bit higher than 50%. Maybe 101% lol. I've found that assuming the other person isn't an idiot is gnerally the best place to start and pretending that I think I might be incorrect helps me get to that point. Hence the 50% in my original post.

This tip came to me today after I had an issue with a system that I've used a lot over several years. It clearly wasn't functioning as it should so I emailed the support team. The response made it clear that they were confident I was in the wrong. I knew they were wrong but kept my tone civil. Turns out I had clicked on the wrong option a few layers deep into the transaction, i.e. it was my fault. I was glad I could just say ""I'm an idiot"" and move on instead of having to apologize for being a jerk. Sometimes you have to wait until you know for sure where responsibility lies, even when you know 100% that it isn't you.",1579580315.0
490,LPT: pay attention to the end of prices while shopping at Costco,32786,erix4f,LifeProTips,https://www.reddit.com/r/LifeProTips/comments/erix4f/lpt_pay_attention_to_the_end_of_prices_while/,1009,">In particular, look for:

>Prices that end in 97¢: These have been marked down from the regular priced items, which end in 99¢


>Odd pricing, such as 79¢, 49¢, or 89¢: These indicate specially priced items that Costco got a deal on from the manufacturer. These can be better deals than at other stores, but not usually better than the 97¢ markdown.


>An asterisk* on the upper right side of the sign: The item won't be reordered.


>88¢ or .00 endings: Manager markdowns. They use these to move a product very fast.

Credit to u/almisamie",1579580175.0
491,LPT: Request extra red sauce when ordering from Pizza chains to improve taste,0,erimlt,LifeProTips,https://www.reddit.com/r/LifeProTips/comments/erimlt/lpt_request_extra_red_sauce_when_ordering_from/,6,"This may seem obvious or purely subjective, but I've found this to significantly improve the quality of pizzas from chains like Pizza Hut, Domino's, Papa Murphy's, etc.

All my friends & family agree, so there's some anecdotal evidence for ya!",1579579036.0
492,LPT: Avoid a scam. There is never a need to send a Google verification code to someone else.,129,erilxz,LifeProTips,https://www.reddit.com/r/LifeProTips/comments/erilxz/lpt_avoid_a_scam_there_is_never_a_need_to_send_a/,4,"I'm selling my daughter's bike on Craigslist and I got a text asking if they could send me a Google verification code to confirm that I was a real person. They would send me a code and I would send it back to them. I'm assuming they would really ask for a email/password reset from Gmail with my phone number, which would send a code to my phone. I would ""confirm"" my identify identity with them, and they would steal my account.  I just told them to call me and they could hear my real human voice instead. I haven't heard from them.",1579578968.0
493,LPT - This finally ENDED my FEAR of FLYING,21,erigwi,LifeProTips,https://www.reddit.com/r/LifeProTips/comments/erigwi/lpt_this_finally_ended_my_fear_of_flying/,11,"I used to have an **extreme** fear of flying. I was totally aware of how much safer flying is than driving and all the jazz you normally hear about that is supposed to make things better. It never did for me. The root of my fear was really loss of control which can be quite hard to treat. I finally talked with a therapist who was also a pilot. She really helped me with the following mantras / visualizations, in part because they are based in physics/science and I am nerd at heart. ""The plane is built to be in the air. It is happiest when flying."" And most importantly for turbulence. ""The plane is just a speed boat going over the ocean. Turbulence is just bumps in the air like waves are bumps in the water."" Saying the first set of mantras over and over during take off helped there and the second when we were flying over bumps. The mantras combined with learning what the different sounds mean on a plane (the engine shifts on an Airbus, the wheels lowering, the binging and bonging for the flight staff - thanks Youtube) changed me flying from blackout drunk terrified freak to chill magazine flipper. anyway, I hope these thoughts can help some of you!",1579578430.0
494,"LPT: If you have an iPhone, make sure you have Find My iPhone enabled and have emergency contacts listed in your Medical ID.",30,eri5pc,LifeProTips,https://www.reddit.com/r/LifeProTips/comments/eri5pc/lpt_if_you_have_an_iphone_make_sure_you_have_find/,3,"I lost my phone in a parking lot today and was able to track it to a local police station. An officer also called each of my emergency contacts to try and track down my address. He was on his way to my house when I pulled into the precinct parking lot.

Find My iPhone is a wonderful thing when you misplace your device.",1579577223.0
495,"LPT: my favorite studying/productivity tool, airplane mode!",5,eri52p,LifeProTips,https://www.reddit.com/r/LifeProTips/comments/eri52p/lpt_my_favorite_studyingproductivity_tool/,1,"-saves on battery

-can still connect to bluetooth or even wi-fi (if absolutely necessary) while airplane mode is active

-allows you to leave your phone on to check the time but reduces the impulse to pick up your device and flip through social media or god forbid... Reddit!",1579577156.0
496,"LPT: If your taskbar and desktop go missing on Windows you can get them back by pressing Control-Alt-Del, opening Task Manager and restarting explorer.exe",7,eri3ms,LifeProTips,https://www.reddit.com/r/LifeProTips/comments/eri3ms/lpt_if_your_taskbar_and_desktop_go_missing_on/,4,"If explorer.exe crashes or is terminated by a virus/accident, it will cause the desktop and taskbar to disappear. This can easily be fixed by pressing Ctrl+Alt+Del, opening task manager and restarting explorer.exe.",1579577001.0
497,"LPT : Don’t tell a foreigner their English sounds great. It’s most likely offensive as, these days, most have studied it from an early age just like you.",0,erhyzp,LifeProTips,https://www.reddit.com/r/LifeProTips/comments/erhyzp/lpt_dont_tell_a_foreigner_their_english_sounds/,10,,1579576478.0
498,LPT: Never give in to bitterness; it's like paying a toll to go down a dead end road.,36,erhuc3,LifeProTips,https://www.reddit.com/r/LifeProTips/comments/erhuc3/lpt_never_give_in_to_bitterness_its_like_paying_a/,5,"I know it's easy and even cathartic to give in to hate, but it really is a pointless thing. I've been down that road and it ultimately hurts you more than the event or person that started it ever could.",1579575964.0
499,"LPT: When coupon hunting for online stores, do this in a different browser",6,erhqur,LifeProTips,https://www.reddit.com/r/LifeProTips/comments/erhqur/lpt_when_coupon_hunting_for_online_stores_do_this/,1,"If you have any cashback extensions/addons or you are supporting a friend/business/youtuber/etc via their link, coupon sites will over-ride those things by forcing you to use their affiliate link. You will notice this when you click on a button to reveal a coupon code, then the store's site will open a new tab.

To prevent this from happening, simply browse for coupons in a different browser. For instance, if you use Chrome for daily browsing, use FireFox to look for coupons. Once you are done looking for coupons, just close the other browser and checkout without hassle.",1579575585.0
500,LPT - You can get a global dark mode on all websites and web apps with Opera.,7,erhcur,LifeProTips,https://www.reddit.com/r/LifeProTips/comments/erhcur/lpt_you_can_get_a_global_dark_mode_on_all/,2,If you enable dark mode on Opera (at least for Android) all websites and social media turn to black backgrounds and looks really good and you can avoid using the conventional apps if your phone doesn't have a native dark mode.,1579573994.0
501,"LPT: When searching for new homes (apartments, houses, or whatever), you can call the utility providers that service that address and get averages and totals for the previous year or two.",84,erh7qj,LifeProTips,https://www.reddit.com/r/LifeProTips/comments/erh7qj/lpt_when_searching_for_new_homes_apartments/,10,"I do this when apartment hunting. I call the local electric company, and they give me a yearly average, they can also give me the highest total during the winter months. You can also do it with natural gas providers. It's a standard thing, any company should be able to do this for you. This helps me determine how much the unit will actually cost me, rent + utility costs, per month, as well as what kind of increase I might be able to expect when the cold rolls in.",1579573426.0
502,"LPT: Learn a skill, or two, or three, or network with people that have skills to do certain things. There are too many people/companies out there trying to make a quick and easy buck. Not only will you save yourself money, but you can also make a little money by helping others.",4,erh5zh,LifeProTips,https://www.reddit.com/r/LifeProTips/comments/erh5zh/lpt_learn_a_skill_or_two_or_three_or_network_with/,1,"I see many people ask where else they can go to have x job/task done because they were quoted x amount at this place when anyone with the know-how and tools can do the same thing at a fraction of the cost.

For example, a dealership was charging this woman $900 + parts to replace her headlight. If you have screwdrivers and various ratchets and sockets, that's a 15-20min job. 

Or when Geek Squad tried to charge my Mother an arm and a leg just to diagnose her laptop screen (which I already knew was the problem), plus parts and labor. That job literally entails a bit of prying, a few small screws, and a ribbon cable. You can check the screen you need by looking at the part and model number on the screen. Then search it on ebay and purchase the replacement. Reverse the order to fix it.

Or, a dealership that wanted thousands of dollars to replace this family's struts and springs on their van. Get me the parts and I'll have it installed in a few hours. 

At most, I'd charge you a 6-pack and MAYBE a pizza depending on the time of day. I can go on and on about the examples I see. If I can't do it myself, I can either learn (YouTube, Internet, books, etc) or I at least know someone that can help.

I will say this LPT doesn't help those that are lazy, always busy, don't have the tools, are physically limited, etc. But for the rest of you, I'd like to think this is a valuable tip.",1579573234.0
503,"LPT: If your goal in life is to be useful to others, you can start by figuring out how to be useful to yourself.",238,ergtqi,LifeProTips,https://www.reddit.com/r/LifeProTips/comments/ergtqi/lpt_if_your_goal_in_life_is_to_be_useful_to/,18,,1579571895.0
504,"LPT: If you post a picture of you and someone else, like “We got engaged today!” or “Just married my Tinder date!”, specify which one is you.",0,erfwgx,LifeProTips,https://www.reddit.com/r/LifeProTips/comments/erfwgx/lpt_if_you_post_a_picture_of_you_and_someone_else/,3,Makes it a lot easier for people to make sensible comments.,1579568278.0
505,"LPT: If you write something down that you don’t want anyone to ever read again, simply write 3-4 random words over it with the same pen.",11,erfg45,LifeProTips,https://www.reddit.com/r/LifeProTips/comments/erfg45/lpt_if_you_write_something_down_that_you_dont/,10,"Have you ever scratched out something so hard you actually ripped through the paper? No need! By layering several words on top of each other, the meaning of each single layer becomes impossible to decipher.",1579566413.0
506,LPT: Buy yourself a pack of underwear that are uncomfortable. If you're a slacker these will be notification you need to do laundry. You will exhaust all other options till you get to them as they are uncomfortable.,0,erf3c4,LifeProTips,https://www.reddit.com/r/LifeProTips/comments/erf3c4/lpt_buy_yourself_a_pack_of_underwear_that_are/,6,,1579564952.0
507,"Lpt: if someone is insulting you if you ignore them long enough, they'll usually stop because they get bored. They thrive off of your reactions.",11,erf12h,LifeProTips,https://www.reddit.com/r/LifeProTips/comments/erf12h/lpt_if_someone_is_insulting_you_if_you_ignore/,4,,1579564679.0
508,"LPT: Instead of purchasing an expensive cargo organizer for your vehicle (vans, hatchbacks, and station wagons in particular), pick up some stackable laundry baskets. They make carrying goods into the home easier as well as providing easily accessible storage in a vehicle.",9,erev7k,LifeProTips,https://www.reddit.com/r/LifeProTips/comments/erev7k/lpt_instead_of_purchasing_an_expensive_cargo/,7,,1579563982.0
509,"LPT: when you are shopping for insurance online, use an app that gives you a phone number instead of using your own phone number. You will get many spam calls, you can always get a fresh number when you find the quote you are looking for, then make sure you change it to your real number.",264,ereosv,LifeProTips,https://www.reddit.com/r/LifeProTips/comments/ereosv/lpt_when_you_are_shopping_for_insurance_online/,35,"I don’t want to share the app name because i am not advertising it.
Edit: the app is called textme i know it’s available on ios",1579563183.0
510,"LPT: When registering for online services, enter Germany or other EU countries as your location to get better privacy features by default because of GDPR.",51,erenxw,LifeProTips,https://www.reddit.com/r/LifeProTips/comments/erenxw/lpt_when_registering_for_online_services_enter/,14,,1579563080.0
511,"LPT: If you're trying to wear a pair of shoes that are slightly too big, put on an extra pair of socks to make them fit better.",0,eremnw,LifeProTips,https://www.reddit.com/r/LifeProTips/comments/eremnw/lpt_if_youre_trying_to_wear_a_pair_of_shoes_that/,2,,1579562914.0
512,[LPT] Not a Morning person? Set Smart Light Switches to Turn on Lights in the Morning to Wake Up with Ease,5,erejds,LifeProTips,https://www.reddit.com/r/LifeProTips/comments/erejds/lpt_not_a_morning_person_set_smart_light_switches/,1,"I've set my smart switch on my lights to turn on in the morning and so far, I've had no trouble waking up to it. My goal was to wake up before 6 to be able to go to the gym and run errands before I head to work and I set my smart switch to turn on, regardless of my mood, at 4 am.  So far I've had no failures in waking up via light source and I hope someone else is also doing this and can vouch for this trick!",1579562490.0
513,"LPT: If you select to depersonalize the trending section on twitter, you can change the trends to be relevant to a language you can't read, basically avoiding it.",18,ereecs,LifeProTips,https://www.reddit.com/r/LifeProTips/comments/ereecs/lpt_if_you_select_to_depersonalize_the_trending/,3,"Since you can't select to hide the trending section, this is an easy workaround.",1579561844.0
514,"LPT Request: How to make time fly on 4 hour public transport trip, no headphones. Only IPhone and Internet, save me.",0,erdnar,LifeProTips,https://www.reddit.com/r/LifeProTips/comments/erdnar/lpt_request_how_to_make_time_fly_on_4_hour_public/,24,EDIT: Already on train cant get stuff.,1579558167.0
515,"LPT Don't update youtube if they ask you as if it very possible that the update will fix the problem with the ads when you go to the end of the video and click ""replay""",0,erd7mu,LifeProTips,https://www.reddit.com/r/LifeProTips/comments/erd7mu/lpt_dont_update_youtube_if_they_ask_you_as_if_it/,1,,1579555787.0
516,"[LPT] If you ever forgot your password to a website that your computer still remembers, inspect element can change it to show it as text instead of balls.",46,ercqi0,LifeProTips,https://www.reddit.com/r/LifeProTips/comments/ercqi0/lpt_if_you_ever_forgot_your_password_to_a_website/,20,"I just noticed some other tech question in here regarding forgotten passwords, so I instantly thought of this one. It saved me multiple times. Like many others im using a laptop as well as a phone. Sometimes my phone asks for a password that I forgot, but my laptop obviously remembers it.

All you need to do is inspect element the password field, then change ""password"" to ""text"" and then apply the change. It now shows your password.",1579553027.0
517,"LPT: if you are watching a presentation or a lecture on Youtube or Udemy, try adjusting the playback rate to watch it 1,5x or 1,75x than the normal speed. It's usually just as easy to understand but you'll be done 60-70% faster!",14085,erbxbx,LifeProTips,https://www.reddit.com/r/LifeProTips/comments/erbxbx/lpt_if_you_are_watching_a_presentation_or_a/,484,"That way you will be much more efficient absorbing knowledge!

How to adjust on YouTube: click on gear button in the bottom right and then adjust for playback time.

How to adjust on Udemy: click on ""1x"" on the bottom left and adjust it however you choose",1579547560.0
518,"LPT don't park near the entrance of a store, park near the trolley return",13,eray2l,LifeProTips,https://www.reddit.com/r/LifeProTips/comments/eray2l/lpt_dont_park_near_the_entrance_of_a_store_park/,9,,1579540618.0
519,LPT: You can find a sleep timer on Spotify if you open a song’s menu and scroll all the way down.,3,era8a2,LifeProTips,https://www.reddit.com/r/LifeProTips/comments/era8a2/lpt_you_can_find_a_sleep_timer_on_spotify_if_you/,2,[Here](https://i.imgur.com/mJp7K5X.jpg). This can be so useful sometimes.,1579535819.0
520,"LPT: When done drinking from a squeeze water bottle, squeeze it just a little more (and hold the squeeze) before taking it out of your mouth. This way it doesn’t make the loud suction noise.",0,er9r4h,LifeProTips,https://www.reddit.com/r/LifeProTips/comments/er9r4h/lpt_when_done_drinking_from_a_squeeze_water/,2,,1579532879.0
521,"LPT: if you have unused, flavored salt samples or packets, try them on popcorn",2,er9q4b,LifeProTips,https://www.reddit.com/r/LifeProTips/comments/er9q4b/lpt_if_you_have_unused_flavored_salt_samples_or/,3,"I've had quite a few artisan salt samples or packets over the years (they are popular gifts), and ofttimes they go unused. I am afraid to use them in meals, because I don't know the ratio of spices to salt, and sometimes I don't even know what specific kind of seasonings are in a sample (and I'm afraid of ruining a meal). Some are just labeled Santa Mix, or Unicorn mix, with no real hint at the overall flavor profile. 

Pop a batch of popcorn, then use a selection of salts to season it in separate, small bowls. It will most likely not ruin a small bowl of popcorn, and it it does, the investment is small. Afterwards, you have a good idea of what types of dishes each might taste good in.",1579532702.0
522,"LPT: If you are new to a country or planning trips, you can subscribe to a calendar that will sync public holidays with your personal calendar.",9,er9oc0,LifeProTips,https://www.reddit.com/r/LifeProTips/comments/er9oc0/lpt_if_you_are_new_to_a_country_or_planning_trips/,1,"Several countries have holidays and observations that vary every year and planning trips or travel can be difficult.

A website called [OfficeHolidays](https://www.officeholidays.com/countries) tracks public, national and federal holidays for several countries and will sync them with your personal calendar once subscribed. It also offers state-specific calendars for countries where some holidays are observed only in a particular state.",1579532404.0
523,LPT if you know your about to get shocked from static electricity build up slap your hands on the fridge/wall/light switch plate so you don’t get that acute annoying shock.,0,er91jz,LifeProTips,https://www.reddit.com/r/LifeProTips/comments/er91jz/lpt_if_you_know_your_about_to_get_shocked_from/,11,,1579528732.0
524,LPT: Stay motivated to get most out of school by calculating how much you are paying per class.,18,er8x5d,LifeProTips,https://www.reddit.com/r/LifeProTips/comments/er8x5d/lpt_stay_motivated_to_get_most_out_of_school_by/,11,"When I was in grad school, I was having tough time staying motivated and make most of my college experience.

I calculated that I was paying $200 per lecture and if I wasted one of the lectures without learning something, I was essentially burning $200. This helped me, maybe it will help some of you. 

(I did the same thing in my bachelor's when I had issues keeping up my attendance in class, it helped there too.)",1579528070.0
525,"LPT: That double down arrow button beside the add comment tab on Reddit, you can hold and drag to anywhere on screen and it stays there.",20,er8qxa,LifeProTips,https://www.reddit.com/r/LifeProTips/comments/er8qxa/lpt_that_double_down_arrow_button_beside_the_add/,7,,1579527138.0
526,"LPT: If you have a warehouse store membership and you need a replacement car battery consider checking for one there first. Most car battery brands are manufactured by 1 of 3 companies so if they have it, the same battery can regularly be had for less than half the price of autoparts/chain stores.",16,er8hv4,LifeProTips,https://www.reddit.com/r/LifeProTips/comments/er8hv4/lpt_if_you_have_a_warehouse_store_membership_and/,7,"in my case, i've found two batteries at costco each for around $90 total with 3 year warranty (the same length as the longest warranties at autozone/o'reilly's) and manufactured by johnson control electronics, the same manufacturer as die hard batteries and duralast and most of the batteries sold at walmart, pepboys, etc. i've had a membership for years but it took me almost two decades to realize i wasn't taking full advantage of it because i've been buying $240 batteries and since warehouse stores are all over the place, you'll still be able to service it in many states.",1579525794.0
527,LPT: Send PDFs not doc or docx,41,er8c2g,LifeProTips,https://www.reddit.com/r/LifeProTips/comments/er8c2g/lpt_send_pdfs_not_doc_or_docx/,14,"If you have to send a document to someone for reading or getting signed or something, export it as a PDF and send that. What you see on your word document may not be what the recipient sees when they open it. Text, photos and other elements can go all over the place.",1579524964.0
528,"LPT: If someone mentions an important fact about themselves (birthday, pet name, etc.) that you’ll probably forget, take a note of it in contact’s notes on your phone. Saves the awkward situation of having to ask again, and helps show you that you care.",122,er8b8n,LifeProTips,https://www.reddit.com/r/LifeProTips/comments/er8b8n/lpt_if_someone_mentions_an_important_fact_about/,16,,1579524845.0
529,LPT: If you use Outlook desktop to manage email add a one minute delay to every email you send. It is always half a second later you hit send that you realize that you forgot to add something. You can then go to outgoing mail and find it waiting for you,2259,er7w4i,LifeProTips,https://www.reddit.com/r/LifeProTips/comments/er7w4i/lpt_if_you_use_outlook_desktop_to_manage_email/,70,,1579522639.0
530,"LPT: When you’ve got wet snow that keeps sticking to your shovel, dry it off and apply some oil.",4,er7vfz,LifeProTips,https://www.reddit.com/r/LifeProTips/comments/er7vfz/lpt_when_youve_got_wet_snow_that_keeps_sticking/,1,"Baking spray works great, but you could rub on any kind of oil. If the shovel isn’t dry, the oil will come off fairly quickly with the first few scoops.",1579522541.0
