,title,score,id,subreddit,url,num_comments,body,created
354,"Turned 18 a week ago, dumped 2 months ago and was probably a mistake 19 years ago. Reddit, please destroy me and show me pain",4,etqsys,RoastMe,https://i.redd.it/un9a9wq3gxc41.jpg,52,,1579987916.0
355,"He lost our fantasy football league and this is his punishment, please roast him.",7,etr9rk,RoastMe,https://i.redd.it/s3j01ev0oxc41.jpg,20,,1579990585.0
356,I'm turning 30 today and I lift.,13,etqwvc,RoastMe,https://i.redd.it/7yt3xkk0ixc41.jpg,54,,1579988559.0
357,Finally 18. Forgot my arm so let's try again.,26,etqpa4,RoastMe,https://i.redd.it/be3js31aexc41.jpg,109,,1579987300.0
358,I'm an IT technician. Im still studying computer science and i play alot of video games and VR,12,etq0cj,RoastMe,https://i.imgur.com/pvdhnrv.jpg,66,,1579982746.0
359,"My biology teacher thinks that humans can't handle a nice 90°C roasting, about to prove him wrong",70,etq1a9,RoastMe,https://i.redd.it/wgbzx1y91xc41.jpg,72,,1579982928.0
360,"Please roast my boyfriend, he thinks he’s better than everyone else when he’s drunk. Put him in his place.",23,etp53j,RoastMe,https://i.redd.it/w2azgl64hwc41.jpg,86,,1579976150.0
361,"I'm so close to rock bottom, finish me off",12,etonoc,RoastMe,https://imgur.com/DuBonbo,47,,1579972407.0
362,i’m stoned asf but I go to college and work,8,etopwl,RoastMe,https://i.redd.it/n94ki2of7wc41.jpg,36,,1579972896.0
363,"divorced parents, alcoholic mom, and college bound. burn my friend.",2,etos8s,RoastMe,https://i.redd.it/h4e4sy6v8wc41.jpg,40,,1579973374.0
364,Will turn 19 this year and life already seems boring to me. Give me something interesting. Don't. Hold. Back. Seriously just destroy me... If you can😏 And mods...It's my hand I swear. Don't remove this one😑,6,etohnm,RoastMe,https://i.redd.it/hczi9jqd2wc41.jpg,58,,1579971199.0
365,It's my 26th Bday.,17,etnwg1,RoastMe,https://i.redd.it/7jdp594ipvc41.jpg,38,,1579966861.0
366,give us the ol burnt to a crisp. this is my ex girlfriend and I. were still friends though.,9,eto5sd,RoastMe,https://i.redd.it/spyqm011vvc41.jpg,80,,1579968723.0
367,"24 years old, medical School, skinnyfat, drummer, nothing to lose, Roast me!",4,eto8sx,RoastMe,https://i.redd.it/zjysog6uwvc41.jpg,47,,1579969331.0
368,Good morning. Fuck my whole Saturday up.,3,eto9ep,RoastMe,https://i.redd.it/1ab4p91pwvc41.png,22,,1579969462.0
369,"Two weeks out from heart surgery, wearing a new shirt and feeling anxious - please, roast me! 😀",154,eto66w,RoastMe,https://i.redd.it/qv74mru9vvc41.jpg,167,,1579968802.0
370,"26 Year old Indian Chartered Accountancy Student, FAILED twice in the exam. Roast Your Best !",8,etnwum,RoastMe,https://i.redd.it/g1jq95k2pvc41.jpg,52,,1579966936.0
371,"29M, into crypto trading. Give it yer best shot bitches.",15,etnb6w,RoastMe,https://i.redd.it/q34xrfw8dvc41.jpg,74,,1579962740.0
372,"Woke up feeling too good this morning, let me see what you got",5,etne8l,RoastMe,https://i.redd.it/4nsg7f0zevc41.jpg,31,,1579963321.0
373,Fuck this bastard !,9,etmsub,RoastMe,https://i.redd.it/qb059db93vc41.jpg,56,,1579959382.0
374,Working a graveyard shift and need someone to point out my insecurities to keep me entertained.,4,etmz4h,RoastMe,https://i.redd.it/8p5wwvmh6vc41.jpg,72,,1579960511.0
375,rusty b0i....hillary clinton; smash or pass??,3,etn4qr,RoastMe,https://i.redd.it/3aug4vqk9vc41.jpg,77,,1579961508.0
376,Brother wearing his 2018 sloth Christmas onezie. Do your worst,1,etn8o3,RoastMe,https://i.redd.it/nukyz0ltbvc41.jpg,31,,1579962259.0
377,Roast this white bitch,4,etmeot,RoastMe,https://i.redd.it/tv3xher8wuc41.jpg,66,,1579957021.0
378,Break my heart like my new ex girlfriend did,8,etmvyn,RoastMe,https://i.redd.it/872t3jru4vc41.jpg,49,,1579959917.0
379,Do the extreme !,11,etmt4u,RoastMe,https://i.redd.it/c9bw82mf3vc41.jpg,54,,1579959440.0
380,My frat bros don't think I can handle it. Roast me,34,etmmg3,RoastMe,https://i.redd.it/e3frh7i10vc41.jpg,78,,1579958300.0
381,Did this a few days ago at least try to hurt my feelings,28,etmggk,RoastMe,https://i.redd.it/ggtqcgs3xuc41.jpg,78,,1579957310.0
382,"Well, I got my friend to do this on my account. Now that I’m eighteen, I want to be burned harder than my great grandpa did in Hiroshima (not even kidding).",15,etly83,RoastMe,https://i.redd.it/9pie954couc41.jpg,93,,1579954367.0
383,Hello! You’re friendly neighborhood Asexual Christian Furry here! Give me hell!,2,etltoq,RoastMe,https://i.redd.it/p7o0l918muc41.jpg,49,,1579953652.0
384,19. Roast me bois,8,etlunh,RoastMe,https://i.redd.it/7dra7h3jmuc41.jpg,61,,1579953801.0
385,"Round 2: can’t beat this boss but I beat my dick anyways, I’m flexable, get it? Because I’m able, to flex them Yeezys",0,etlrhi,RoastMe,https://i.redd.it/i6m3odi7luc41.jpg,43,,1579953310.0
386,"Looking for a laugh, let’s go boys (and girls)",7,etlg22,RoastMe,https://i.redd.it/bpv5v3iyfuc41.jpg,55,,1579951544.0
387,18 year old theatre kid. I’ve been dying to post here so make it good!,37,etl423,RoastMe,https://i.redd.it/0pbxzl5pauc41.jpg,201,,1579949774.0
388,When you thank a fellow auto design coworker for helping you with your program tasks and you realize roughly 10 minutes later that he actually F@&€ED you over hard core. Touché MF!!,5,etla2f,RoastMe,https://i.redd.it/bezrcifcduc41.jpg,41,,1579950665.0
389,18 year old college student. make me cry.,16,etkz3k,RoastMe,https://i.redd.it/5pjvwp6e8uc41.jpg,70,,1579948999.0
390,"This cheesey bread is named after me. It's ""The Veg"" Roast me Day 24/366",4,etkknq,RoastMe,https://i.imgur.com/IXSiJ7Y.jpg,33,,1579946900.0
391,#50yoOkie,11,etiwx8,RoastMe,https://i.redd.it/otog5wjletc41.jpg,70,,1579938983.0
392,Deny me for meat tubes again...,14,etj4ab,RoastMe,https://i.redd.it/dslwbqafhtc41.jpg,105,,1579939931.0
393,M21 alcoholic uni student just tryna have a laugh! Give me your best,7,etj5r8,RoastMe,https://i.redd.it/529lnlr0itc41.jpg,53,,1579940132.0
394,"Eyes open, meat tube showing, give me a reason to validate my bitchass crying",12,etjvnh,RoastMe,https://i.redd.it/qpacd4hsrtc41.jpg,79,,1579943422.0
395,It’s my cake day and I’m ready for y’all to do your worst!! I need a laugh today and need to build a thicker skin.,9,etj03u,RoastMe,https://i.redd.it/pagkk9isftc41.jpg,59,,1579939381.0
396,is my hand in the photo enough now?,26,etjnbt,RoastMe,https://i.redd.it/y34cb3ejotc41.jpg,100,,1579942322.0
397,"I ""lost"" fantasy football, but Bondo is the real loser in fantasy football and in life.",10,etivbr,RoastMe,https://i.redd.it/gql33z8zdtc41.jpg,39,,1579938780.0
398,roast us!,20,etinj0,RoastMe,https://i.redd.it/47ioi5z5btc41.jpg,94,,1579937827.0
399,Pretty boi,17,etiddk,RoastMe,https://i.redd.it/gyaxw5ya7tc41.jpg,75,,1579936543.0
400,24 year old machinist and redneck living at my moms house. Light me up. The,70,etiazt,RoastMe,https://i.redd.it/p4y43cgh6tc41.jpg,170,,1579936251.0
401,I’ve been on here for 3 years today and never done this,8,etgt9q,RoastMe,https://i.redd.it/ktbjqxtsmsc41.jpg,46,,1579929631.0
402,Finished college but can’t get a job. Slowly learning to love myself. Tear me down!,460,eti15z,RoastMe,https://i.redd.it/w99vowws2tc41.jpg,357,,1579935013.0
403,This is my friend who describes himself as a Gentleman and a scholar and the next Jeopardy champ who says you can't hurt his feelings.,23,ethhai,RoastMe,https://i.redd.it/pg2nvex6usc41.jpg,95,,1579932547.0
404,"Hey guys, this is my friend who doesn't usually use reddit and doesn't believe that he's going to get roasted in any way. Make him believe it",26,ethj85,RoastMe,https://i.redd.it/wmgsm5a5wsc41.jpg,147,,1579932778.0
405,Apprentice alcoholic #roastme,10,ethoyu,RoastMe,https://i.redd.it/3j7l6i18ysc41.jpg,57,,1579933476.0
406,Let’s see what you can do,40,etgxx0,RoastMe,https://i.redd.it/ssz8wgbiosc41.jpg,184,,1579930207.0
407,Roast my stupid face,17,etg5bw,RoastMe,https://i.redd.it/73r8gok6esc41.jpg,50,,1579926736.0
408,21yr old British music student. Roast me bois.,26,etgoba,RoastMe,https://i.redd.it/o0kqkruzksc41.jpg,116,,1579929026.0
409,"Everybody tells me my haircut makes me look like Lloyd Christmas from Dumb & Dumber. Last week a woman told me kids under 14 have to have a parent at their table. Turning 19 in a month, but I already know this’ll get flagged. Hit me harder than puberty will (one day).",9,etgsag,RoastMe,https://i.redd.it/9nx69ft7msc41.jpg,34,,1579929512.0
410,"It’s pretty damn hard to take a picture, even for an attention whore.",6,etg3bf,RoastMe,https://imgur.com/a/xoFx19d,20,,1579926498.0
411,My friend recently came out as a gay man. Roast him,11,eteck1,RoastMe,https://i.imgur.com/h6Hh08g.jpg,67,,1579919128.0
412,20m show me what you got!,18,etee72,RoastMe,https://imgur.com/y8FuOlm,89,,1579919326.0
413,"I'm feeling pretty good right now, i need a roast",13,etf3gy,RoastMe,https://i.redd.it/nb1jw7lw0sc41.jpg,28,,1579922275.0
414,Be brutal,9,etf67u,RoastMe,https://i.redd.it/7ck27qqu1sc41.jpg,51,,1579922598.0
415,"18y Brazilian, have never looked worse. Have reached rock bottom and dropped out of high school last year. My hobbie is to constantly look for new VPN free trials to watch Survivor on US websites and drink myself to sleep (almost) everyday. Life is messier than my hair, end me before I do it myself.",27,etfcjk,RoastMe,https://i.redd.it/mpglo0114sc41.jpg,103,,1579923335.0
416,18yo Dutch lad who tries to help others with their problems so I can avoid my own. Fuck me up fam,31,etfi4x,RoastMe,https://i.redd.it/9c6meuuz5sc41.jpg,85,,1579923986.0
417,This is my roommate at college. His confidence is believed to be untouchable. Let’s see if anyone can penetrate this confidence. He considers himself to be a young entrepreneur. Reddit I need you to do what you do!,20,etfucc,RoastMe,https://i.redd.it/79bqiumcasc41.jpg,58,,1579925444.0
418,Roast this white hippie bastard - hes 24 with a receding hairline the insecure bastard,8,etec56,RoastMe,https://i.redd.it/dyer1pdfrrc41.jpg,59,,1579919080.0
419,I’m the boss of a casino. Tell me all the stuff people say behind my back!,30,etesiz,RoastMe,https://i.redd.it/h9sgqq05xrc41.jpg,118,,1579921005.0
420,"Turning 22 today, make me laugh or cry.",41,ete60d,RoastMe,https://i.redd.it/d0rr72m6prc41.jpg,140,,1579918330.0
421,"Annihilate this Brown Boy - We call him the Golden Brown boy, find him a new name",5,ete6gw,RoastMe,https://i.redd.it/euku840dprc41.jpg,52,,1579918387.0
422,"32M and living inside of my art project. ‘Me’ is just an illusion, roast it anyway.",27,ete5gk,RoastMe,https://i.redd.it/ug8f9hzaorc41.jpg,79,,1579918262.0
423,"My colleagues and I are all submitting a roast me, do your worst to this South African fool",5,etdzpx,RoastMe,https://i.redd.it/7zx1ji43nrc41.jpg,34,,1579917625.0
424,"19, computer science student with no success in anything and without any skill in any field either. Tell me what's wrong with me.",37,etddgd,RoastMe,https://i.redd.it/7d3lhwvjfrc41.jpg,182,,1579915088.0
425,"My friend wanted a roast me. 18, last year of high school, virgin, trying to be a k-pop star. Throw the best you got at him.",13,etd37o,RoastMe,https://i.redd.it/o5k22zp3crc41.jpg,44,,1579913927.0
426,Go crazy! M(18),4,etd46f,RoastMe,https://i.redd.it/2kvoktbbcrc41.jpg,47,,1579914039.0
427,"I can’t weld today, and am stuck in he cafeteria. Go ahead reddit, do your thing",9,etd2ha,RoastMe,https://i.redd.it/5kje7syubrc41.jpg,40,,1579913845.0
428,Roast me as hard the roasted chicken on my plate !,8,etayag,RoastMe,https://i.redd.it/skfn3uzyiqc41.png,23,,1579904131.0
429,"My friend says he is stud, is that so ?!",6,etbwha,RoastMe,https://i.redd.it/sk52vamhwqc41.jpg,26,,1579908675.0
430,"Im 19, Joining the navy in 2 weeks. I don't have a license, nor am I very independent/self-sufficient, try and roast me",5,etc2s3,RoastMe,https://i.redd.it/7hl4er7vyqc41.jpg,28,,1579909475.0
431,"On the Cusp of Thirty, happily partnered, gainfully employed, and feeling great. Please eviscerate my ego.",5,etce7v,RoastMe,https://i.redd.it/z96n7ga43rc41.jpg,37,,1579910905.0
432,Lost my fantasy football league. Just got up from a nap. Please roast away,12,etcfzc,RoastMe,https://i.redd.it/luze4rmr3rc41.jpg,19,,1579911123.0
433,I drink juice every morning. Roast me.,6,etcj3v,RoastMe,https://i.redd.it/hnqyifzu4rc41.jpg,22,,1579911492.0
434,"18, french, want to do law, politics, journalism or... writing stuff ?",4,etcj4b,RoastMe,https://i.redd.it/5w7nl92p4rc41.jpg,19,,1579911493.0
435,Give it to me daddy,8,etclhk,RoastMe,https://i.redd.it/h7e2hyep5rc41.jpg,50,,1579911777.0
436,Came in last place in my fantasy football league,5,etcow3,RoastMe,https://i.redd.it/235n7h1y6rc41.jpg,28,,1579912192.0
437,I came in last in fantasy football and this is my punishment. Let me have it.,9,etcpk9,RoastMe,https://i.redd.it/jwarg6477rc41.jpg,37,,1579912279.0
438,"My mate thinks your roasting was shit, Reddit. Can we make him cry? 32, single and ready to mingle",6,etcr2w,RoastMe,https://i.redd.it/m19el5br7rc41.jpg,23,,1579912465.0
439,Superior at my workplace. Subordinates think I'm a megalomaniac. Try and roast me.,10,etayjp,RoastMe,https://i.redd.it/y36q2a53jqc41.jpg,66,,1579904168.0
440,"Because life wasn't kicking me enough, take your best shot.",20,etaw3e,RoastMe,https://i.redd.it/r0ky5eu4iqc41.jpg,66,,1579903851.0
441,Need to be entertained on a boring Friday. Do your best!,24,etausu,RoastMe,https://i.redd.it/so8sh37mhqc41.jpg,128,,1579903675.0
442,26y egyptian studying master in Germany. Show me your worst.,145,etau4t,RoastMe,https://i.redd.it/iur7sz3bhqc41.jpg,171,,1579903576.0
443,"2nd year computer science student, convinced that nothing can hurt me anymore, prove me wrong",15404,etaq04,RoastMe,https://i.redd.it/dt95hwfmfqc41.jpg,2667,,1579903006.0
444,Posted a pic with my dog and got lit up for being a hipster singularity. So let's try it again but proper this time.,13,etaiyr,RoastMe,https://i.redd.it/g4u96hbccqc41.jpg,89,,1579901948.0
445,Fuck my shit up bois n gurls,21,et9j86,RoastMe,https://i.redd.it/g7jpt47qvpc41.jpg,96,,1579896350.0
446,Straight lgbt rights activist,13,eta0gg,RoastMe,https://i.redd.it/2cunivk44qc41.jpg,64,,1579899137.0
447,Roast away,7,eta14s,RoastMe,https://i.redd.it/51kmfbgg4qc41.jpg,22,,1579899250.0
448,Easy mode. Let's see where this goes.,4,eta21f,RoastMe,https://i.redd.it/6eca3ptv4qc41.jpg,28,,1579899391.0
449,Told him to hold this and smile for reddit,5,eta8q1,RoastMe,https://i.redd.it/i2jnq5vs7qc41.jpg,17,,1579900408.0
450,"You already know what to do, stop reading the title and get on with the slaughter.",13,et9eix,RoastMe,https://i.redd.it/fybp7veitpc41.jpg,67,,1579895567.0
451,I'm sure I've failed the exam that I've done this morning and I'm vegan,20,et8rod,RoastMe,https://i.redd.it/kyr06o3uhpc41.jpg,59,,1579891641.0
452,My birthday today- roast me not my eyebrows,9,et8xku,RoastMe,https://i.redd.it/2v7rm3xykpc41.jpg,52,,1579892699.0
453,my friend dared me to do a Roast Me post because he says i flex too much . do your best Reddit,22,et8b12,RoastMe,https://i.redd.it/zrh5qnag8pc41.jpg,102,,1579888486.0
454,18yo with too much time,8,et8bqf,RoastMe,https://i.redd.it/nzh9zv0w8pc41.jpg,41,,1579888633.0
455,I spent longer on this poster than I have on homework in the last month. Tell me something I haven’t heard before.,12,et7bzl,RoastMe,https://i.redd.it/msmk3uf1noc41.jpg,84,,1579881286.0
456,"My Resting B!tch Face... it's easier to crack, than it looks.",6,et79nm,RoastMe,https://i.redd.it/1queo59nloc41.jpg,65,,1579880822.0
457,"Fat and anxius 21 year old, minimal wage worker. Send me to the burned victims unit",5,et6fow,RoastMe,https://i.redd.it/5boc5esz5oc41.jpg,78,,1579875551.0
458,Too unimaginative to give you a title.,24,et4u77,RoastMe,https://i.redd.it/n7ax3chhfnc41.jpg,85,,1579866637.0
459,I discovered the FEEDBACK LOOP is the Fundamental Unit of ALL of Reality (and I can describe it). NaNa naNa nAna… I beat you ALL. I'm so good. %)~ Roast Me mother*ckers. (you don't deserve the exclamation point),3,et4sj5,RoastMe,https://i.redd.it/8fy2b1caanc41.png,112,,1579866402.0
460,Roast me and my best friend.,22,et40e4,RoastMe,https://i.redd.it/dwbgea183nc41.jpg,112,,1579862520.0
461,"I got roasted for my birthday by friends, can the internet do any better?",68,et422h,RoastMe,https://i.redd.it/zzz5e9fw3nc41.jpg,219,,1579862739.0
462,"Just got my hair done today, laying in bed bored, so roast me!",123,et35l9,RoastMe,https://i.redd.it/92cb1zz0rmc41.jpg,261,,1579858415.0
463,Roast Me as best you can,19,et3p4p,RoastMe,https://i.redd.it/tux1bj2nymc41.jpg,124,,1579860971.0
464,Been feeling cocky lately pound me back into the ground,7,et3qka,RoastMe,https://i.redd.it/l57ic2f7zmc41.jpg,69,,1579861161.0
465,"We're Lovers. Just kidding, we're Brothers.... Brother-in-laws ;) Roast me Day 23/366",6,et32o5,RoastMe,https://i.redd.it/1httlspqpmc41.jpg,59,,1579858037.0
466,"I fucked up the best relationship anyone could ever have, I chopped off a foot of my gorgeous red hair and dyed it blue, and I’m spiraling out of control. I just want to get ran over by a car, so nothing could be worse! But try!",303,et221x,RoastMe,https://i.redd.it/4gktv081cmc41.jpg,426,,1579853372.0
467,Roast me harder then what my decade old bully did to my self esteem,14,et1ub3,RoastMe,https://i.redd.it/7b30yf859mc41.jpg,76,,1579852400.0
468,My friend doesn’t think you have what it takes to hurt his feelings,63,et14ur,RoastMe,https://i.redd.it/y3lk2hp30mc41.jpg,181,,1579849356.0
469,"A friend of mine found out about this sub, he wants to get roasted. Help him fellas",20,et0kbw,RoastMe,https://i.redd.it/vqk4j1z3tlc41.jpg,80,,1579847005.0
470,24y.o. Estonian. Without work. Hitchhiking around the Europe. Roast me,17,et0ato,RoastMe,https://i.redd.it/w1t01uumplc41.jpg,69,,1579845915.0
471,About to force my pca to look into dumpsters for food,40,et0dfi,RoastMe,https://i.redd.it/qip9us2oqlc41.jpg,123,,1579846214.0
472,"Posted a year or so ago, nothing much has changed in my life, still single and even my hair doesn't want to be near me. Getting accustomed to my newly shaved head. Come at me bitches",20,et09a5,RoastMe,https://i.redd.it/j55mqw2bplc41.jpg,68,,1579845726.0
473,"21, Filipino that failed out of nursing school, say something that my parents haven’t already :’)",33,eszusc,RoastMe,https://i.redd.it/n7dvd71bklc41.jpg,112,,1579844045.0
474,27 Birthday today! Give me your best presents you filthy animals!,15,et00ml,RoastMe,https://i.redd.it/isg9om69mlc41.jpg,91,,1579844703.0
475,Repost from Earlier. Fixed Picture Orientation. Is that all you got reddit?,6,et041b,RoastMe,https://i.redd.it/kljjxbgdnlc41.jpg,51,,1579845109.0
476,We laugh at our own jokes !,10,esz585,RoastMe,https://i.redd.it/dhqbkzmqblc41.jpg,59,,1579841168.0
477,19 y.a chemist student,8,esyxi2,RoastMe,https://i.redd.it/e0hfbs749lc41.jpg,51,,1579840289.0
478,"Recently 25, work from home, never got girl interested, board gamer, college ongoing - 6ft4 (big) disappointment for parents",51,esyqk9,RoastMe,https://i.redd.it/6lfae86s6lc41.jpg,122,,1579839501.0
479,Go on !,7,esyrlo,RoastMe,https://i.redd.it/gddozst47lc41.jpg,39,,1579839624.0
480,Please Roast me i have nothing better to do.,11,esylg6,RoastMe,https://i.redd.it/05fc3dw25lc41.jpg,36,,1579838924.0
481,Do your worst!,7,esyl7p,RoastMe,https://i.redd.it/1kgu390y4lc41.jpg,43,,1579838899.0
482,"Ginger and works at chili’s, Roast me",9,esyhao,RoastMe,https://i.redd.it/1kl6o3oo3lc41.jpg,40,,1579838455.0
483,Heard this page had the heat... Do your worst I’m ready.,9,esye6i,RoastMe,https://i.redd.it/iuxmun1n2lc41.jpg,66,,1579838104.0
484,Help me raise money for a haircut. Roast me.,5,esy839,RoastMe,https://i.redd.it/tfjz5y0h0lc41.png,35,,1579837385.0
485,Tried writing backwards but failed.,17,esxu1m,RoastMe,https://i.redd.it/2jheyjmmvkc41.jpg,65,,1579835748.0
486,You know what to do,3,esxn2u,RoastMe,https://i.redd.it/aje53l1btkc41.jpg,37,,1579834965.0
487,"Another friend of mine wants to be roasted, 18 ""I'm a real slav, you fake ass bitches can't touch me""",13,esw6l8,RoastMe,https://i.redd.it/wfg2ojnsakc41.jpg,90,,1579828738.0
488,Not a single thing is going well in life and I even failed at crying about it,4,esx153,RoastMe,https://i.redd.it/tslvd4relkc41.jpg,28,,1579832338.0
489,I’m a giant tool! Roast me!,4,esxcft,RoastMe,https://i.redd.it/d3aghcldpkc41.jpg,10,,1579833689.0
490,Roast me,7,esxcn4,RoastMe,https://i.redd.it/d3680urlpkc41.jpg,18,,1579833719.0
491,Roast my friend 2.1 gpa big eminem fan,40,esxfdl,RoastMe,https://i.redd.it/s5yei2lmqkc41.jpg,59,,1579834063.0
492,to be honest I'm invincible (F20),196,eswqw6,RoastMe,https://i.redd.it/kmqwzgxyhkc41.jpg,318,,1579831151.0
493,"My friend thinks he's impregnable to roasts, prove him wrong comrades",17,eswq25,RoastMe,https://i.imgur.com/E5sGBzv.jpg,30,,1579831058.0
494,"Soccer player, favorite subject math, and always down to have fun. M(18)",21,esw0ge,RoastMe,https://i.redd.it/3l4z6ynk8kc41.jpg,91,,1579828004.0
495,21 year old Web developer looking for a solid roast sesh. Fuck me up real good,6,esvnm6,RoastMe,https://i.redd.it/4gujqwz74kc41.jpg,40,,1579826527.0
496,Looking for a proper roasting. Don't hold back,10,esvd9s,RoastMe,https://imgur.com/XEziaMG,52,,1579825319.0
497,"Dont have an interesting title, just do it.",19,esvggm,RoastMe,https://i.redd.it/zh4wqmnl1kc41.jpg,58,,1579825681.0
498,It’s been 3 1/2 years of recovering from a psychotic episode with no success at school and no motivation to get to work. 23 yrs old now and am still mooching off of my Father’s wealth... dig me a hole and bury me in it!,32,esv78q,RoastMe,https://i.redd.it/1ovayuwjyjc41.jpg,181,,1579824621.0
499,"Time to roast my friend who is 19 years my senior. He's unemployed and came to my apartment to beg for money, again. He agreed to be roasted so that I'd give him $20, a razor head and some pheromone spray.",6,estpuj,RoastMe,https://i.redd.it/rjjf4cgkejc41.jpg,32,,1579817921.0
500,19 and far too happy at work. Roast away,87,estwfm,RoastMe,https://i.redd.it/px3dolf0hjc41.jpg,161,,1579818802.0
501,Hit me with your best shot!,10,esuc4p,RoastMe,https://i.redd.it/vhoacvv9njc41.jpg,46,,1579820848.0
502,"Mentally retarded 18yo, built like a twig, gets 4 hours of sleep, day drinks, and is overdue for a haircut and a shave, have at it.. there's a lot to be had at, make me give up on life more than I already have",3,estaav,RoastMe,https://i.redd.it/8w6vjk8b8jc41.jpg,48,,1579815798.0
503,"I'm 24 today & i start a new job on Monday, feeling pretty good. Lets see if we can change that.",17,essouu,RoastMe,https://i.redd.it/yk7g986izic41.png,59,,1579812838.0
504,"19, retail assistant, failed all exams and never had a girlfriend. Bring it on.",12,essr37,RoastMe,https://i.redd.it/kfxql4yf0jc41.jpg,62,,1579813150.0
505,The camera adds 20 lbs. Right?,79,essv9b,RoastMe,https://i.redd.it/2141uog62jc41.jpg,149,,1579813735.0
506,"Been a year since the last one, can't afford another piece of paper. Roast me.",41,esrxbl,RoastMe,https://i.redd.it/6535rcfimic41.jpg,79,,1579808465.0
507,My friend doesn't have reddit but wants to be roasted. Don't hold back.,4,esrkr8,RoastMe,https://i.redd.it/2vk2mqonfic41.jpg,39,,1579806161.0
508,Bored at work hopefully a good roast will spice up my day,21,esqzzo,RoastMe,https://i.redd.it/r8a0muql4ic41.jpg,53,,1579802475.0
509,"I'm a schoolman who failed at sending my first post. My hobbies include boxing, taekwondo, playing fantasy/strategy games, and learning stuff about politics/psychology. I'm working as waiter and take part in the local entrepreneurship NPO. I don't use shampoo. Good luck.",16,esqxe3,RoastMe,https://i.redd.it/a16ij9ua3ic41.jpg,131,,1579802007.0
510,Two whiteboy gamers from Norway. Do your absolute WORST.,17,esqxnk,RoastMe,https://i.redd.it/ntyayngg3ic41.jpg,54,,1579802057.0
511,"19yr old, believe it or not I have had sex",2,esqske,RoastMe,https://i.redd.it/vy8563rd0ic41.jpg,84,,1579801024.0
512,"(23m) Come on fellas, make my confidence lower than my chance of surviving past 30",50,esqsgb,RoastMe,https://i.redd.it/8r1l4mua0ic41.jpg,138,,1579800998.0
513,Tell me how I’m not a soild 3/10,13,espmju,RoastMe,https://i.redd.it/ppyni4abahc41.jpg,82,,1579792261.0
514,Had a nervous breakdown about 5 years ago and half of my moustache went white. I’ve heard every joke about a thousand times. If I’ve heard something before I’m gonna rip on you pretty hard so hit me with something fresh or don’t bother.,145,esps1g,RoastMe,https://i.redd.it/a3vv8iqfdhc41.jpg,372,,1579793308.0
515,Hey I’m back I’m that 18 y.o. Dude from Slovakia that is ill as fuck,6,esq2hv,RoastMe,https://i.redd.it/gxixl1pmjhc41.jpg,32,,1579795390.0
516,I have pink hair so roast me.,10,esphhu,RoastMe,https://i.redd.it/8wvylr4m7hc41.jpg,56,,1579791349.0
517,18 y/o HS senior in NH,15,esoavr,RoastMe,https://i.redd.it/d5k667jckgc41.jpg,53,,1579783524.0
518,mon the hoops,2,esnj34,RoastMe,https://i.redd.it/3ge8z0px7gc41.jpg,45,,1579779360.0
519,"All right, let’s see how creative you can be. 30 years old dude living in Texas and hating every day of it.",6,eso0wg,RoastMe,https://i.redd.it/u10xpzc7fgc41.jpg,48,,1579781794.0
520,23 year old man needs to be humbled,6,esnyw7,RoastMe,https://i.redd.it/8oibknr2egc41.jpg,47,,1579781490.0
521,19|F| Hello fellow Roasters,689,esntah,RoastMe,https://i.redd.it/j56oaswybgc41.jpg,526,,1579780706.0
522,"My friend, 25 year old CMA, has thick skin. Give her some roast reddit!",22,esnsru,RoastMe,https://i.redd.it/91ob3hlqbgc41.jpg,87,,1579780634.0
523,"18 yo stud, senior in highschool, 11 notches.",59,esnald,RoastMe,https://i.redd.it/7lvlvyzn4gc41.jpg,298,,1579778257.0
524,I'm fucked up and bored destroy me mere then my lover has,5,esm4u1,RoastMe,https://i.redd.it/y0uton2gpfc41.jpg,68,,1579773131.0
525,Do your worst Reddit,10,esm0nj,RoastMe,https://i.redd.it/1wj6uepwnfc41.jpg,53,,1579772622.0
526,Super Senior. Not sure what I'm doing with my life. Get this over with.,5,esm03u,RoastMe,https://i.redd.it/vidi1uvnnfc41.jpg,47,,1579772556.0
527,May Mr. Peanut rot in hell where he belongs. Roast me day 22/366,15,esllr8,RoastMe,https://i.imgur.com/2TK4iQS.jpg,90,,1579770765.0
