,title,score,id,subreddit,url,num_comments,body,created
701,"I play professional soccer and work out 5 times a week, good luck bitches",1,erinvw,RoastMe,https://i.redd.it/0qpx332qozb41.jpg,102,,1579579179.0
702,I'm too average to be roasted,12,eribx3,RoastMe,https://i.redd.it/5wpp7bvtkzb41.jpg,73,,1579577882.0
703,New year new look. 2019 vs 2020,16,eri5q7,RoastMe,https://i.redd.it/hklggq0xizb41.jpg,83,,1579577225.0
704,"18M, thinking I'm pretty hot. Take me down a notch.",0,eriaji,RoastMe,https://i.redd.it/86eja4pekzb41.jpg,2,,1579577731.0
705,Let em’ rip,10,erhljr,RoastMe,https://i.redd.it/5un78538czb41.jpg,72,,1579574976.0
706,Just lost my job and my girlfriend. Need some roasts to feel better.,24,erhfs3,RoastMe,https://i.redd.it/jxrd4nj9azb41.jpg,191,,1579574341.0
707,Show me what you can do,11,erh4n0,RoastMe,https://i.redd.it/bazcyswj6zb41.jpg,65,,1579573076.0
708,Let me have it,14,erh9zm,RoastMe,https://i.redd.it/pofv9lbc8zb41.jpg,92,,1579573674.0
709,"25 and newly single because I have the emotional capacity of a 5year old. Please, make me wanna die more.",10,ergu04,RoastMe,https://i.redd.it/cws5nsi53zb41.jpg,35,,1579571923.0
710,Do your worst please. I'm really bored,17,ergsz0,RoastMe,https://i.redd.it/7g112hys2zb41.jpg,129,,1579571809.0
711,"Removed... 4th time is the charm, fuck us up!",2,ergoc0,RoastMe,https://i.redd.it/s69po96a1zb41.jpg,17,,1579571297.0
712,My friend 18(M) wanted a good roast. He's really awkward and girls are his worst enemy.,6,ergn94,RoastMe,https://i.redd.it/e8ssvgsx0zb41.jpg,43,,1579571179.0
713,"18, aviation major.",7,erg2gn,RoastMe,https://i.redd.it/2kmwuxl7uyb41.jpg,35,,1579568915.0
714,18M Already want to drop off the planet. And my best friends thinks I want to bang his girl. So do your worst.,5,erg2w8,RoastMe,https://i.redd.it/nvdzu7xbuyb41.jpg,51,,1579568959.0
715,My bf is trying to prove that he has bigger balls than me and my friend. Pls make him cry!,25,erfeh6,RoastMe,https://i.redd.it/h297gdo3myb41.jpg,160,,1579566219.0
716,I dont even care,49,ereoyu,RoastMe,https://i.redd.it/xae9kyg7dyb41.jpg,138,,1579563200.0
717,I'm 40 today and living a dream!! I will only respond to the roasts I actually laugh at! Lets do this reddit!!,36,erelgo,RoastMe,https://i.redd.it/ibcv2apvbyb41.jpg,111,,1579562759.0
718,My friend thinks he's smart shit. Roast him for a good birthdays present.,8,eregea,RoastMe,https://i.redd.it/j9k54ts38yb41.jpg,45,,1579562111.0
719,let me have it,10,ere7l0,RoastMe,https://i.redd.it/00vm81zl6yb41.jpg,40,,1579560979.0
720,My Co-worker has never been roasted before. She thinks she can handle it. Don’t hold back!,12,ercl7a,RoastMe,https://i.redd.it/uf72sc52gxb41.jpg,73,,1579552051.0
721,Roast my roommate,11,ercu9p,RoastMe,https://imgur.com/wwcGxAD,44,,1579553660.0
722,Today is my 18th birthday! Make me regret living this long.,45,ercdgg,RoastMe,https://i.redd.it/1au5kratbxb41.jpg,225,,1579550623.0
723,I am from Russia. Hard roast me.,13,erc1eq,RoastMe,https://i.redd.it/37g57m915xb41.jpg,65,,1579548344.0
724,"Make me day interesting, happy roasting!!!",9,erc28h,RoastMe,https://i.redd.it/86t8gdch5xb41.jpg,41,,1579548501.0
725,"It's 3 AM, fuck me up",15,erc29w,RoastMe,https://i.redd.it/40acnkke5xb41.jpg,68,,1579548507.0
726,"Mr potato head here, roast him like an aunt bessy...",16,erbi7p,RoastMe,https://i.redd.it/i231lqmztwb41.jpg,47,,1579544636.0
727,"My younger brother. 18. Doesnt get any allowance. Had been asking me change money every now and then since past few months, and later revealed that it was mostly for buying condoms to screw his girlfriend. Roast this broke mofos ass to bits.",10,era8xx,RoastMe,https://i.redd.it/0a7m69244wb41.jpg,40,,1579535926.0
728,23 year old law student and swimmer. Give me your best.,8,erbb2i,RoastMe,https://i.redd.it/0vfqsgxwpwb41.jpg,41,,1579543258.0
729,"We’ve been friends for 7 years, break the friendship",28284,erb110,RoastMe,https://i.redd.it/f9zlhsdsjwb41.jpg,4204,,1579541203.0
730,18/ Indian.,5,er9ujf,RoastMe,https://i.redd.it/lpt54xpqwvb41.jpg,33,,1579533449.0
731,"2nd roast, first was disappointing. So let's start again.",0,era88e,RoastMe,https://i.redd.it/1issj72r3wb41.jpg,23,,1579535809.0
732,Need a hit to my ego. Do your worst!,5,erac00,RoastMe,https://i.redd.it/n57cvf6q5wb41.jpg,36,,1579536478.0
733,"Make me become like Australia, roasted",0,eraeem,RoastMe,https://i.redd.it/8qmjpkoz6wb41.jpg,29,,1579536894.0
734,This my buddy who doesn’t know what reddit is. I showed him this r/ but he thinks all of you are soft..,10,er97vi,RoastMe,https://i.redd.it/apg9pv5mlvb41.jpg,49,,1579529705.0
735,24 y/o Computer Networking student struggling financially and with life kick me while I'm down!,12,er90v5,RoastMe,https://i.imgur.com/STHA3LG.jpg,68,,1579528640.0
736,"Bring it on y’all, I’m bored",8,er88f8,RoastMe,https://i.redd.it/xn44ixxv5vb41.jpg,38,,1579524416.0
737,"Been thinking on this for about a month now, have at it folks",10,er8m93,RoastMe,https://i.redd.it/j1vat9zxbvb41.jpg,46,,1579526453.0
738,21 year old physics major who has nothing to do tonight (or any night) due to an alcohol sensitivity. Show me what you’ve got.,7,er7klj,RoastMe,https://i.redd.it/qf79cbu1wub41.jpg,43,,1579521107.0
739,If I thought y’all could take me down pull me down from this high I would have never post,12,er7l10,RoastMe,https://i.redd.it/7g6pcp28wub41.jpg,57,,1579521166.0
740,"I have a sinus and an ear infection right now, make me feel worse",46,er7ivl,RoastMe,https://i.redd.it/cu94tcsbvub41.jpg,101,,1579520865.0
741,"Time for the roaster to become the roasted. Hit me with everything you guys got. 30y, Pittsburgher, mechanic.",14,er7jg4,RoastMe,https://i.redd.it/va6perikvub41.jpg,52,,1579520949.0
742,"Buddy of mine thinks he’s unroastable, never graduated high school, lifer at the local factory, easily attached to women.",9,er7a5v,RoastMe,https://i.redd.it/yo7wornvrub41.jpg,56,,1579519706.0
743,Yes yes I’m Indian. What else is roast-able?,15,er70on,RoastMe,https://i.redd.it/rl19wntwnub41.jpg,81,,1579518370.0
744,Two old friends going for a beer,8,er6d90,RoastMe,https://i.redd.it/phpkajgdeub41.png,17,,1579515164.0
745,Finally starting to feel like I look good. Keep me humble Reddit!,8,er6rq6,RoastMe,https://i.redd.it/a2oqoec7kub41.jpg,64,,1579517136.0
746,20 y/o 5’10 Latina who’s mom genuinely wishes was never born. I wanna see if you nerds can make my self-esteem any lower than it already is uwu,218,er6py5,RoastMe,https://i.redd.it/vuyj2fhkjub41.jpg,361,,1579516910.0
747,i’ve had the gosha sweatshirt for 24 hours. my ego is the size of the moon. destroy me.,19,er6do2,RoastMe,https://i.redd.it/gaq8fa7jeub41.jpg,69,,1579515216.0
748,Shaved half my face for shits and giggles. Roast me.,6,er66im,RoastMe,https://i.redd.it/wmmh4pnrbub41.jpg,50,,1579514288.0
749,I'm a tad hungover and I also think I gave myself a concussion last night. Roast me day 19/366,12,er60j9,RoastMe,https://i.imgur.com/8r0QqFw.jpg,51,,1579513455.0
750,I want to be a mechanic when I grow up :),10,er5udg,RoastMe,https://i.redd.it/v3dteedt6ub41.jpg,111,,1579512620.0
751,"I'm 22, married, and I have to ask permission to buy a video game. Roast me.",19,er5ve4,RoastMe,https://i.redd.it/6ijm38887ub41.jpg,64,,1579512759.0
752,Don’t hold back boys,2,er5jjg,RoastMe,https://i.redd.it/km9hntsj2ub41.jpg,69,,1579511187.0
753,"I cry in the shower and have no redeeming qualities as a person, roast me:-)",50,er5gtm,RoastMe,https://i.redd.it/meo5y76g1ub41.jpg,140,,1579510823.0
754,Yooo im turnt right now nothing will hurt.😂😂😂,8,er5dad,RoastMe,https://i.redd.it/qls1m0c00ub41.jpg,39,,1579510332.0
755,About to start a workout regime to lose weight! Roast my fatass so i can eat ice cream instead,6,er58sw,RoastMe,https://i.redd.it/naziqz58ytb41.jpg,69,,1579509733.0
756,"A friend decided to give it a go, give him your best!",6,er4x1v,RoastMe,https://i.redd.it/cg70k99ottb41.jpg,48,,1579508207.0
757,Posted my friend so time to burn me too.,2,er4g6x,RoastMe,https://i.redd.it/n5ucnpf4ntb41.jpg,27,,1579506002.0
758,Roaster becoming a roastee,7,er40b7,RoastMe,http://imgur.com/a/0hSojBk,21,,1579504006.0
759,The Stu man needs a good roasting,7,er4ed6,RoastMe,https://i.redd.it/wvgixteemtb41.jpg,38,,1579505764.0
760,"My friend isn’t a monk, you just can’t see his man bun",23,er3y7w,RoastMe,https://i.redd.it/fonih33hgtb41.jpg,65,,1579503766.0
761,Took me way to long to grow this mistake,8,er3pc0,RoastMe,https://i.redd.it/4ejemtq6dtb41.jpg,63,,1579502658.0
762,29/F,7,er3k37,RoastMe,https://imgur.com/a/WraFW1D,43,,1579502034.0
763,Have fun!,10,er3jyd,RoastMe,https://i.redd.it/avbjk257btb41.jpg,39,,1579502013.0
764,I'm ready,56,er3h7a,RoastMe,https://i.redd.it/axth8hfcatb41.jpg,234,,1579501701.0
765,"Doing this for a video, hit me as hard as yall can",3,er3hfp,RoastMe,https://i.redd.it/or2y3jweatb41.jpg,44,,1579501725.0
766,Don’t hold back,10,er38sa,RoastMe,https://i.redd.it/pkg1mlxe7tb41.jpg,44,,1579500715.0
767,Today's my 31st. Go ahead and try ruining it.,14,er2xdu,RoastMe,https://i.redd.it/9ovyq7yf3tb41.jpg,31,,1579499380.0
768,This is my cousin. She only heard about roastme today cause she’s been too busy watching Terrace House. Show her what you got; she asked for it,7,er2xu0,RoastMe,https://i.redd.it/9i5ra07l3tb41.jpg,43,,1579499431.0
769,My friend wanna be roasted. Do him,7,er2zhv,RoastMe,https://i.redd.it/gsflvoq64tb41.jpg,38,,1579499631.0
770,"Like my love of pork products, roast me.",40,er27yv,RoastMe,https://i.redd.it/9ccwl06uusb41.jpg,135,,1579496486.0
771,My girlfriend doesn’t think you guys are very funny. Please show her,41,er23c8,RoastMe,https://i.redd.it/mp8caeb8tsb41.jpg,150,,1579495948.0
772,We can be gay for pay. But other days we truck riding besties! Roast us the best you can you wet wipes!,10,er1sum,RoastMe,https://i.redd.it/rxpnbhnkpsb41.jpg,51,,1579494721.0
773,Punishment for last place in fantasy football. Let him have it.,7,er1qtv,RoastMe,https://imgur.com/Qt1Oxuh,32,,1579494480.0
774,"19 year old Metal head English student from the UK, can’t hate myself more so do your worst",10,er1d51,RoastMe,https://i.redd.it/39ldg1k0ksb41.jpg,42,,1579492847.0
775,"19 year old marketing student from Flanders who likes to go out with friends and drinks a bit too much beer, likes games and is hopelessly looking for a girlfriend. Do your worst.",15,er12r1,RoastMe,https://i.redd.it/kut3omfdgsb41.jpg,81,,1579491621.0
776,Fuck me up,129,er0xk0,RoastMe,https://i.redd.it/ptb0eqciesb41.jpg,288,,1579490995.0
777,Finished last in my fantasy football league. Hopefully your roasts are better than my team's performance this season.,27,er0pqw,RoastMe,https://i.redd.it/rye6748lbsb41.png,67,,1579490105.0
778,Do your worst,10,er04qd,RoastMe,https://i.redd.it/9dqh44lf4sb41.jpg,66,,1579487632.0
779,18f. I’ll give y’all more to roast this time (Now with complete appendages!),97,eqz6x2,RoastMe,https://i.redd.it/d9766k0bsrb41.jpg,182,,1579483531.0
780,Let's see what y'all got,15,eqyo2i,RoastMe,https://i.redd.it/oc580tpnlrb41.jpg,35,,1579481311.0
781,"19, Bf left me this week saying he hasn't loved me for weeks, he bought this $260 ring for me recently as well, I'm in a world of hurt and confusion (see a previous post if you're curious), otherwise do your worst, bet you can't.",48,eqxixs,RoastMe,https://i.redd.it/j1r2351f6rb41.jpg,206,,1579476174.0
782,Shatter my self-esteem after I tried trimming my beard and ended up shaving all of it.,166,eqww93,RoastMe,https://i.redd.it/q0s234szwqb41.jpg,246,,1579473009.0
783,I ran over a frog. It didn't sound nice :/,89,eqwc93,RoastMe,https://i.redd.it/b5yyzz02oqb41.jpg,170,,1579470023.0
784,Inspiring Rapper. Roast Me. (P.S. Might respond to someone with a disstrack),17,eqv81e,RoastMe,https://i.redd.it/kdddeqd91qb41.jpg,80,,1579462333.0
785,Bored on 24hr staff duty. Hit me with your worst!,59,equirr,RoastMe,https://i.redd.it/iiaa58sqkpb41.jpg,118,,1579456774.0
786,"Practical software engineer student, show me your worse redditors!",9,equ6la,RoastMe,https://i.imgur.com/WAHO6x5.jpg,75,,1579454173.0
787,"Roast my friend, if you can !!",6,equ5o4,RoastMe,https://i.redd.it/eylswmxfcpb41.jpg,50,,1579453981.0
788,I’m board roast me till you smell bacon,12,eqtp8q,RoastMe,https://i.redd.it/a8rty4tz1pb41.jpg,55,,1579450467.0
789,"22 (M) Specializes in pulling white women, roast him",17,eqt7gj,RoastMe,https://i.redd.it/vik25usoqob41.jpg,83,,1579446704.0
790,roast this bitch,11,eqss2t,RoastMe,https://i.redd.it/cue2iiyjgob41.jpg,43,,1579443255.0
791,22M. Ugly and stupid af. Highly self-hatred. Literally a total loser. Wanna know myself more with the help of you guys. Do your worst.,39,eqs7fq,RoastMe,https://i.redd.it/mvuq7tce5ob41.jpg,112,,1579439503.0
792,"Just ate ribs. Fuck it, this should be easy",11,eqs13q,RoastMe,https://i.redd.it/m8w4n0742ob41.jpg,84,,1579438410.0
793,Just a mere mortal with a couple extra chromosomes,7,eqrhvd,RoastMe,https://imgur.com/a/2aaXf4n,28,,1579435271.0
794,"Diabetic college dropout, struggling with my music. Roast me!",209,eqrhj1,RoastMe,https://i.redd.it/nyukp0onsnb41.jpg,347,,1579435217.0
795,my buddies been standing here hiding reddit. show him your wrath,5,eqqp1g,RoastMe,https://i.redd.it/lkburhwmfnb41.jpg,30,,1579430839.0
796,I’m a mechanic adult virgin. Roast me!,7,eqql8a,RoastMe,https://i.redd.it/vofoebqwdnb41.jpg,62,,1579430257.0
797,"this girl thinks she cute, she’s 21 wearing cheetah print... give it to her",12,eqqdq2,RoastMe,https://i.redd.it/fmlnv35nanb41.jpg,100,,1579429159.0
798,"my buddies dad said you’re all too soft, let his old ass hear it",15,eqq5la,RoastMe,https://i.redd.it/p9u28em27nb41.jpg,67,,1579427959.0
799,my buddy’s gf said reddit is to weak to roast her. get her fellas,55,eqpzak,RoastMe,https://i.redd.it/rpelu6ka4nb41.jpg,151,,1579427024.0
800,"my buddy looks like triple H on crack, but he said you guys don’t have shit on him. let him have it",18,eqpvvq,RoastMe,https://i.redd.it/933x5vdt2nb41.jpg,82,,1579426528.0
801,"all American, what can you say?",7,eqprh1,RoastMe,https://i.redd.it/44ygyty11nb41.jpg,50,,1579425936.0
802,"My football team is trash and so is my fantasy football team. This is my punishment for loosing, have fun.",14,eqpqs6,RoastMe,https://i.redd.it/s7z50mms0nb41.jpg,62,,1579425847.0
803,"19 y/o Environmental Studies major. Yes, that is the wax paper from a pizza box. Do your worst, i’m a big boy now.",2,eqpi8r,RoastMe,https://i.redd.it/r9ic0fudxmb41.jpg,38,,1579424700.0
804,"my friend thinks he could beat connor and the cowboy tonight no problem, give it to him",7,eqpm9g,RoastMe,https://i.redd.it/63up5h6zymb41.jpg,34,,1579425237.0
805,No fancy title. Just roast me!,155,eqozq0,RoastMe,https://i.redd.it/6tgjb9mwpmb41.jpg,353,,1579422192.0
806,“I’m disturbed. I’m depressed. I’m inadequate. I got it all!” Roast me Day 18/366,0,eqovzq,RoastMe,https://imgur.com/a0SDNY7,11,,1579421701.0
807,Heard you were fairly mediocre at this roasting thing.. what cha got?,8,eqoite,RoastMe,https://i.imgur.com/Xf1tQwe.jpg,55,,1579420012.0
808,Im having a good day you know what to do,5,eqom0l,RoastMe,https://i.redd.it/wscdjgankmb41.jpg,64,,1579420418.0
809,"this is my friend eric, he recently got his nose pierced and thinks his “swag” is unmatched. do your worst",6,eqo9ze,RoastMe,https://i.redd.it/tek5uwy6gmb41.jpg,50,,1579418920.0
810,Shaved my head about a month ago for charity. Can barely talk to people in public and rarely leave the house. Do your worst!,21,eqnya6,RoastMe,https://i.redd.it/kifzf1gtbmb41.jpg,48,,1579417449.0
811,Hope your roasts are better than his Fantasy Football managing skills!,32,eqnvq3,RoastMe,https://i.imgur.com/mkL8bKY.jpg,62,,1579417138.0
812,My father wants to be roasted; 56 year old dude in a motorcycle club. Retired CO and current high school security guard. Please roast his ass.,73,eqn5s0,RoastMe,https://i.redd.it/3j739tkh1mb41.jpg,107,,1579413978.0
813,Just a couple of guys looking for a good time!,15,eqn2op,RoastMe,https://i.redd.it/dicyvued0mb41.jpg,75,,1579413601.0
814,"Took this ages ago, finally got around to posting it. Bet you I’m better at insulting myself than you are",11,eqn1ir,RoastMe,https://i.redd.it/zk5pe78yzlb41.jpg,70,,1579413465.0
815,I’m the only person in my friend group that didn’t kiss a girl in 2019. Roast me,11,eqn1ib,RoastMe,https://i.redd.it/lvrzo6wyzlb41.jpg,63,,1579413463.0
816,"Weird ass , meme lord , edgy lord , 18yr old , rock /semi goth boi. Roast me wigga...",0,eqmi9h,RoastMe,https://i.redd.it/a2be5rywslb41.jpg,67,,1579411106.0
817,"I’m the stud your parents warned you about, roast me",24,eqm7hg,RoastMe,https://i.redd.it/r0kutzwyolb41.jpg,88,,1579409764.0
818,"Lost my Fantasy Football league. Send me to the shadow realm, Kid...",7,eqm9ux,RoastMe,https://i.redd.it/g3bn6dokplb41.jpg,47,,1579410051.0
819,25 and just got kicked out of moms house. Life is about to get hard.,41,eqlxrx,RoastMe,https://i.redd.it/e40908mbllb41.jpg,84,,1579408551.0
820,18m selling hotdogs for a living never had a gf also a breaking bad fan.,7,eqlrf5,RoastMe,https://i.redd.it/42eoh8nyilb41.jpg,27,,1579407751.0
821,Our friend is asking us to rate him on a scale of 1 - 10 but he said he's ok with getting roasted. Help us out reddit!,1,eqlafc,RoastMe,https://i.redd.it/vk6z29dqclb41.jpg,33,,1579405648.0
822,"I’m studying criminal justice, and yes I actually have autism. I really need to get roasted right now, do your worst!",35,eqlfdo,RoastMe,https://i.redd.it/glrdlaxhelb41.jpg,72,,1579406244.0
823,"Take 2, apparently I need arms. Old and falling apart, do your worst internet.",7,eqldr2,RoastMe,https://i.redd.it/j8vaz88wdlb41.jpg,51,,1579406041.0
824,"18, I left my favela for this. Make it good.",25,eqkv8f,RoastMe,https://i.redd.it/jcqffeu97lb41.jpg,76,,1579403817.0
825,23 y/o who spends most of his time playing video games and working. Socially awkward and I hate when people try to start random conversation with me. Roast away and make me wanna crawl back in the hole I came out of.,9,eqkrgy,RoastMe,https://i.redd.it/9i7pqk6z5lb41.jpg,38,,1579403379.0
826,"I'm currently at a Magic: the Gathering tournament, shock me for 2.",16,eqkkxk,RoastMe,https://imgur.com/tYXRWl3,47,,1579402621.0
827,"Felt cute, might cry later. Roast us",57,eqkboh,RoastMe,https://i.redd.it/5klgjklg0lb41.jpg,154,,1579401547.0
828,"Rough childhood, no friends, pathetic job... Do your worst",8,eqkmue,RoastMe,https://i.redd.it/5ux6dsxd4lb41.jpg,26,,1579402843.0
829,Ok round 2. We're brothers. Roast us.,17,eqk0km,RoastMe,https://i.redd.it/v0daa5lmwkb41.jpg,76,,1579400245.0
830,"Welp, here I go. Roast the MarioLord14. Or are y’all too scared?",17,eqk7rw,RoastMe,https://i.redd.it/7ow82km4zkb41.jpg,105,,1579401074.0
831,"23, professional squirrel washer.... not as easy as you think....roast me",14,eqk2hp,RoastMe,https://i.redd.it/usrkbszbxkb41.jpg,25,,1579400469.0
832,"I may be dark, but i like them pale.",14,eqk2y0,RoastMe,https://i.redd.it/d7ey498hxkb41.jpg,52,,1579400519.0
833,36. IQ of 162. Roast me.,9,eqjw5q,RoastMe,https://i.redd.it/c3h559m4vkb41.jpg,78,,1579399732.0
834,I don't deserve self-esteem. Destroy what little I have left.,9,eqjnfh,RoastMe,https://i.redd.it/ewril3q4skb41.jpg,64,,1579398720.0
835,"20 y/o fat cunt, roast me bois and gals. Btw i got banned on twitch for drinking",125,eqjivv,RoastMe,https://i.redd.it/elthyxxeqkb41.png,164,,1579398153.0
836,"Life is good, RoastMe G",13,eqjcdi,RoastMe,https://i.redd.it/8p6pu152okb41.jpg,41,,1579397351.0
837,My father wanted to be on R/RoastMe. Have fun!,20,eqjeyb,RoastMe,https://i.redd.it/xywtlikwokb41.jpg,86,,1579397674.0
838,Do I look like a roasted chicken ?,5,eqikmt,RoastMe,https://i.redd.it/8jauljbyekb41.jpg,55,,1579394311.0
839,"18. Dream is to become a music producer. Downvoted to oblivion the last 2 times I was here, but 3rd time's a charm??",0,eqiipx,RoastMe,https://i.redd.it/9xhoj4n1ekb41.png,29,,1579394062.0
840,"26, There's definitely something about my face that people don't like",58,eqgowa,RoastMe,https://i.redd.it/5czddsoomjb41.jpg,198,,1579384786.0
841,"Be kind to me, or treat me mean.",6,eqfrgc,RoastMe,https://i.redd.it/jf18qpf15jb41.jpg,34,,1579378847.0
842,"18, high school student, destroy me",6,eqgb7o,RoastMe,https://i.redd.it/xufd1p0wfjb41.jpg,40,,1579382498.0
843,"19, have to leave university because of disease, now working as a repairman. Doubt about what will be with my future. Reddit, do your best",25,eqfyga,RoastMe,https://i.redd.it/mwuz78hx8jb41.jpg,81,,1579380166.0
844,Global..roast me,10,eqf5b7,RoastMe,https://i.redd.it/4b4440drrib41.jpg,29,,1579374386.0
845,Do it Reddit,2,eqf6ih,RoastMe,https://i.redd.it/a9kw17vfsib41.jpg,12,,1579374621.0
846,"If you have any complaints on our services this is the man to talk to, have at him.",11,eqe05x,RoastMe,https://i.redd.it/fm8vuc1f1ib41.jpg,64,,1579365563.0
847,"19, not in school and have been working at starbucks for way too long, cook me",23,eqdwmy,RoastMe,https://i.redd.it/e5m3gqf7zhb41.jpg,34,,1579364779.0
848,"23 and still asked for id card everytime I try to buy a drink and today a coworker told me my hair looked like someone poured ink on the top of my head, be savage",560,eqdqgn,RoastMe,https://i.redd.it/kzd78ep5vhb41.jpg,281,,1579363418.0
849,"fellow employee ""took a tab, died, became god"" now risen and ready for his roast",6,eqdnul,RoastMe,https://i.redd.it/l7pdb61dthb41.jpg,27,,1579362852.0
850,Failed 32 year old entrepreneur doing the Ryan Holiday challenge.,2,eqd0u3,RoastMe,https://i.redd.it/u2ilvpiffhb41.jpg,28,,1579358153.0
851,Giving y'all the awkward white person smile. I also always wear airpods and have a chinese character tattoo. Please roast me,18,eqcyv6,RoastMe,https://i.redd.it/g6bejjt3ehb41.jpg,64,,1579357760.0
852,"My friend and I are participating in Ryan Holiday’s 21 day stoic challenge. This is my friend, pls roast his ass",3,eqcj8j,RoastMe,https://i.redd.it/mcqbso2q5hb41.jpg,43,,1579354870.0
853,I'm a YouTuber with 45 subs. Hoping to be big one day. Expect a reaction video to this so make it good.,0,eqc6cq,RoastMe,https://i.redd.it/oyfju740zgb41.jpg,31,,1579352644.0
854,"I’m a student, insecure about my lifestyle, hoping for a new start",4,eqc2yp,RoastMe,https://i.redd.it/me8purtexgb41.jpg,35,,1579352077.0
855,"25 year old who has never had a girlfriend, tell me why.",15,eqc27g,RoastMe,https://i.redd.it/5w898me2xgb41.jpg,68,,1579351953.0
856,"(20M) Jarhead, my childhood friend, roast him too while we're at it.",4,eqbws4,RoastMe,https://i.redd.it/5fk0d4uaugb41.jpg,29,,1579351032.0
857,"these are their wives, my mom and her best friend. roast them too.",9,eqbw98,RoastMe,https://i.redd.it/kro3c891ugb41.jpg,53,,1579350940.0
858,Make me feel bad,5,eqbn9k,RoastMe,https://i.redd.it/as881jompgb41.jpg,38,,1579349451.0
859,"the arm in the picture was this guy, my dads best friend, roast him.",8,eqbtes,RoastMe,https://i.redd.it/xynrjvdnsgb41.jpg,51,,1579350477.0
860,roast my dad please,21,eqbi0x,RoastMe,https://i.redd.it/82k6eta3ngb41.jpg,62,,1579348621.0
861,First post on Reddit. Roast me.,2,eqb60w,RoastMe,https://i.redd.it/1uq9mmoihgb41.jpg,24,,1579346726.0
862,Do your worst!,9,eqb1us,RoastMe,https://i.redd.it/4wn6fvfmfgb41.jpg,75,,1579346087.0
863,Four dudes with too much self confidence. Humble us.,23,eqazzv,RoastMe,https://i.redd.it/awkucw4segb41.jpg,62,,1579345805.0
864,I am from Australia and think you are all peasants,19,eqarek,RoastMe,https://i.redd.it/tj3bzq7yagb41.jpg,80,,1579344517.0
865,Are y’all digging the stash?,3,eqarme,RoastMe,https://i.redd.it/beql8m02bgb41.jpg,38,,1579344553.0
866,Too much studying need some roast,231,eqasqe,RoastMe,https://i.redd.it/f4hsxvmibgb41.jpg,294,,1579344711.0
867,First month on the job feeling pretty good someone put me down,19,eqan8r,RoastMe,https://i.redd.it/uigrxsf19gb41.jpg,70,,1579343874.0
868,Let's see how this goes.,11,eqaket,RoastMe,https://i.redd.it/oll1m3qs7gb41.jpg,75,,1579343455.0
869,Woke up from a nap on my birthday do ya thing,8,eqai87,RoastMe,https://imgur.com/frds28j,62,,1579343133.0
870,"I say 'crick,' instead of 'creek'",5,eqaano,RoastMe,http://imgur.com/a/cTHidpE,19,,1579342003.0
871,Roast her harder than the food she just over cooked,72,eq9y7c,RoastMe,https://i.redd.it/7qisokb2yfb41.jpg,185,,1579340191.0
872,"Hey, I’m an 18 stone 18 year old. I’ve got thicker skin then a blue whale so nothing you will say can hurt. Unless.... do your worst reddit.",1,eq9or2,RoastMe,https://i.redd.it/0hhmdus1ufb41.jpg,45,,1579338835.0
873,"Felt cute, good luck trying to roast me internet!",6,eq9o1o,RoastMe,https://i.redd.it/m8l505qltfb41.jpg,22,,1579338732.0
874,"About to go bed after a long day of doing nothing, roast me!",8,eq9npa,RoastMe,https://i.redd.it/slxlmscltfb41.jpg,15,,1579338694.0
875,"21M ,my friend is studying to be a pilot",3,eqaeuw,RoastMe,https://i.redd.it/ei4jr5xa5gb41.jpg,31,,1579342622.0
876,Roast me... hard working 18 year old cant get none,11,eq9llq,RoastMe,https://i.redd.it/77n9u31psfb41.jpg,49,,1579338378.0
877,"6'7"" 400lbs and just found out I dont need insulin anymore. Do what diabetes couldnt",403,eq9jed,RoastMe,https://i.redd.it/ap8fsensrfb41.jpg,214,,1579338074.0
878,"We all know that I have Daddy issues, so let's try to be a little more original than that.",10,eq9i37,RoastMe,https://i.redd.it/3u6q2n4arfb41.jpg,136,,1579337899.0
879,I am trash at fantasy football. This is my punishment. Get after it.,10,eq9fvl,RoastMe,https://i.redd.it/h41qep1dqfb41.jpg,24,,1579337590.0
880,"21M | my friend liked the idea of being roasted, destroy him",9,eq9aay,RoastMe,https://i.redd.it/4kbceh30ofb41.jpg,62,,1579336799.0
881,Destroy me. Ain’t got much to live for.,8,eq90o9,RoastMe,https://i.redd.it/ib6ndef1kfb41.jpg,62,,1579335467.0
882,leaving for work. roast me.,177,eq8yht,RoastMe,https://i.redd.it/qjp8gxh3jfb41.jpg,372,,1579335148.0
883,Me and my roommate. Rolled my ankle last weekend while skating. Make it harder for us to live than it was for me to stand for this picture,7,eq9292,RoastMe,https://i.imgur.com/6C410LV.jpg,45,,1579335684.0
