,title,score,id,subreddit,url,num_comments,body,created
0,26yr old socially awkward black chick (4'8in) who identifies as a furry,2,evt07j,RoastMe,https://i.redd.it/rav4zaef5sd41.jpg,2,,1580359736.0
1,"Conservative, growing a mullet, cant get a bitch to save my life",0,evsls3,RoastMe,https://i.redd.it/9hdjfm391sd41.jpg,13,,1580358237.0
2,"I´m a 24 F, lesbian with a taste for straight girls. Roast me mofos!",6,evsnxq,RoastMe,https://i.redd.it/d4gjqrko1sd41.jpg,31,,1580358451.0
3,"Relying on this to cure my boredom for tonight, do your worst :)",3,evslel,RoastMe,https://i.redd.it/deap0v851sd41.jpg,27,,1580358197.0
4,Roast my freind,2,evsfcd,RoastMe,https://i.redd.it/ata8ypc9zrd41.jpg,21,,1580357563.0
5,Shaved each other's eyebrows 2 weeks ago,6,evrgrk,RoastMe,https://i.redd.it/j53xklj2ord41.jpg,27,,1580353829.0
6,He really like tacos. Roast’em gang.,8,evrfyz,RoastMe,https://i.redd.it/uj7eigewnrd41.jpg,36,,1580353741.0
7,Ruin my college reputation,14,evr8dq,RoastMe,https://i.redd.it/yk3gu4cdlrd41.jpg,36,,1580352894.0
8,"Me, a 19 yo art student from Germany on my 2nd night without sleep bc of an art project. ROAST THE LIVING SHIT OUT OF ME....",3,evr2he,RoastMe,https://i.redd.it/f01gouqcjrd41.jpg,40,,1580352217.0
9,"My good friend just turned 21 this week... he's already had a celebratory time at the bars last weekend, let's give him some pain for a woeful time at the bars this weekend. He needs to experience both sides of drinking lol",6,evqxsc,RoastMe,https://i.redd.it/o46dn6cjfrd41.png,28,,1580351701.0
10,Coworkers convinced me to do this. Roast me please.,5,evqe9n,RoastMe,https://i.redd.it/gnrkdnn1brd41.jpg,22,,1580349438.0
11,"22YO Mexican dj, aspiring musician, stoner and aeronautical engineering student. Have no mercy",3,evqdy6,RoastMe,https://i.redd.it/2l1tx1zyard41.jpg,14,,1580349403.0
12,Roast me part 2 make me cry atleast😂😂 for a my youtube,0,evq7vz,RoastMe,https://i.redd.it/whl3l2xv8rd41.jpg,49,,1580348694.0
13,I have diabetes. Roast me,1,evqo5y,RoastMe,https://i.redd.it/1htrq2jferd41.jpg,34,,1580350558.0
14,"My friend wants you to roast him, don’t hold back",4,evqspb,RoastMe,https://i.redd.it/9iihm9p1grd41.jpg,35,,1580351115.0
15,Big fan of hot dogs. Roast me!,10,evpsc5,RoastMe,https://i.redd.it/cd5fi62k3rd41.jpg,44,,1580346901.0
16,Let's start the roasting!,9,evo3ds,RoastMe,https://i.redd.it/7p0lwas9hqd41.jpg,35,,1580339406.0
17,Roast us!!,7,evo6rv,RoastMe,https://i.redd.it/xl2hb9wiiqd41.jpg,62,,1580339841.0
18,"Roast my Chad of a flat mate. He’s a diabetic, ADHD, Geology student. He joined the uni rugby team to “get girls”.",4,evp84o,RoastMe,https://i.redd.it/9wsj0bpgwqd41.jpg,21,,1580344518.0
19,"21, Engineering student at a crappy university in a crappy country, dumped by my gf 2.5 week ago and I still love her, hit me as hard as you can so i stop thinking.",1,evp8fc,RoastMe,https://i.redd.it/4uelp9vkwqd41.jpg,21,,1580344554.0
20,"Got tired of my friend roasting me so I came to reddit for a change, go ahead strangers",6,evpgpu,RoastMe,https://i.redd.it/gtue4yygzqd41.jpg,41,,1580345539.0
21,Roast This Punk.,5,evpl88,RoastMe,https://i.redd.it/atu13kv31rd41.jpg,32,,1580346077.0
22,"21yo from hungary, new to reddit, love wearing stupid shirts, do your thing guys",6,evnk3o,RoastMe,https://i.redd.it/iyvt2fnl9qd41.jpg,61,,1580336827.0
23,"RoastMe! I.T. Professional ... heard it all, make this burn memorable!",6,evnzbk,RoastMe,https://i.redd.it/lfoz94hofqd41.jpg,64,,1580338873.0
24,19M I just failed my midterm with a 37 ez,0,evog9t,RoastMe,https://i.redd.it/453vni96mqd41.jpg,22,,1580341058.0
25,"I have an unsuccessful attempt at being an eSports Pro, currently broke and failed one of my modules at uni. Make it hurt.",4,evova8,RoastMe,https://i.redd.it/fn4t9y5prqd41.jpg,41,,1580342915.0
26,This is my friend. Roast her down to the grave!,4,evoy8s,RoastMe,https://i.redd.it/z8aiur3ssqd41.jpg,38,,1580343280.0
27,I'm the Air Guitar World Champion.,8588,evn0oq,RoastMe,https://i.redd.it/0jv8d3wb1qd41.jpg,1172,,1580334101.0
28,...,5,evm9hd,RoastMe,https://i.redd.it/mnzzogauopd41.jpg,50,,1580329845.0
29,My friends a hippy and used to be a vegan bet you can't roast him,0,evmbq5,RoastMe,https://i.redd.it/l5z03k3yppd41.jpg,35,,1580330225.0
30,First day at IT job,6,evmix3,RoastMe,https://i.redd.it/m3mzyxyctpd41.jpg,53,,1580331377.0
31,i am vape lord zain and i’m single ladies hmu ......don’t tell my gf🤫,0,evmjir,RoastMe,https://i.redd.it/y13flmgntpd41.jpg,22,,1580331471.0
32,Roast me dudes,0,evmot2,RoastMe,https://i.redd.it/858fqnp4wpd41.jpg,35,,1580332301.0
33,im bored in school do it,2,evlcmf,RoastMe,https://i.redd.it/3itie0pw6pd41.jpg,64,,1580323829.0
34,"My friend planned to move to Canada for two years but became broke and is now back in Australia, unemployed. Roast him.",145,evmek3,RoastMe,https://i.redd.it/i4266tz9rpd41.jpg,207,,1580330665.0
35,"Alright, let's have it.",14,evmbp1,RoastMe,https://i.redd.it/zn3pjfkxppd41.jpg,48,,1580330220.0
36,"He thinks he is top shit, please do your worst reddit.",7,evm8cd,RoastMe,https://i.redd.it/73wukqh8opd41.jpg,34,,1580329653.0
37,Today is my birthday. My age and my shirt size are both XL. Set me on fire so I can blow out the candles.,2,evmle5,RoastMe,https://i.redd.it/wjxbwtcjupd41.jpg,51,,1580331763.0
38,"Roast me! 21, have no clue what I’m doing with life and live in constant existential crisis. DO YOUR WORST",20,evlilf,RoastMe,https://i.redd.it/p0r56ewiapd41.jpg,185,,1580325029.0
39,"Father of a 2yo, I haven’t known the blessing of a proper nights sleep in longer than I can remember. Break my already tenuous mental state.",10,evlj1c,RoastMe,https://i.redd.it/8seefbprapd41.jpg,32,,1580325113.0
40,First day at my internship turn me to dust.,26,evlkzi,RoastMe,https://i.redd.it/uyfqz29xbpd41.jpg,83,,1580325514.0
41,Try to be more creative than the bullys at my school.,14,evlovx,RoastMe,https://i.redd.it/vqy4hip4epd41.jpg,80,,1580326244.0
42,"What up Roasters! Fyi I'm not actually Jewish, hence the Fro... avid Rollerblader and Fitness Freak",9,evkd7u,RoastMe,https://i.redd.it/3yjhsy4mkod41.jpg,65,,1580316443.0
43,"Graphic Designer without clients today, roast me.",5,evkdui,RoastMe,https://i.redd.it/4f7nayldlod41.jpg,35,,1580316573.0
44,"Go ahead, do your worst !",6,evkoie,RoastMe,https://i.redd.it/do1qhzwxrod41.jpg,43,,1580318814.0
45,"26, frustrated app developer, without any relationship of more than 1 month, working in a casino",4,evkoz3,RoastMe,https://i.redd.it/x9mm8knbsod41.jpg,27,,1580318912.0
46,You know what to do,7,evksqh,RoastMe,https://i.redd.it/m7vduassuod41.jpg,28,,1580319744.0
47,Just roast me,0,evkuvp,RoastMe,https://i.redd.it/9iut1yn5wod41.jpg,16,,1580320199.0
48,Roast me,1,evkxp5,RoastMe,https://i.redd.it/qfw02yivxod41.jpg,11,,1580320799.0
49,"Trying to get into college, yes I’m an adult, yes I look like a toddler, I still live with my parents, roast me reddit",2,evkxrk,RoastMe,https://i.redd.it/h2r4t25zxod41.jpg,15,,1580320811.0
50,Got some settlement money so I quit my job so I can play video games all day roast me,6,evkyna,RoastMe,https://i.redd.it/sl7dd1miyod41.jpg,44,,1580320991.0
51,High school student from Russia who likes making music and watching Star Wars. Roast me as hard as you can.,23,evk54h,RoastMe,https://i.redd.it/9evvwpk7god41.jpg,83,,1580314837.0
52,Hi I’m big Jan and I like zyns and have a zero tinder success rates but I promise I’m good at some things. I have a big ego but I’m afraid to do acid. Please roast me.,6,evib13,RoastMe,https://i.redd.it/couqa8prind41.jpg,30,,1580303589.0
53,He loves the mullet and thinks nobody can penetrate the mullet skull.,4,evj5em,RoastMe,https://i.redd.it/zirme72axnd41.jpg,31,,1580308470.0
54,He's got to high a self esteem do what you do best Reddit.,2,eviux3,RoastMe,https://i.redd.it/ip7lny06snd41.jpg,24,,1580306752.0
55,"18 year old EMT from Detroit. Gaming nerd (is trash), self proclaimed audiophile, drama nerd. Make me regret being born more than my therapist already knows I do.",2,eviugp,RoastMe,https://i.redd.it/e914kadyrnd41.jpg,45,,1580306678.0
56,"Out of all the hoes I know, I am my favourite. Roast me.",10,evhz0a,RoastMe,https://i.redd.it/94p8me7odnd41.jpg,69,,1580301883.0
57,"22 years old, in my fourth year of studying business management, and my girlfriend thinks she can roast me better than anybody on this sub ever can. Prove me wrong!",5,eviz3s,RoastMe,https://i.redd.it/mzfp6ps5und41.jpg,39,,1580307420.0
58,"20 year old. I'm a 5'2, failure in life. Make me feel worse about myself",1,eviynn,RoastMe,https://i.redd.it/ywl34prxtnd41.jpg,46,,1580307353.0
59,I get roasted daily by friends/coworkers. Let’s see if Reddit can say something that I haven’t heard yet.,24,evis01,RoastMe,https://i.redd.it/9mw1hh4uqnd41.jpg,115,,1580306304.0
60,Crazy drunk indian [19] having bright future in drunk life . Try your worst but you can never be worse than me.,8,evirsj,RoastMe,https://i.redd.it/w97nisepqnd41.jpg,49,,1580306271.0
61,"I'm 23 yo, I wanted to be a musician but gave it up to be a programmer. I 'm brazilian, clumsy and colorblind. Please don't hold back.",8,evhbm0,RoastMe,https://i.redd.it/ufyv9rp04nd41.jpg,75,,1580298634.0
62,"18, flat as a washboard, had my first kiss and first anal in one night. Roast me",92,evhcwa,RoastMe,https://i.redd.it/gupldp6i4nd41.jpg,213,,1580298803.0
63,"Easy target, roast away!",25,evfron,RoastMe,https://i.redd.it/nq13t9k6imd41.jpg,117,,1580291285.0
64,"Shit job. Zero motivation. Classes kicking my ass, I’d like to see you try and kick it harder",27,evfv7x,RoastMe,https://i.redd.it/2va61nxhjmd41.jpg,185,,1580291726.0
65,"Do your worst, I lost my dignity a while ago.",10,evg1hs,RoastMe,https://i.redd.it/xauxd4vtlmd41.jpg,46,,1580292512.0
66,Roast me and my crooked teeth~,5,evg1y4,RoastMe,https://i.redd.it/yu4lvuf0mmd41.jpg,53,,1580292574.0
67,"my BNHA keychain just came in the mail, do your worst.",12,evg2i6,RoastMe,https://i.redd.it/ecwvhde8mmd41.jpg,108,,1580292647.0
68,21 year old with a burning passion for animation and dancing girls. Opinions on my style are appreciated :),73,evfzgd,RoastMe,https://i.redd.it/ti0z1gg2lmd41.jpg,265,,1580292262.0
69,I was going to take the picture in front of a clown painting but I thought one clown was enough. Roast me Day 28/366,16,evg7hc,RoastMe,https://i.imgur.com/tgtFphe.jpg,62,,1580293282.0
70,Rules only apply to cowards and not people who think non-linearly.,11,evf3h4,RoastMe,https://imgur.com/obXdFWA,158,,1580288270.0
71,Just roast me,150,evfnab,RoastMe,https://i.redd.it/wh2nfexggmd41.jpg,230,,1580290708.0
72,I am so much better than all you fools. Change my mind,1,evf6t3,RoastMe,https://i.redd.it/087vcg87amd41.jpg,65,,1580288677.0
73,21 yr old missing my daily mental breakdown.. what do y'all got for me!,31,evcw4p,RoastMe,https://i.redd.it/5hve849qild41.jpg,168,,1580279363.0
74,"Im 40 Unemployable, never been kissed or dated. 2 woman showed me how a vagina works, TransM2F post-op, no money, no job, no home, dropped out of college, can't afford medical support(medicines), clean and sober, Haunted EVP poltergeist stuff and Tinnitus suffer. I'm dead inside",9,evcxeu,RoastMe,https://i.redd.it/il27l2i5jld41.jpg,108,,1580279507.0
75,22. Really into prog metal. Save your porn/pedo stache comments; I've heard them all. Do your worst.,12,eveo69,RoastMe,https://i.redd.it/wh6pebfv3md41.jpg,168,,1580286474.0
76,"Ive been working since 5 this morning, put me to sleep",12,evepk4,RoastMe,https://i.redd.it/fqmarrxa4md41.jpg,71,,1580286628.0
77,"New years resolution was to shave, how am I doing?",15,evevka,RoastMe,https://i.redd.it/tkn7ve2b6md41.jpg,68,,1580287297.0
78,19yo biology student and future prostitute. I masturbate to Greek deities every night. Roast me :D,32,eveh2l,RoastMe,https://i.redd.it/e6x5r9fh1md41.jpg,119,,1580285669.0
79,"19, 6’6, going to work on cargo ships in the near future, fulltime job as a dishwasher and don’t go to school. Toast me.",10,evds3w,RoastMe,https://i.redd.it/gy2azg5xsld41.jpg,47,,1580282790.0
80,Twins: Cousins (I am an identical twin and my cousins are also identical twins),17980,evdazj,RoastMe,https://i.redd.it/pzwqijphnld41.jpg,1096,,1580280964.0
81,"I watch a lot of anime, and play gta 5 on a daily basis, Roast me like a Thanksgiving turkey.",259,evcfkx,RoastMe,https://i.redd.it/1v01w0ljdld41.jpg,461,,1580277618.0
82,"I'm a 30yr old mom of three, married and still don't know what I want to be when I grow up...any ideas?",13,evcbye,RoastMe,https://i.redd.it/4f0rp2eecld41.jpg,126,,1580277234.0
83,"(20) pothead from Georgia, give me what you got",16,evcbor,RoastMe,https://i.redd.it/isre6izacld41.jpg,105,,1580277202.0
84,"Roast my brother, he needs it",3,evc9r9,RoastMe,https://i.redd.it/o5enougpbld41.jpg,32,,1580277000.0
85,2 high school drop outs. All we do is smoke weed and make music all day. Roast us.,100,evccy4,RoastMe,https://i.redd.it/azg8fxxocld41.jpg,325,,1580277333.0
86,20 y/o loser. People never know if they should call me sir or miss,16,evavfk,RoastMe,https://i.redd.it/yd0yrmkrukd41.jpg,114,,1580271304.0
87,I have no friends and never go outside. Roast me!,8,evb3nh,RoastMe,https://i.redd.it/eeuiz0xjxkd41.jpg,106,,1580272242.0
88,Roast my mate,6,evbl4f,RoastMe,https://i.redd.it/0eowqqql3ld41.jpg,38,,1580274274.0
89,23yr old Middle School TA,4,evblar,RoastMe,https://i.redd.it/1b9qaopn3ld41.jpg,43,,1580274294.0
90,"Romanian flatmates, both 6'5'', 21, studying computer science and veterinary medicine (left to right). Do your worst.",27,evbnb6,RoastMe,https://i.redd.it/17m6amn34ld41.jpg,48,,1580274518.0
91,"A hopeful deaf guy, roast me back to the 1950s!",8,evbcza,RoastMe,https://i.imgur.com/YzFqyK7.jpg,63,,1580273342.0
92,We are madly in love but keep secrets from each other.... get us divorced folks!,45,eva4zy,RoastMe,https://i.redd.it/asqbrbuplkd41.jpg,244,,1580268260.0
93,Today is my cake day. Slaughter this animation student,8,eva3ow,RoastMe,https://i.redd.it/x727c33alkd41.jpg,39,,1580268113.0
94,Roast me like the virus,8,eva7yf,RoastMe,https://i.redd.it/mg2a4fjqmkd41.jpg,51,,1580268603.0
95,U wont,3,evaav5,RoastMe,https://i.redd.it/xvvqeubrnkd41.jpg,47,,1580268960.0
96,Nursing student whose getting his m.d in orthopedic trauma surgery. No life outside of school. Do y’all best cuz my 3 brothers probably beat you to it,9,ev9wkz,RoastMe,https://i.redd.it/w77f48qrikd41.jpg,41,,1580267270.0
97,"26 year old white guy that likes astrology, Roast me!!!",16,ev9lok,RoastMe,https://i.redd.it/gc5hpjxzekd41.jpg,83,,1580266001.0
98,"Just another blue haired bitch, SG reject feeling a little too cool 🥶, roast me",44,ev977i,RoastMe,https://i.redd.it/d7pac5tz9kd41.jpg,356,,1580264317.0
99,"I’m 150 pounds, Arab, I like my self.",10,ev8cca,RoastMe,https://i.redd.it/3df2b0j7zjd41.jpg,70,,1580260691.0
100,I'm have been too happy as of late. Please fix.,9,ev8d71,RoastMe,https://i.redd.it/e2tuqzp5zjd41.jpg,52,,1580260777.0
101,"23 y.o., former chainsmoker and alcoholic, usually socially awkward, weeb and underemployed. Clearly I am too happy for my own good.",48,ev7mwi,RoastMe,https://i.redd.it/d7n8ezlqpjd41.jpg,87,,1580257506.0
102,My first time here. Sup,20,ev7ift,RoastMe,https://i.redd.it/dcs4zdz1ojd41.jpg,115,,1580256941.0
103,too hot to be roasted,7,ev79yi,RoastMe,https://i.redd.it/vxxco9a2ljd41.jpg,19,,1580255960.0
104,"I’m 18, 260 lbs, greasy Retard, do your best",21,ev74m4,RoastMe,https://i.redd.it/f78alefzhjd41.jpg,93,,1580254921.0
105,"Two years ago, I failed both chemistry and physics on my first year in health science. Now I study classical piano performance. End me.",14,ev6zlk,RoastMe,https://i.redd.it/kgwnzxv9fjd41.jpg,63,,1580253985.0
106,"6’8 , 125 pounds go all in",104,ev6m85,RoastMe,https://i.redd.it/3votvry3ajd41.jpg,175,,1580252249.0
107,Roast me boizzz!!,11,ev6xnq,RoastMe,https://i.redd.it/6e110l1jejd41.jpg,98,,1580253740.0
108,"21, Junior year of college, upcoming Microsoft intern! Give me some first degree burns!",43,ev6q5f,RoastMe,https://i.redd.it/7e1vtzrlbjd41.jpg,66,,1580252763.0
109,"I am slightly drunk and need entertainment, please roast me til I'm scorched",6318,ev6c92,RoastMe,https://i.redd.it/oqs367vy5jd41.jpg,1743,,1580250856.0
110,"5'6 student from Germany who is into gaming, sports and filmmaking. Roast me harder than my friends.",3214,ev5ueq,RoastMe,https://i.redd.it/zctvulxywid41.jpg,563,,1580248233.0
111,19yo British Autist. Let's see what you've got!,33,ev4syh,RoastMe,https://i.redd.it/9pnrbhqmgid41.jpg,73,,1580242343.0
112,"Whoever gets roasted harder gets a flask of rum. 24h until the contest ends. 1330, 29th of January 2020",16,ev4x0n,RoastMe,https://i.redd.it/ig3dkl5niid41.jpg,84,,1580243013.0
113,"31yo from Russia. I just can’t do anything to the end in my life! Quit good-paying job two months ago because I got bored, wanted to became Unity developer. No one is interested in hiring me. Developed health issues instead. Roast me!",6,ev5qhw,RoastMe,https://i.redd.it/g35lrubdwid41.jpg,51,,1580247629.0
114,Bored at work (20),8,ev5zzw,RoastMe,https://i.redd.it/admme27r0jd41.jpg,45,,1580249105.0
115,Two students who absolutely hate their life. Give us your best shot.,76,ev4uzw,RoastMe,https://i.redd.it/yypk5tbghid41.jpg,91,,1580242686.0
116,20y old studying computer science,7,ev55pe,RoastMe,https://i.redd.it/pmey8m6vmid41.jpg,34,,1580244441.0
117,"25yo, overweight, vitiligo on one of my eyes, working a tech support job, lemme hear it!",18,ev4fiy,RoastMe,https://i.redd.it/d324c5yo9id41.jpg,74,,1580240003.0
118,"Roast me better than the sun in Africa, 33 year old with no future, do your worst.",7071,ev44d0,RoastMe,https://i.redd.it/su2ozncg3id41.jpg,990,,1580237907.0
119,"Sticks and stones can turn me on but words can cut me to the bone. Do your worst, Reddit.",24,ev44f9,RoastMe,https://i.redd.it/ls5vpzug3id41.jpg,73,,1580237917.0
120,I think you know what to do.. (35 m ),367,ev3vdj,RoastMe,https://i.redd.it/w79iw4yuxhd41.jpg,505,,1580236084.0
121,Roast this IB dropout,15,ev19vu,RoastMe,https://i.redd.it/16h67zh2igd41.jpg,53,,1580218607.0
122,"He thinks he is immune to a good roast. ""I dare you, I double dare you modafuka"" says he.",24,ev1wmw,RoastMe,https://i.redd.it/95314xrgtgd41.jpg,57,,1580222444.0
123,Senior year. 18 years old. Jus got a hair cut. I hate it. Do your worst.,15,ev29bm,RoastMe,https://i.redd.it/wlfi046a0hd41.jpg,32,,1580224731.0
124,"His name is Alex, but we call him Ballex. Roast away.",6,ev2sao,RoastMe,https://i.redd.it/qxsmj9h3bhd41.jpg,45,,1580228368.0
125,24th birthday and I’ve finally started to feel good about things. Bring me back down to that cesspool that is reality.,7,ev2mzg,RoastMe,https://i.redd.it/vzgzfw338hd41.jpg,20,,1580227355.0
126,"I've Been here a year ago, but i havent lost my will to live yet, please finish the Job",1,ev2v2e,RoastMe,https://i.redd.it/jxvv1wzqchd41.jpg,18,,1580228923.0
127,27 and life is falling apart. End me quickly,9,ev0ogz,RoastMe,https://i.redd.it/2omxt6q88gd41.jpg,114,,1580215300.0
128,My friend is a bit too happy nowadays. Anything y'all can do to restore equilibrium? ಠ_ಠ,7,ev18mu,RoastMe,https://i.redd.it/bv9l2skghgd41.jpg,31,,1580218402.0
129,31 Australian do your worst.,9,ev1nw0,RoastMe,https://imgur.com/JRo0OlT,58,,1580220902.0
130,"Just turned 18, Internet gremlin and cocky af. Bring me down a notch",2,ev1906,RoastMe,https://i.redd.it/4z08ka4ihgd41.jpg,33,,1580218460.0
131,On top of the world. Take me down a peg!,11,ev0p86,RoastMe,https://i.redd.it/lpto5xvk8gd41.jpg,85,,1580215414.0
132,Bring it on.,6,ev09kt,RoastMe,https://i.redd.it/t96fp2sq1gd41.jpg,26,,1580213136.0
133,18 yo High School Dropout// eradicate what little self confidence I have left,6,euzlmb,RoastMe,https://i.redd.it/yrzknnj3sfd41.jpg,58,,1580209871.0
134,Fire away,12,euzmsl,RoastMe,https://i.redd.it/jfflxyaisfd41.jpg,52,,1580210013.0
135,Roast me,19,euzmwk,RoastMe,https://i.redd.it/lnou3bgksfd41.png,40,,1580210031.0
136,"Getting my art degree this year, so /r/roastme",38,euzp57,RoastMe,https://i.redd.it/bvac6r6ftfd41.jpg,154,,1580210327.0
137,"21y. Be unique, if I’m not crying tonight you guys didn’t do your job",12,euzq0l,RoastMe,https://i.redd.it/4rrkm39otfd41.jpg,69,,1580210444.0
138,Annihilate me please.,11,euzbtr,RoastMe,https://i.redd.it/v7v39yxbofd41.jpg,61,,1580208606.0
139,"20 today, losing weight and feeling good about myself, end that",4,euzct5,RoastMe,https://i.redd.it/oih5nxuoofd41.jpg,46,,1580208725.0
140,"25, bored at work, me and my coworker got bored of roasting each other so now its your turn",6,euycu4,RoastMe,https://i.redd.it/f7c9me3xafd41.jpg,41,,1580204098.0
141,Please tear me to shreds,12,euyg9n,RoastMe,https://i.redd.it/5vdghmv7cfd41.jpg,93,,1580204544.0
142,"My coworker u/Defaultcoke, 20, new to reddit. Give him a warm welcome",1,euyhg8,RoastMe,https://i.redd.it/gqbfs3gpcfd41.jpg,32,,1580204696.0
143,"28, about to get married and a scientist",12,euz0fl,RoastMe,https://i.redd.it/vi386x2wjfd41.png,54,,1580207143.0
144,Don't hold back,2,euz0cu,RoastMe,https://i.redd.it/0ld881jyjfd41.jpg,36,,1580207134.0
145,It's been a long week at work and i need some entertainment. Let loose!!,12,euynz2,RoastMe,https://i.redd.it/0qzt5cc7ffd41.jpg,66,,1580205541.0
146,Just hanging out with my bro - I bet you can't roast us really good (haha),8,euyg1x,RoastMe,https://i.redd.it/a497ofh0cfd41.jpg,80,,1580204514.0
147,"Dunno why it's landscape when it was originally portrait. Currently taking a break from college to try and get some work experience. I love self-deprecation, so throw your best shots.",2,euy7vf,RoastMe,https://i.redd.it/b3lnpecn8fd41.jpg,55,,1580203436.0
148,Haven’t been laid in 2 years. I think that’s been my choice.,4,euy8jg,RoastMe,https://i.redd.it/eo6ee0e79fd41.jpg,49,,1580203517.0
149,I am an 18 year old half black man that is un roastable and works in the landscaping industry. I am black because my actual skin color is red which is closer to black than white. I live in the woods and only eat twinkies and ice cream. It is not possible to roast me. I am from Russia. I'm the goat!,0,euyb3r,RoastMe,https://i.redd.it/44bn5517afd41.jpg,64,,1580203854.0
150,"34 year old ""Artist"" doing Tech Support ""for now"". Make me feel more useless than my BFA. And do try for higher fruit than ""yOu CaNt GeT a JoB, LOl.""",27,euxvkm,RoastMe,https://i.redd.it/g8hf3tc84fd41.jpg,175,,1580201847.0
151,23 year old community college drop out with a man bun,12,euy1ss,RoastMe,https://i.redd.it/yglg58en6fd41.jpg,88,,1580202658.0
152,A coworker of mine who wants roasted. 18 and is dating a 15 year old. Has daddy issues and says his dick is big. Give it all you got!,5,euxeza,RoastMe,https://i.redd.it/h84amq6lyed41.jpg,52,,1580199956.0
153,36. Gay. Single. Titties bigger than your mom. Get at me. Roast me. Nothing can hurt my feelings unless you call me skinny.,11,euxtcq,RoastMe,https://i.redd.it/0h84nw6g3fd41.jpg,112,,1580201582.0
154,"hobbiless, unemployed community college dropout, 22 as of this friday (assuming i survive this roast) btw the sign is sticking to my forehead solely from the grease on my skin. Destroy me",20,euxlxr,RoastMe,https://i.redd.it/yyq0yt8x0fd41.jpg,168,,1580200733.0
155,Me and the boys,7,euxq21,RoastMe,https://i.redd.it/3p2rkhw92fd41.jpg,63,,1580201187.0
156,I'm a no name small streamer playing Disney games. Roast me LIVE Day 27/366,0,euxq8b,RoastMe,https://i.redd.it/uk7z6bu20fd41.jpg,31,,1580201209.0
157,I play video games for a living and don't leave the house for multiple days in a row. Roast me :),37467,euxsfm,RoastMe,https://i.redd.it/ichuwsq03fd41.jpg,5300,,1580201472.0
158,18 year old high school student i have heard every insult there is have at me,9,euw2c5,RoastMe,https://i.redd.it/fuf8shn8ied41.jpg,122,,1580194451.0
159,My mate agreed to do this for my bday but won’t stop complaining. Please give it your best.,2,euwtg9,RoastMe,https://i.redd.it/mec35w0ared41.jpg,15,,1580197489.0
160,"I wanna feel the heat , burn me to the core",2,eux0va,RoastMe,https://i.redd.it/t379jwsqted41.jpg,34,,1580198318.0
161,18/Canada. currently failing grade 12. Please give me another existential Crisis,10,euwlx0,RoastMe,https://i.redd.it/3a6mxf3toed41.jpg,49,,1580196659.0
162,"I’m bored out of my mind, so go all in",46,euwqk0,RoastMe,https://i.redd.it/3u8ho7paqed41.jpg,192,,1580197164.0
163,Slow day at work. Why not,15,euwkoy,RoastMe,https://i.redd.it/tl8rxr5eoed41.jpg,76,,1580196520.0
164,"25M, looks like an otter with a bad haircut, and would like to be roasted",5,euw9ml,RoastMe,https://i.redd.it/rcdjmrqnked41.jpg,56,,1580195263.0
165,Why does my phone taste like my cats cum and not mine?,4,euvgl4,RoastMe,https://i.redd.it/b7ges0k0bed41.jpg,70,,1580192022.0
166,"roast me, lets see if ya’ll funny",32,euvl6o,RoastMe,https://i.redd.it/zw76z0jjced41.jpg,146,,1580192534.0
167,"I need a slogan, spare none of my feelings!",29,euvmf8,RoastMe,https://i.redd.it/emvcrjiyced41.jpg,185,,1580192673.0
168,"18 yo weeblet, bring it on!",7,euum6x,RoastMe,https://i.redd.it/r35pd65c1ed41.jpg,49,,1580188764.0
169,"Just a nerd looking to hear more than just trash about his cleft lip, unless its clever",7,euunhd,RoastMe,https://i.redd.it/u5bm1zgo1ed41.jpg,63,,1580188891.0
170,Don’t hold back,9,euv0kv,RoastMe,https://i.redd.it/zy6glauv5ed41.jpg,39,,1580190293.0
171,21 yr old Christian Juul addict,493,euvbdc,RoastMe,https://i.redd.it/79yl84hd9ed41.jpg,359,,1580191467.0
172,Give me your best cards. I will handle them,10,eus7nn,RoastMe,https://i.redd.it/2hnc1sl09dd41.jpg,82,,1580179241.0
173,"Roast me. I dare you. 22, lives at home. DnD Dungeon Master. Bring it.",75,euu5tq,RoastMe,https://i.redd.it/dilu5inwvdd41.jpg,238,,1580186940.0
174,Straight outta college and right into IT. Burn me to the core.,109,euu9qj,RoastMe,https://i.redd.it/abws6we6xdd41.jpg,211,,1580187373.0
175,Do it...Braaappp,10,euujty,RoastMe,https://i.redd.it/gka576tj0ed41.jpg,75,,1580188515.0
176,Don’t hold back,5,euugbj,RoastMe,https://i.redd.it/i788tqfezdd41.jpg,53,,1580188113.0
