,title,score,id,subreddit,url,num_comments,body,created
177,"Try your worst, bet you can't day anything that i haven't already heard, 23 and yes i look like a drug addict, but i'vr been clean for months",18,euubj4,RoastMe,https://i.redd.it/9j4qdcmtxdd41.jpg,91,,1580187583.0
178,Let's see how well you take Nepalese people,10,eut4ut,RoastMe,https://i.redd.it/2v3onz4xjdd41.jpg,60,,1580182915.0
179,"Roast me pls, i wanna feel sad",10,eut9lm,RoastMe,https://i.redd.it/lc36i1rhldd41.jpg,85,,1580183435.0
180,Chiefs are in the Super Bowl but I finished last in fantasy football again so I’m back for my 2nd annual roasting. Make it hurt worse than last year...,25,eut51p,RoastMe,https://i.redd.it/6rvososzjdd41.jpg,56,,1580182935.0
181,Feeling confident today. Knock me down a peg.,12,eus3k6,RoastMe,https://i.redd.it/kgb89adl7dd41.jpg,88,,1580178780.0
182,Taking microbiology and anatomy II. Work in OR. Professional girlfriend stealer. I once used cheat engine to hack Roblox. I have a bonsai but it isn't doing too well.,0,eus61p,RoastMe,https://i.redd.it/7r7fmx6g8dd41.jpg,48,,1580179052.0
183,Alright kids. Do your worst.,22,eushsn,RoastMe,https://i.redd.it/ure2gpubcdd41.jpg,102,,1580180354.0
184,"19,male. I get called Jesus, guess why. Hurt me.",10,eurjcg,RoastMe,https://i.redd.it/45f9bppo0dd41.jpg,127,,1580176582.0
185,Grade-A shitty mechanic and I’m dumber than drywall. Have at it,24,eur0di,RoastMe,https://i.redd.it/v8dq39u4vcd41.jpg,76,,1580174579.0
186,Freshly 23. Just fuck me up,12,eur0vj,RoastMe,https://i.redd.it/9mv6p84bvcd41.jpg,43,,1580174631.0
187,26 yo university drop out. Traveling tonight give me something to read (and cry) for the way.,4,eur1b3,RoastMe,https://i.redd.it/qq3w0cqfvcd41.jpg,57,,1580174675.0
188,22. Still listens to ska and has 3.9 GPA. Do your worst.,126,eupotx,RoastMe,https://i.redd.it/uqrk6ru5fcd41.jpg,275,,1580169201.0
189,22 year old Indian. Currently trying to find a job that I think I will like. Enough with the tech support jokes. Come at me with something new.,14,eupt3y,RoastMe,https://i.redd.it/k6z4kekqgcd41.jpg,65,,1580169760.0
190,29 fast food worker do your worse,7,eups34,RoastMe,https://i.redd.it/3i4e6c7fgcd41.jpg,70,,1580169629.0
191,"In my early 20’s, work in fast food.",15,eups0r,RoastMe,https://i.redd.it/pzgjgroegcd41.jpg,87,,1580169621.0
192,Monday’s are awful. I couldn’t figure out how to get this to work. Roast me,5,eupxey,RoastMe,https://i.redd.it/5ewtindcicd41.jpg,26,,1580170270.0
193,"23 M, some people suggested me to post a far picture so that they can roast me better. Here it is for you guys",8,euocht,RoastMe,https://i.redd.it/vnok9aydwbd41.jpg,64,,1580162898.0
194,"Mods made me put my hand in this, so I panicked and did blue steel. Good luck roasting me with this much cool.",1,euoqvg,RoastMe,https://i.redd.it/q33nsue52cd41.jpg,31,,1580164824.0
195,"Give me new thicc-flasses insults, oh yeah 26 sort of illustrator from Costa Rica",1,euosfw,RoastMe,https://i.redd.it/e2gskqao2cd41.jpg,23,,1580165023.0
196,Destroy me,30,euoh45,RoastMe,https://i.redd.it/gpm747dbybd41.jpg,88,,1580163536.0
197,24 years old wannabe IT guy. End me.,4,euohs7,RoastMe,https://i.redd.it/03n5656kybd41.jpg,34,,1580163617.0
198,"19, Left STEM major for Art School, Having Breakdowns Daily. Do your worst.",7,euomo1,RoastMe,https://i.redd.it/5cfm0iii0cd41.jpg,136,,1580164273.0
199,"Mods said they cant see my hands but I dont discriminate against people with no hands. Besides my shit sense of humor, tell me all the other reasons Im spending my birthday alone",27,eunlir,RoastMe,https://i.redd.it/b5skmtzmkbd41.jpg,38,,1580158942.0
200,"Short-ish, fat/overweight, in need of a haircut, 18 year old male. Roast me, come up with anything. Can’t wait.",7,eun9u4,RoastMe,https://i.redd.it/2zt93hkrebd41.jpg,76,,1580156970.0
201,I used to be the employee of the month. Been struggling lately. Do your worst.,6,eunaj0,RoastMe,https://i.redd.it/kg6q13o5fbd41.jpg,34,,1580157092.0
202,Tired-ass 20 year old italian lesbian who's hairy like a man and dresses like shit and it's about to fail tomorrow's psychology exam. Plz made me laugh a bit I'm exhausted,20,euno03,RoastMe,https://i.imgur.com/keL22i3.jpg,100,,1580159333.0
203,i'm not hard to roast (i'm 19 btw),4,euno7b,RoastMe,https://i.redd.it/okjo44wwlbd41.jpg,42,,1580159365.0
204,"I've heard them all. Uber driver, terrorist, big ears/nose. Hit me with something new where it hurts if you can.",82,euntte,RoastMe,https://i.redd.it/evuig2p3obd41.jpg,232,,1580160173.0
205,"18yo Studying to be a chef and i stay home to play runescape, punch me in the face.",10,eunwyh,RoastMe,https://i.redd.it/sj8q5aampbd41.jpg,54,,1580160613.0
206,22. Line cook. Single. Tell me why.,12,euml60,RoastMe,https://i.redd.it/a9ncs0ny0bd41.jpg,96,,1580152318.0
207,"18 YO high school student, nerd. Do ur worst",6,eumveu,RoastMe,https://i.redd.it/zqvx7oqu6bd41.jpg,15,,1580154316.0
208,"Am 26, unemployed, living with parents, I'm from India, so basically I shit on the streets. Only had one gf so far, I'm a wimp when it comes to women. Go at it",96,eun1zs,RoastMe,https://i.redd.it/rnhmovppabd41.jpg,159,,1580155598.0
209,"This my pal, he's 18 even tho he looks like a fucking baby",2417,eulxzh,RoastMe,https://i.redd.it/n46znf2coad41.jpg,825,,1580148073.0
210,Two bored co-workers on monday morning. Roast the hell out of us.,5,eulxsq,RoastMe,https://i.redd.it/0t4953q8oad41.jpg,14,,1580148040.0
211,"19 year old artist, looking for my Shizuka. Let me have it.",6,eulu73,RoastMe,https://i.redd.it/bitu9gwdmad41.jpg,16,,1580147420.0
212,I’m fully aware November was 2 months ago,7,euluo1,RoastMe,https://i.redd.it/qaffdwpjmad41.jpg,65,,1580147492.0
213,Just go all in,7399,eumf3q,RoastMe,https://i.redd.it/q05ku12hxad41.jpg,1490,,1580151144.0
214,"Art student, 24. End me.",30,eukslr,RoastMe,https://i.redd.it/m3g2lyjjz9d41.jpg,79,,1580139735.0
215,19 y/o friend aspiring medical student and loves his beard. Go to town.,12,eul2cb,RoastMe,https://i.redd.it/1q9gqlwt4ad41.jpg,26,,1580141546.0
216,Why am I doing this to myself,8,eul6hr,RoastMe,https://i.redd.it/i96mba0h7ad41.jpg,34,,1580142401.0
217,23M. Can't wait to be roasted hell out of everyone. Let's go guyss,8,eul970,RoastMe,https://i.redd.it/cbej9st79ad41.jpg,24,,1580142989.0
218,"All right, I'm ready, hit me with it. I'm 21 years old, Christian, kissless virgin, learning to program, and way too into anime and video games",54,eukkzc,RoastMe,https://i.redd.it/adcs4xqbv9d41.jpg,83,,1580138317.0
219,"21, 3ish years behind in college, been on 3 probations, and make music in most of my free time while working in a restaurant full time. Could always use some humbling, so end me",5,eujtnr,RoastMe,https://i.redd.it/crzv6gjnh9d41.jpg,36,,1580133718.0
220,"18, just out of high school, roast me",1,eujys3,RoastMe,https://i.redd.it/vh6v1rz2k9d41.jpg,23,,1580134535.0
221,Lemme have it you wussies.,34,eujepg,RoastMe,https://i.redd.it/o1f5j5pra9d41.jpg,102,,1580131403.0
222,Fukin end me,1,eujik4,RoastMe,https://i.redd.it/mmp6hnwjc9d41.jpg,64,,1580132004.0
223,you guys cant make me feel worse than myself so lets go,16,euirxj,RoastMe,https://i.redd.it/493n58ap09d41.jpg,42,,1580128018.0
224,"Welcome to the Roast of u/sandliker, don’t hold back",2,euiz5g,RoastMe,https://i.redd.it/3zrw30xv39d41.jpg,31,,1580129089.0
225,I shaved my eyebrows today now I look crazy,16,euj3ha,RoastMe,https://i.redd.it/hkfv9sct59d41.jpg,186,,1580129737.0
226,"33 year old single mom, esthetician, antisocial af, normally would be at the goth club on a Sunday night but here I am, take it easy on me it's my first time.",572,euihug,RoastMe,https://i.redd.it/3r2cuthew8d41.jpg,342,,1580126572.0
227,My friend's cat is sick. And last time you were pathetic. You can't even make me uncomfortable.,5,euij5v,RoastMe,https://i.redd.it/k7j2lccyw8d41.jpg,82,,1580126773.0
228,"23, Colombian, I drive a car that’s just as old as I am lol Roast me",233,euism6,RoastMe,https://i.redd.it/lveus0oz09d41.jpg,327,,1580128115.0
229,pls give it your all make me sad,1,euia4y,RoastMe,https://i.redd.it/unipocj5t8d41.jpg,35,,1580125477.0
230,[20F] make me regret this,52,euhzx4,RoastMe,https://i.redd.it/76d6gm3vo8d41.jpg,193,,1580124035.0
231,I’m a middle aged school teacher burn me,12,euhz12,RoastMe,https://i.redd.it/5dj99xgho8d41.jpg,78,,1580123919.0
232,"My ex girlfriend (Yes, i had a girlfriend believe it or not) wouldn’t let me post on Roastme cause she didn’t want me people to be mean to me. So uhhhhhh.... let me fucking have it, plebs",20,euhhga,RoastMe,https://i.imgur.com/sDd5eTi.jpg,79,,1580121558.0
233,"20, bowlcut, do your worst.",30,euh4rs,RoastMe,https://i.redd.it/ws5jzjlgc8d41.jpg,124,,1580119865.0
234,"21, Fiction writer, bibliophile, pianist, and head of the Chris-R fan-club",11,euh7dd,RoastMe,https://i.redd.it/nv8z9lh5d8d41.jpg,53,,1580120212.0
235,This is the other little demon that's been tormenting me. Roast me day 26/366,16,eugsx5,RoastMe,https://i.imgur.com/IISI6Yz.jpg,48,,1580118256.0
236,Lifting for the past 6 months and nothing you say can be worse than my gains. 18,24,eug9uc,RoastMe,https://i.redd.it/embl9ecxz7d41.jpg,96,,1580115651.0
237,"19yo business student, barely passing classes, all I do is plays video games all day and I'm not even good at them, make me cry.",23,eug9n1,RoastMe,https://i.redd.it/try6wihsz7d41.jpg,89,,1580115624.0
238,25yo metalhead. Hit me with your best roast. Ty.,7,eufziw,RoastMe,https://i.redd.it/vzg5wozsv7d41.jpg,60,,1580114264.0
239,Love bird watching when I'm too toeingl in my jnco jeans!,7,eufnu0,RoastMe,https://i.redd.it/6l2bwtomr7d41.jpg,32,,1580112860.0
240,"18, 6’6, and incredible handsome",13,euforj,RoastMe,https://i.redd.it/5ttnu27yr7d41.jpg,55,,1580112974.0
241,32yo restaurant manager. Just fuck my shit up,12,eufhky,RoastMe,https://i.redd.it/vvz6idhbp7d41.jpg,84,,1580112083.0
242,"My mom tells me I’m cute, But my boyfriend thinks I’m ugly. Who’s right?",10,eufdnj,RoastMe,https://i.redd.it/r7o1pq1vn7d41.jpg,71,,1580111619.0
243,Daddy pays for everything. Trump 2020 #rolltide,0,eufdvj,RoastMe,https://i.redd.it/spjee401o7d41.jpg,31,,1580111648.0
244,"Come on, I’m waiting for you",13,euf82c,RoastMe,https://i.redd.it/4mp1qx3zl7d41.jpg,87,,1580110958.0
245,Feeling a little TOO well recently...,53,euebl5,RoastMe,https://i.redd.it/tnjahw2ta7d41.jpg,177,,1580107201.0
246,"21 with pink hair, surely I deserve to be bullied lmao",27,eue8em,RoastMe,https://i.redd.it/enqlfx6r97d41.jpg,76,,1580106848.0
247,Don't hold back,26,eudi72,RoastMe,https://i.redd.it/38hmxaez07d41.jpg,102,,1580103898.0
248,"24F CS/premed student, always wanted to post on these subs",14,eud780,RoastMe,https://i.imgur.com/umuGQWR.jpg,59,,1580102660.0
249,My mechanic friends looks like he’s wearing blackface.,14,eucm2y,RoastMe,https://i.redd.it/7emnfageq6d41.jpg,55,,1580100342.0
250,Im too dumb to think of an original title so fuck you.,7,eud74b,RoastMe,https://i.redd.it/v1f4xvr9x6d41.jpg,59,,1580102649.0
251,"18nb, commitment issues, i wear fanny packs and heelys, and i dye my hair constantly. do your worst reddit",12,eud766,RoastMe,https://i.redd.it/l2f8z0fax6d41.jpg,71,,1580102654.0
252,"Haven’t shower in 5 days, single and can’t find my car keys",46,euczno,RoastMe,https://i.redd.it/q6ajqg7ru6d41.jpg,129,,1580101822.0
253,"21, 2 year law student dropout, leaving for the army soon, make me cry",10,eubmw6,RoastMe,https://i.redd.it/9z6oen8gf6d41.jpg,42,,1580096655.0
254,I listen to indie music so I think I’m cooler then everyone. Roast me!,16,eubng9,RoastMe,https://i.redd.it/41v7zl2mf6d41.jpg,45,,1580096715.0
255,"Just got my first tattoo, tell me how bad it is",35,eucb6y,RoastMe,https://i.redd.it/i55eysvxm6d41.jpg,150,,1580099175.0
256,"Left my girlfriend and realised that it was stupid because I will never be completely satisfied, give me the rest",8,eucd3i,RoastMe,https://i.redd.it/kovufxajn6d41.jpg,40,,1580099378.0
257,"Bonk ass dude, roast me",11,eucxkl,RoastMe,https://i.redd.it/bqihgxx4u6d41.png,39,,1580101597.0
258,"22 years old, yes my name is actually Quanah",111,eubjgq,RoastMe,https://i.redd.it/0kideo6ce6d41.jpg,168,,1580096283.0
259,Roast me Fanny’s,15,eub64e,RoastMe,https://i.redd.it/hwbt33mr96d41.jpg,68,,1580094744.0
260,"Lost in fantasy football, now I have to get roasted. Do your worst.",6,euaxz7,RoastMe,https://i.redd.it/mxy0uvp076d41.jpg,43,,1580093827.0
261,My friend here is a 24 year old middle eastern grad student who thinks Canada is too damn cold. Roast him so that he finally get some warmth.,16,eualcd,RoastMe,https://i.redd.it/p0zk4wcs26d41.jpg,76,,1580092398.0
262,My friend goes to Cambridge university.,12,euakj9,RoastMe,https://i.redd.it/na4vnc9i26d41.jpg,31,,1580092303.0
263,hello roast the asian plis,15,eua9s0,RoastMe,https://i.redd.it/8k6enfzoy5d41.jpg,63,,1580091025.0
264,"I doubt you could say anything my family hasn’t already said. College student, Stoner, cereal box shaped body. Let me have it",22306,euapl7,RoastMe,https://i.redd.it/cf3forh946d41.jpg,4013,,1580092895.0
265,Roast me like one of your French girls,17,eu96wg,RoastMe,https://i.redd.it/8ayn05o4l5d41.jpg,73,,1580086459.0
266,33 years old business owner bored on a Sunday night. Bring it on!,12,eu9lrd,RoastMe,https://i.redd.it/ycj2p31bq5d41.jpg,89,,1580088213.0
267,"Lost a pool bet,ROAST ME",60,eu9oa2,RoastMe,https://i.redd.it/w9zfv157r5d41.jpg,131,,1580088499.0
268,"Retrying this,make me want to down a pint of bleach reddit",23,eu7spg,RoastMe,https://i.redd.it/caw2xgcf25d41.jpg,119,,1580080180.0
269,18 melbourne Australia jewish i hope u burn me better then the fires,19,eu6x26,RoastMe,https://i.redd.it/y9az9ncfo4d41.jpg,59,,1580075460.0
270,"I've been feeling too good about myself lately, please make it go away and remind me how trash I am again",38,eu6hks,RoastMe,https://i.redd.it/5jlwnodsg4d41.jpg,152,,1580072892.0
271,"Roast my wife. 22 y.o. currently studying library and information sciences. Bookworm, enjoys playing to The Sims and desperately wants to have a child.",153,eu616n,RoastMe,https://i.redd.it/n6dsmpx684d41.jpg,198,,1580070003.0
272,"You’ve roasted my coworker, now roast me",12,eu5evf,RoastMe,https://i.redd.it/jiudalr8v3d41.jpg,59,,1580065647.0
273,20 yo. bi criminology student . End me.,131,eu5kf4,RoastMe,https://i.redd.it/p7e006zky3d41.jpg,248,,1580066770.0
274,"My coworker thinks he is God’s gift, prove him wrong",21,eu4q4s,RoastMe,https://i.redd.it/mak9w4upe3d41.jpg,88,,1580060095.0
275,19 years old with hella ADHD and currently struggling to get a business degree... not emotionally prepared for this but here we gooo,39,eu4du3,RoastMe,https://i.redd.it/xcw9upko63d41.jpg,128,,1580057386.0
276,18 nyc jewish boy,22,eu4lv5,RoastMe,https://i.redd.it/j3qrt0wub3d41.jpg,142,,1580059157.0
277,"21, Virgin, Possibly Asexual",4,eu479x,RoastMe,https://i.redd.it/feta2b4f23d41.jpg,56,,1580055954.0
278,"A guy, just woke up being an 18 old, full time weeb, not too far from being anorexic, finishing high school without knowing what to do next and never had a real relationship, hoping to change that.",16,eu3yro,RoastMe,https://i.redd.it/v4x3ssh6v2d41.jpg,88,,1580054095.0
279,Roast me and my dumpster sign.,11,eu3xkx,RoastMe,https://i.redd.it/qei3eia2w2d41.jpg,67,,1580053816.0
280,"Bored as hell, roast me",9,eu3x5f,RoastMe,https://i.redd.it/42rmj0hsv2d41.jpg,77,,1580053723.0
281,23. Virgin. Incel. Linux enthusiast.,25,eu3dmf,RoastMe,https://i.redd.it/qgw3jk66k2d41.jpg,82,,1580049818.0
282,Bring it the fuck on.,3,eu329b,RoastMe,https://i.redd.it/tdr49zord2d41.jpg,29,,1580047698.0
283,"I'm too autistic to work a real job, so I'm going to try selling nudes online instead. Roast me alive y'all",213,eu3sgy,RoastMe,https://i.redd.it/zqnh0v6vs2d41.jpg,431,,1580052742.0
284,"22 year old single heartthrob, try your best",12,eu37is,RoastMe,https://i.redd.it/nxmkp42tg2d41.jpg,62,,1580048697.0
285,Got roasted last time for being unemployed. Got a job and cut my hair. Leveling up.,0,eu3ad7,RoastMe,https://i.redd.it/430ds64di2d41.jpg,38,,1580049207.0
286,18 y-o broke college student who looks like a 25 y-o reincarnation of Jesus. Do your best :D,89,eu2a25,RoastMe,https://i.redd.it/8xh2sp95z1d41.jpg,160,,1580042747.0
287,"Tired of people crying about how comments on social media ruin their lives. Heard about /roastme. Mid 30s dad in the military, loves board games and video games. Unoffendable.",15,eu2csc,RoastMe,https://i.redd.it/95ox41eh02d41.jpg,71,,1580043195.0
288,I'm Stoned RoastMe.,1,eu2el8,RoastMe,https://i.redd.it/7igqchyc12d41.jpg,26,,1580043492.0
289,"Tres sin cebolla, porfavor, roast us :)",6,eu2fif,RoastMe,https://i.redd.it/d3210qot12d41.jpg,48,,1580043648.0
290,None of my friends will roast me so reddit do your worst.,17,eu2hx9,RoastMe,https://i.redd.it/c3f89a4132d41.jpg,82,,1580044057.0
291,Mixon Dak ass. Finished last in fantasy.,17,eu1f6f,RoastMe,https://i.redd.it/o1qrbvt4l1d41.jpg,62,,1580038034.0
292,Just dyed my hair so why not grill me,10,eu1lwd,RoastMe,https://i.redd.it/t95te6mxn1d41.jpg,83,,1580038977.0
293,"Was the 6th wheel of a girl's night out bowling, put me in the gutter like I put all my bowling balls in",10,eu1010,RoastMe,https://i.redd.it/js0o93gqe1d41.jpg,53,,1580035890.0
294,This is who my sister is married to..... please send help. Roast please!!,7,eu0s0e,RoastMe,https://i.redd.it/onu94yb6b1d41.jpg,92,,1580034768.0
295,Let me have it,8,eu0bzd,RoastMe,https://i.redd.it/t8h64lck41d41.jpg,49,,1580032504.0
296,"21, disabled with rare connective tissue disease, gay, roast me.",24336,eu0cis,RoastMe,https://i.redd.it/ognqnt8w41d41.jpg,2870,,1580032572.0
297,I'm watching my sisters dogs this weekend and she's a literal demon. Roast me day 25/366,3,eu0d0l,RoastMe,https://i.imgur.com/C0i7F2g.jpg,52,,1580032640.0
298,"My 20/M friend, wants to get berated. Reddit, give him your all!",10,eu0gcn,RoastMe,https://i.redd.it/gwokjorh61d41.jpg,38,,1580033111.0
299,"21 year old spoilt brat , bring it on",2,eu0h0c,RoastMe,https://i.redd.it/rcefxzjh61d41.jpg,46,,1580033202.0
300,Do your worst. 18 college student.,26,eu051h,RoastMe,https://i.redd.it/0tlbti8u11d41.jpg,185,,1580031545.0
301,I shaved my head today aaand yes I am female,10,eu00z8,RoastMe,https://i.redd.it/xbcuq7b501d41.jpg,123,,1580030976.0
302,"Just an Asian, come at me.",1,eu0168,RoastMe,https://i.redd.it/oke3ns1801d41.jpg,49,,1580031005.0
303,Roast me reddit,9,etzx9g,RoastMe,https://i.redd.it/6grd3nfny0d41.jpg,22,,1580030473.0
304,1st year med student. Give my friend what you got. Also Gay.,4,etzv05,RoastMe,https://i.redd.it/6w93n7x2x0d41.jpg,39,,1580030168.0
305,"22 unemployed, living at home after a business degree and not actively seeking work. Roast me please",3,etzkh0,RoastMe,https://i.redd.it/n7ofefeat0d41.jpg,24,,1580028713.0
306,My freind thinks hes unroastable kill him destroy him make him suffer.,1,etzili,RoastMe,https://i.redd.it/pufla76os0d41.jpg,28,,1580028460.0
307,I'm a 6ft 2 high school senior and I just had my 18th birthday.ive been waiting to see how reddit will destroy me.roast me till I'm no more,4,etzdp4,RoastMe,https://i.redd.it/qhjsy0qsq0d41.jpg,48,,1580027831.0
308,I was too lazy to even sit up for the roast,13,etyyjz,RoastMe,https://i.redd.it/ebhao6dgk0d41.jpg,107,,1580025781.0
309,She really wants roasting. Do your best!,16,etzasp,RoastMe,https://i.redd.it/jpxeomump0d41.jpg,109,,1580027460.0
310,Lets try this again; Lets see how good you guys are.,0,etyj9r,RoastMe,https://i.redd.it/csbs4xaie0d41.jpg,83,,1580023800.0
311,25 year old generic brown person stuck in PhD hell for approximately the next forever. Roast me like my daddy used to.,7,etyhtc,RoastMe,https://i.redd.it/rnr2aqp9e0d41.jpg,29,,1580023618.0
312,I recently got my diving license. You can’t possibly make me feel bad.,10,etygny,RoastMe,https://i.redd.it/n6ndp5rtd0d41.jpg,75,,1580023470.0
313,"biology and chemistry double major, second year of university, i love to watch anime and metal music and yeah I'm ginger tell me something i dont know, do your worst losers",7,etyb04,RoastMe,https://i.redd.it/1hut3qdnb0d41.jpg,42,,1580022736.0
314,"my confidence is already shit, help me out a little guys",8,ety5dp,RoastMe,https://i.imgur.com/gw2B6eW.jpg,73,,1580022024.0
315,My dirty homeless bf with face tattoos and all our dogs. Thank you.,9,ety2xg,RoastMe,https://i.redd.it/wbkwqbql80d41.jpg,87,,1580021714.0
316,"Showed my girlfriend this sub. She doesn’t understand it, plz give her things to not like about me",9,ety1r0,RoastMe,https://i.redd.it/6pepkg0680d41.jpg,45,,1580021565.0
317,"Animation major, 19, Beat me up, buttercup",3,etwybr,RoastMe,https://i.redd.it/vea2m56gtzc41.jpg,43,,1580016616.0
318,18 year old blood from the projects,3,etx7s9,RoastMe,https://i.redd.it/vp1adndwwzc41.jpg,62,,1580017783.0
319,"18, 1 friend in my area, others have fun too far away. Had only one crush that wasn't even interested in men. Bad at taking photos and bored to tears, decided to read some good roasts",3,etx9sf,RoastMe,https://i.redd.it/rwznt8unxzc41.jpg,29,,1580018035.0
320,23 year old history major,9,etxd9v,RoastMe,https://i.redd.it/39iv8pbxyzc41.jpg,26,,1580018456.0
321,"Feeling happy for the first time in a while, time to celebrate!",8,etxeur,RoastMe,https://i.imgur.com/zwyuv22.jpg,33,,1580018659.0
322,"I'm Polish, a student of Entrepreneurship and I'm trying to impress my Norwegian boyfriend by posting this here.",56,etx8zv,RoastMe,https://i.redd.it/qhrhl18dxzc41.jpg,142,,1580017935.0
323,Roast me. It's my 40th birthday today.,2,etxo0a,RoastMe,https://i.redd.it/bopjdmvw20d41.jpg,21,,1580019798.0
324,The rest of the country is on fire so I might as well get roasted,3,etwwpg,RoastMe,https://i.redd.it/abhrmzyuszc41.jpg,14,,1580016420.0
325,"An asian, a lightskin and a whiteboi walk into a bar...",30,etvus7,RoastMe,https://i.redd.it/166jq0n7fzc41.jpg,102,,1580011827.0
326,20 yr old Art major,17,etwv0j,RoastMe,https://i.redd.it/glfkery8szc41.jpg,129,,1580016211.0
327,"Feeling happy, because I can almost fit into this shirt again. Knock me back down.",10,etwucx,RoastMe,https://i.redd.it/tvoborqzrzc41.jpg,59,,1580016126.0
328,19 yo manual labour fresh out the shower y’all cant touch me 😜,3,etw2xv,RoastMe,https://i.redd.it/0hk6r507izc41.jpg,69,,1580012831.0
329,"New year, new roasts, make me cry",16,etw77g,RoastMe,https://i.redd.it/3utqsmbrjzc41.jpg,70,,1580013356.0
330,Another friend of mine. Please guys wake him up (he needs it),1,etwjqc,RoastMe,https://i.redd.it/5axe34m6ozc41.jpg,20,,1580014847.0
331,"I'm a huge Pokemon fan and a fan artist. Fry me up, Reddit!",73,etvg0c,RoastMe,https://i.redd.it/05wcalxv9zc41.jpg,241,,1580010036.0
332,My friend got finely roasted last time. Now is my turn 🔥,7,etv2un,RoastMe,https://i.redd.it/r7o2djp25zc41.jpg,26,,1580008423.0
333,"yo, i love art n music n science but im shit at all of them. crush me like i’ve crushed my own dreams",35,etuzbz,RoastMe,https://i.redd.it/ver2dqpr3zc41.jpg,142,,1580007979.0
334,"23 yr old carpet cleaner, bored on my day off. Gimmie your best shot, while i take my own shots. Of vodka",7,etugxw,RoastMe,https://i.redd.it/h5i8c558xyc41.jpg,61,,1580005780.0
335,I have 5 kids and my wife left me,15,etua41,RoastMe,https://i.redd.it/38lly6wpuyc41.jpg,82,,1580004939.0
336,Destroy me with your best. Make me cry like the starving Ethiopian children,21,etu695,RoastMe,https://i.redd.it/rs6dwskctyc41.jpg,90,,1580004477.0
337,Do it...!,4,ettyfz,RoastMe,https://i.redd.it/h4jm4kplqyc41.jpg,42,,1580003552.0
338,29y with a beard for the roasting! Let's hear it.,10,etttwm,RoastMe,https://i.redd.it/bm6g4g6woyc41.jpg,27,,1580002993.0
339,"Unemployed 27 year old dad with a law degree I don't want to use because I need constant emotional validation to be motivated to do anything. On /r/roastme because I want to convince myself I don't care what anyone thinks, but I know that's not true, I'm insecure as fuck. End me.",6,ettpc2,RoastMe,https://i.redd.it/46qr0gyulyc41.jpg,38,,1580002438.0
340,I've roasted many people during my lifetime. I wanna see how you do against me,20,ett57z,RoastMe,https://i.redd.it/o6nb815ufyc41.jpg,118,,1579999933.0
341,I'm Norwegian and think I am a god at League of Legends. Roast me.,9,ett5rv,RoastMe,https://i.redd.it/sgc9ksa2gyc41.jpg,31,,1580000008.0
342,"22, living with my recently divorced mom, acne, daddy issues, and crippling insecurity. Fry me",153,ett661,RoastMe,https://i.redd.it/4vogtms7gyc41.jpg,302,,1580000061.0
343,Recently lost 2 stone and so I'm feeling good about myself. Try and change that with a good roasting xx,10,etsa4m,RoastMe,https://i.redd.it/jmv3v88x3yc41.jpg,40,,1579995928.0
344,"20 year old, Indian boy studying Civil Engineering, been friendzoned by more than 3 girls in less than 3 months. Also, couldn't handle more then 2 shots of drink. I am also a billie eilish fan.",68,etsb1e,RoastMe,https://i.redd.it/kjuwlc5b4yc41.jpg,132,,1579996055.0
345,Roast the ginger,11070,etsf47,RoastMe,https://i.redd.it/kz01axnw5yc41.jpg,2539,,1579996613.0
346,29 and recently unemployed. Do your worst.,64,ets4e8,RoastMe,https://i.redd.it/4w3sqhdk1yc41.jpg,151,,1579995132.0
347,I’m Kyle and want to be plowed by insults. do your worst,28,etryqp,RoastMe,https://i.redd.it/cn8y1x85zxc41.jpg,125,,1579994318.0
348,"2 of us Aussies are married, guess which ones single. Do your worst",95,etru16,RoastMe,https://i.redd.it/txmjuzw4xxc41.jpg,159,,1579993645.0
349,"Roast me, 18 year old boy from denmark. Go fully hard on me boys!",54,etrrd7,RoastMe,https://i.redd.it/4cte2d3yvxc41.jpg,87,,1579993278.0
350,My friend,0,etrsy8,RoastMe,https://i.redd.it/c04jylh4wxc41.png,34,,1579993497.0
351,I turned 18 yesterday. I think I will never find a boyfriend who loves me. Most of the time I sit in front of my PC and play some games. Sooo roast me now! :),34,etrgfl,RoastMe,https://i.redd.it/5gf5vre7rxc41.jpg,253,,1579991646.0
352,18. I mostly play games and be single as fuck. Roast me already,18,etr0qh,RoastMe,https://i.redd.it/8vpeyf8xjxc41.jpg,83,,1579989198.0
353,"Come on, do your best",4,etqy0o,RoastMe,https://i.redd.it/wqirz38eixc41.jpg,27,,1579988746.0
