,comment
0,Reading.
1,"All the time.

(also great to see a good narwhal bacon reference back on here)"
2,This should bend nicely. ;)
3,r/xmen
4,"It likely depends on your location, countries, states, and even counties have different rules."
5,my hamster spat out sunflower seeds all over my hand. that’s about it really
6,My height. I love that being so short makes me genuinely adorable but at the same time I lost alot of practicality being this short (5'1)
7,"'I'll be over here on my phone if you need me.'

If he wants to talk he'll start a conversation.  probably he feels as awkward as you do."
8,"Women, fine wine, and weed."
9,But he isn't.
10,But cap picked it up
11,"Still though, what would be your equivalent?"
12,"Still though, what would be your equivalent?"
13,Ordered a 6 piece nugget meal and got 7
14,Pooped the bed one too many times
15,Long story short - I outgrew him.
16,Positive to negative interactions. It can't work if one or both of you can't get that ratio up.
17,If being with them feels like an effort.
18,if you are questioning the relationship then it needs work....relationships should not be hard work at all.
19,Play Roblox
20,"I'd give myself 50,000 robux"
21,Delete it
22,Who?
23,Fair enough
24,I second this
25,Look on youtube for flamingo he plays roblox
26,A can of worms
27,One Word... NETFLIX
28,"I talk too much, so once my mouth opens it’s never really closing"
29,Your mouth.
30,Youtube
31,Ouija
32,Your heart
33,Pandora's Box.
34,Rock the cue ball and accept it. Nothing more unattractive than a person who isn't confident in their own skin.
35,"I'm not (this isn't denial, but a fact)."
36,Wassah dude
37,"Was I too ""ruff"" last night?"
38,Do you know how much I love you?!
39,"Do you hate me, don't you?"
40,I'm sorry for stepping on your paw
41,What's wrong with you?
42,Night at the Roxbury?
43,"If they take their clothes off in front of you, they are most likely in to you, or have been coated in something toxic/disgusting."
44,I need these answers too
45,lots of eye contact from what i hear
46,There are no signs. You just have to trust your gut to tell if someone's into you.
47,Or they think you're gay
48,Also a possibility.
49,X Gon Give It To Ya. I can do anything when listening to that song.
50,Thinking about my parents.  The hardest part is remembering to think of them when times are tough and I need motivation.  In recent years I've become more mindful of when a negative thought cycle starts and I've been able to cauterize the cycle with thinking of my parents and what wonderful and inspiring people they are.
51,Failure.
52,My girlfriend
53,Hotties
54,my favorite food when im hungry like god damn id kill for that shit
55,"**Attention! [Serious] Tag Notice**

* [Jokes, puns, and off-topic comments are not permitted](https://www.reddit.com/r/AskReddit/wiki/index#wiki_-rule_6-) in **any** comment, parent or child.

* Parent comments that aren't from the target group will be removed, along with their child replies. 

* Report comments that violate these rules.

Posts that have few relevant answers within the first hour, and posts that are not appropriate for the [Serious] tag will be removed. Consider doing an AMA request instead.

Thanks for your cooperation and enjoy the discussion!


*I am a bot, and this action was performed automatically. Please [contact the moderators of this subreddit](/message/compose/?to=/r/AskReddit) if you have any questions or concerns.*"
56,“Compassion is priceless in the truest sense of the word. It must be given freely...in abundance.”
57,Did this question make sense in your head?
58,r/ihadastroke
59,"Bad knee.

He slipped on the Bat Skateboard and hurt it sometime in the mid 70's"
60,"**Attention! [Serious] Tag Notice**

* [Jokes, puns, and off-topic comments are not permitted](https://www.reddit.com/r/AskReddit/wiki/index#wiki_-rule_6-) in **any** comment, parent or child.

* Parent comments that aren't from the target group will be removed, along with their child replies. 

* Report comments that violate these rules.

Posts that have few relevant answers within the first hour, and posts that are not appropriate for the [Serious] tag will be removed. Consider doing an AMA request instead.

Thanks for your cooperation and enjoy the discussion!


*I am a bot, and this action was performed automatically. Please [contact the moderators of this subreddit](/message/compose/?to=/r/AskReddit) if you have any questions or concerns.*"
61,Dont mind me just making a comment to get notified if sb replied
62,until both feel ready and comfortable doing such acts.
63,Could be before the relationship is official. You both dictate that based on your comfortability levels
64,Talk about it with your SO.
65,"I'm down from the minute we see each other, so it's however long the other person wants to wait."
66,Marriage because I am a good Christian boy
67,"I only hookup with promiscuous women, id say we wait 30 mins"
68,"In my last relationship, we waited eight days after we made it exclusive. But that was 25 years ago..."
69,ASAP.
70,"I usually had sex first, then a relationship sometimes developed. 

I'm married now, but that's how the relationship started."
71,"if its someone that I would really like a LTR with then I will wait, if we are just casually dating then within the first 3 dates."
72,"Preferably before rigor mortis sets in. But if I'm slow, it's not a deal breaker."
73,At least a month
74,"Because ""Whale style"" never caught on."
75,It rolls off the tongue easier than booty up face down style
76,Marine mammals would like to have a word with you.
77,"Because everybody has seen dogs fucking, it’s the most familiar one"
78,Except for Bonobos Monkeys
79,Because dogs are such amazing and loyal companions that it would be a shame to not name something awesome after them.
80,"""Whale style""? You mean what your mum does?"
81,Have you seen us?
82,"Usually, they tend to overrate themselves."
83,Do we?
84,"There are 300 million versions, nothing constitutes us correctly."
85,What are hotdogs made of?
86,Am I asking a Genius a question or a Genie?
87,What is the next winning powerball number?
88,How does reddit calculate karma?
89,Child sex trafficking exists.
90,A man in the depths of an ether binge.
91,"The fact that it takes an incredible amount of mental energy to not focus on mostly negative and inconvenient things day in and day out, especially if there's an abundance of good in your life.

Might just be me though, happiness is alluding."
92,"The growing division between the poor and the wealthy, and how insidiously they tamper with governments to keep the status quo."
93,People hold hands before marriage
94,"**Attention! [Serious] Tag Notice**

* [Jokes, puns, and off-topic comments are not permitted](https://www.reddit.com/r/AskReddit/wiki/index#wiki_-rule_6-) in **any** comment, parent or child.

* Parent comments that aren't from the target group will be removed, along with their child replies. 

* Report comments that violate these rules.

Posts that have few relevant answers within the first hour, and posts that are not appropriate for the [Serious] tag will be removed. Consider doing an AMA request instead.

Thanks for your cooperation and enjoy the discussion!


*I am a bot, and this action was performed automatically. Please [contact the moderators of this subreddit](/message/compose/?to=/r/AskReddit) if you have any questions or concerns.*"
95,"Breathing helps me, in through the nose and slowly out through the mouth. You could also spend a little time outside in the sun."
96,"cardio workouts! (cycling, running, long walks etc...). Anxiety is like sitting in your car, engine running in Park, with your foot on the accelerator. NOT good for the engine and if you push too hard your engine will blow....exercise is like putting your car in drive. It will burn up the anxiety and relieve the stress. Sitting on social media is the opposite and counter-productive."
97,"a quick method i use to calm myself is to use repetitive motions such as tapping, pacing, or snapping. music and doodling also calms my anxiety. anything to shift your focus from whats triggering it."
98,Meditation and exercise/ eating healthy.
99,Accidentally stepping on his foot/tail.
100,I stepped on her tail :(
101,"Pets don't really have a concept of accidents, and that we see differently from them. When you get up in the middle of the night for a snack and step on your cat, they probably just think you woke up in the dead of night to go downstairs and kick them. 

That requires much apology rubs and treats."
102,I stepped on his tail. :-(
103,Many times - I apologize that it isn't supper time yet.  I apologize that I bumped him in the night while *he* was comfortable and asleep.  I apologize that I've accidentally stepped on or kicked him.
104,I had to pee in the middle of the night. My dog was laying on the floor next to my bed. I stepped on her.
105,"The Pope, or one of the Rothschilds, or a high-ranking Freemason. Gain vast political power. Reshape the world into a better one."
106,"My mom encouraged me to speak to adults/crowds while I was a young kid, and it made a huge difference in school and in my professional life as an adult- public speaking is such a common and often crippling fear!

Edit: I meant that in the context of school, extra curricular stuff, and family friends- not creepy strangers that might put me in their van."
107,"So proud of you! This is awesome. Public speaking can be such a burden to the introverted, shy, and inexperienced. Glad you got exposure at a young age."
108,He probably just crawled inside of her
109,Donkey be packing
110,A step ladder.
111,The female in the pair can physically take it. And dragons are inherently magical creatures. Opens up a lot of possibilities for fertility
112,I'm sure rule34 would have you covered for the answer to that.
113,Donkey be packing that Schmeat🥵
114,Donkey style
115,Agreed
116,and then wanked himself off
117,Using Shreks earwax
118,what for?
119,"Lube, you know"
120,oh i bet it would be wet enough inside there
121,"Selling body fluid is illegal.

Do you take your dealer to court when he sells you carrots instead?"
122,r/oddlyspecific and this is more of an r/legaladvice question
123,r/trashy r/oddlyspecific
124,"Under the Truth in Perversion Act 1999, any dirty panty fraud is solved by being laughed out of court."
125,Where does it state that?
126,"**Attention! [Serious] Tag Notice**

* [Jokes, puns, and off-topic comments are not permitted](https://www.reddit.com/r/AskReddit/wiki/index#wiki_-rule_6-) in **any** comment, parent or child.

* Parent comments that aren't from the target group will be removed, along with their child replies. 

* Report comments that violate these rules.

Posts that have few relevant answers within the first hour, and posts that are not appropriate for the [Serious] tag will be removed. Consider doing an AMA request instead.

Thanks for your cooperation and enjoy the discussion!


*I am a bot, and this action was performed automatically. Please [contact the moderators of this subreddit](/message/compose/?to=/r/AskReddit) if you have any questions or concerns.*"
127,"> **What can be done to reform \[religion\]?** 

FTFY."
128,Why do we need to reform Islam?
129,A cruise missile
130,"I don’t think you can, and certainly not letting them move to your country en masse is going to reform them either."
131,Sharia law and all that other stuff.
132,Do we dont end up as heads on spikes in 100 years.
133,yeah... that's not really a reason.
134,"Sharia law isn’t a practice of all people who are in the Islamic faith. It’s actually a small portion of radicals who want this restrictive sect of Islam.

So my answer to you is that we should educate people on Islamic beliefs more."
135,well in a 100 years I'll be dead so if they want to dig up my head and put it on a spike that's cool but I don't think Islam is much about heads on spikes.
136,I remember reading that most Muslims support Sharia law.
137,"Well, you might have kids or grandkids alive. Plus the general fate of your country."
138,Ok
139,Give me a theme and I will make an related line
140,"Suck mine, Valentine"
141,"I thought starwars or disney.. as theme. 

General (love) funny sex stuff idk hope i helped lol"
142,Stopped at one that was attached to a truck stop. The kid working the register forgot what I ordered... twice
143,I ate too much and crapped myself.
144,Harry Potter
145,World of warcraft for sure. I would single handedly kill all human beings and dogs on earth for that to happen.
146,Absolutely anywhere within the worlds of Studio Ghibli!
147,Same
148,"""If you give me a part, I'll make you my vice president in 20 years"""
149,I know the answer. When they filmed in his buildings he insisted he be written in those films as part of the rental agreement.
150,"According to a few actors he at one time had a requirement that in order to film on his property, you were required to film a cameo scene for him.  This scene didn't have to make the final cut of the film though."
151,He was rich AF.
152,"I even feel awkward to imagine him, a billionaire approaching to film makers or film makers approaching him to do all those extras"
153,That I’m going to wake up.
154,"I have this dream where I am a part of this large group of about 100-200 people. Where we are all stood on the edge of this cliff. The nightmare consists of me being pushed off the cliff to my death, but right before I hit the ground (I never get the chance to wake up from dying) my consciousness is transferred to one of the people who hasn’t been pushed off yet. The longer the nightmare goes on the more and more bodies pile up at the bottom. Happens about 5 times a month."
155,"Nothing, they're perfect."
156,The Playstation 2.
157,Colecovision.
158,N64
159,"Dreamcast, ahead of its time."
160,3DS it was perfect in my opinion
161,Atari 2600
162,"Probably the PS1. They had a killer line up of JRPGs, shooters, survival horror,  adventure games, etc.  The first Resident Evil, FFVII, MGS, Symphony Of The Night, and tonnes of other awesome games."
163,The Iowa caucus
164,"I really wish the other people that were also grieving the same loss didn't require so much support from me. Between coping with my own grief and helping to soothe theirs, I got dangerously close to having a complete meltdown."
165,I only recently started letting people know that I'm actually into stuff like warhammer
166,"Unless people ask directly, I don’t tell people that my kid got into Princeton.  I don’t want to seem braggy"
167,"My favorite book is ""War and Peace"" but saying that makes me sound really pretentious, so I usually lie and say I have a different favorite when people ask"
168,Ummm I’d say ASMR but it’s not always reeeeally SFW
169,Interesting! That's a video game? Why weren't you telling people that you like it?
170,Congrats to your kid!!
171,"Warhammer is a tabletop miniatures war game. There’s a general stigma around it that it’s incredibly nerdy (which, tbh, it is), and is also very expensive."
172,No it's closer to dungeons & dragons. It's a tabletop hobby. Most people are just really surprised when they find out that someone like me is into something like that.
173,"I trust Geralt with Brexit a lot more than I trust BoJo, so I’m all for it."
174,"Pax Man is in charge? Gottta admit, it’s an improvement ."
175,"Okay, so the blocks in Tetris rule my country? I'll drink to that"
176,The dovahkiin is prime minister? Shit still better than Justin Trudeau.
177,I know nothing about my MLB RTTS player's personality. He just hits dingers and steals bases.
178,Not every boner means a horny man.
179,We can be hypnotized by just the sight of breast. I’m 47 years old and I’m still helpless under their Power.
180,"Manspreading is not a thing, we just like not curahing our testicles."
181,GTA or Red Dead. Just the popularity of them alone would make money.
182,"Making an interactive movie about any ""choices matter"" game (Life is Strange, Little Misfortune, etc). For instance, Netflix's Bandersnatch was great."
183,I heard the 2001 Tomb Raider movie was pretty good.
184,"Gears of war, warhammer 40k both extremely action and lore oriented and probably right up Michael bay's alley"
185,"God of War, be pretty fucking dope IMO, Kratos slayin everything from the Aegean Sea to the Underworld, BEWBS, and overall a good story. 

&#x200B;

IF it's done right"
186,"“New Earth Inc. does not accept any responsibility for the following:

Earthquakes, typhoons, tornadoes, defective electronics, being lost at sea, political developments that result in torture, loss of life or wealth, trees failing to make noise upon falling, exposure to the elements, and other forms of misuse by users.

For customer service concerns, please call 1-800-GODSRUS. We hope you have a New Earth day! New Earth, Inc.: If you aren’t on us, you’re already dying on Old Earth!”"
187,"**Attention! [Serious] Tag Notice**

* [Jokes, puns, and off-topic comments are not permitted](https://www.reddit.com/r/AskReddit/wiki/index#wiki_-rule_6-) in **any** comment, parent or child.

* Parent comments that aren't from the target group will be removed, along with their child replies. 

* Report comments that violate these rules.

Posts that have few relevant answers within the first hour, and posts that are not appropriate for the [Serious] tag will be removed. Consider doing an AMA request instead.

Thanks for your cooperation and enjoy the discussion!


*I am a bot, and this action was performed automatically. Please [contact the moderators of this subreddit](/message/compose/?to=/r/AskReddit) if you have any questions or concerns.*"
188,Set an alarm and make sure it's far away enough that you have to get out of bed to turn it off
189,"Set an alarm and have a routine. Think about things you want to accomplish- is it exercise? Is it light housework? 

My alarm goes off at 5:15 every morning and the first thing I do is make my bed. 

Once you settle into a morning routine, it's less of a chore to get up early."
190,Set an alarm.
191,"People shooting other people,sniping them, mowing them down with vehicles, etc"
192,Massive car wrecks and destruction on the roads in GTA.  It's not so much fun when I have to sit in the traffic it causes.
193,Urban combat
194,Violence. In real life I hate even hearing of any slight violence but in video games I love it.
195,Ammunition and firearms.
196,It's all the way in 2024?
197,Canned goods!
198,Why would anyone want to live in a nuclear winter holocaust?
199, I would at least try once.
200,Tell her! You've nothing to lose and there's probably a small part of you that will always wonder otherwise.
201,I wouldnt be in love with her in the first case.
202,Move on
203,"Sooner than later, rip the bandaid off, and maybe you'll get a surprise but if not, hey it'll sting less than if you let it fester."
204,Sleeping with their eyes open
205,exchanging telegraphs
206,Sitting in my room shaking because some Reddit strangers ridiculed their personal  experience.
207,Listening to Ginger Bakers Middle Passage album
208,Juggling the body parts of a Hollywood actress while gnawing on fetal rhinoceros testicles.
209,Sneezing with their eyes open.
210,Bass fishing using a Sriracha bottle as bait.
211,Upvoting this post
212, Answering your question apparently
213,Me
214,"Restarting the British Empire.

I guess if no one else is going to do it then I might as well try"
215,"You

Also, be more original"
216,Playing Angry Birds.
217,Looking at my palm
218,Sleeping
219,How about with just one eye open?
220,Did you pick out this answer from cards against humanity? XD
221,Also having sex with you.
222,I guess that's quite true ✓
223,"Nah I just got done also it's not about originality, I saw this question online and I wanted to see more  answers :)"
224,"No, I was just trying to be as random as possible. But I now need to make both of those CAH cards!"
225,Well it was a good one and if I was the card Czar I'd give you points :)
226,Fly
227,The episode of any sitcom that shows a bunch of clips from past episodes as a recap.
228,Stargate SG 1 Emancipation.
229,There is a fairly well known episode of Buffy where there is a demon that feeds on sexual energy or something and it basically consists of Buffy having sex the entire episode (if memory serves) I absolutely love this series but that episode just seemed like it was trying too hard to draw in horny teens.
230,I just went vegetarian so a veggie pizza with mayo.
231,Ass
232,100000000mg/THC pan of brownies and 2L of water
233,"Grilled human, I dont care about morals and ethics I'm going to die"
234,Anything with a lot of beef and bacon.
235,Salted Caramel Cheesecake
236,5kg chestnuts 5kg raspberries
237,r/AmITheAsshole. A bunch of people who don't know how life works. Probably all 13 year olds.
238,"*I'm not mad, just disappointed*

*Sincerely, Canada*"
239,"I've learned that apart from voting, there's nothing you can do. Just enjoy life. Don't sweat the headlines. Give it as much energy as it deserves."
240,I will laugh at you yokels
241,Feel disappointed in everyone else.
242,I’ll be happy knowing my vote counted.
243,I won’t be happy.
244,Zero chance of that based on exit poll data from the last 2 elections.
245,"It will be glorious.   Four more years of prosperity and no more wars.   By the end of his second term the southern border wall will be done.   Hopefully Rosie O' Donnell,  Cher and Barbra Streisand will have moved to Canada."
246,🤷‍♂️
247,"I will realize that there is a sucker born every minute and they always vote Republican. 

A house of cards is guaranteed to fall. 

Cutting sensible relations and not implementing any is a shitty foundation even for a house of cards. 

I'm going to be fine. I have skills i could use in any State, or Country. 

The rest of you I fear for."
248,"There was this kid named Hanz who was absolutely fucking insane at boxing. 

One time I sparred him and it was like an anime fight, he dodged anything I threw and completely toyed with me. But that's when I saw how good you can actually get at fighting, so boxing became so much more cool to me after that."
249,Did either of you land any punches? How was the rest of it?
250,"if you ain't first, you're last"
251,Illegitimi non carborundum.
252,"""Punch fear in the face"" - Me"
253,Mitochondria is powerhouse of the cell
254,So silver and bronze medals are ?
255,I'm going to DISNEYLAND!
256,Wallow in it.
257,Go to the bathroom...sacrifice your underwear...clean up and go commando.    Good luck OP I hope no one noticed.
258,go on reddit to ask r/askreddit what to do
259,I have ibs d and acctually had an accident today on the train I had to sit in it for an hour
260,Clean myself up.
261,Go shower
262,Go home
263,I'm on the toilet right now so I'm fine.
264,Same dude
265,Must make life rather difficult. Hope you find a solution.
266,Yer its so annoying I have diarrhea everyday it sucks at school or in public
267,"erm, I didn't mean... solution...ummm nm"
268,Real freedom
269,"driving without a turn signal.  My instinct is that nobody has to know where tf I am going, that's not their business.  Turns out I'm wrong on that one."
270,Weed
271,"67 MPH in California?

An 18 year old male in a sexual relationship with a  17 year old female?

Pulling the tags off of those mattresses?"
272,Why does this get posted every freakin day?
273,Yikes
274,Where do you feel it sounds legal?
275,You must drive a BMW then
276,"No, I deleted it, because I thought I said it the other way, my apologies"
277,Audi
278,"I’m not very flexible, but I have very bendy fingers. I used to use them as a party trick to freak people out."
279,That question without a NSFW tag is a trap
280,Not of people have decent answers.
281,"I was just kidding, sorry"
282,New York - I don't think they have any sports teams yet
283,Some city in Nebraska or Iowa - I want a basketball team with a farmer name and logo.
284,"Truth or Consequences, New Mexico; they could use an NHL hockey team."
285,"have them with a woman instead of by hand.  


^(//and make eye contact with her during.)"
286,Edging.
287,Edging for long periods + not jacking off for a couple days
288,add bacon
289,"Look for my book, releasing this fall.

My methods guarantee a male orgasm."
290,Stop beating it so much
291,Here’s the big one: jerk less often.
292,"Finger tips are not nice tips, pretty much the opposite."
293,Prostate.
294,"Right when he’s on the cusp of completion, yell “YES LORD FARQUAD!!!”... that’ll do it (joke)"
295,"Wait a week, then jerk off with one hand and use the other hand to massage the taint/gooch/whatever you want to call the area between your balls and your asshole.

You want to push in about an inch until you feel the bumpy parts and start moving your fingers up and down, it's essentially massaging the prostate but without going up your ass.

Enjoy."
