,comment
446,"As a classic example, a scientific paper found a statistical correlation between lack of cancer and drinking red wine once a day. After that every morning show was talking about how drinking red wine cures cancer."
447,Science Friday has been an NPR staple for a better part of 30 years. NPR is one of the best sources for information along with Reuters news radio. No propaganda. No sensational puff. Just facts by people that care about truth.
448,"See the sugar and oil industries for examples of money-for-papers.

However, the vast majority of scientific peer reviewed papers (at least in the US and Europe) are based on research funded by public money. Doesn’t make any given study or paper “right,” but I think that skewing (or suppressing) results to please the paymaster is relatively rare."
449,"If you want to wait a few hours until I'm fully awake, I can give you a long list of podcasts that I find especially good/interesting. What are your interests?"
450,Eons!
451,Updoot!
452,"No, but I've now got a new daily podcast thanks to a quick Google search.  Thanks!"
453,"Abstracts are still dry and often full of jargon, because the audience is expected to be familiar with those terms.

Science paper name:  Exposure to high saturation levels of sucrose in mouse models leads to excessive adipose tissue development on a predictable growth scale

General audience journal article name:  Meet the scientist who proved that mice get fat when they drink sodas"
454,Where should a teacher wanting close that gap a bit to catch-up go to learn how to do so?
455,"Nice job explaining the theory-practice gap to the general audience of Reddit.

That said, do you want to have to explain that everytime you reference it to another educator? Or is simply saying theory-practice gap easier?"
456,"I think your argument is perfectly sound. However, education is a rather special case when it comes to academic research. Jargon allows a number of complex concepts to be discussed in a single packet, which is rather crucial for efficiently communicating at the frontiers of a technical field. Papers have to be maximally precise; analogies and common English are typically insufficient. I do think the typical academic work could use a pass or two at de-jargoning, but it should only be applied where it can be gotten away with."
457,">we have a huge problem of teachers being years if not decades behind the latest and greatest in educational practice because the last time they got any sort of educational theory was in college

Not to be a cynic but, in my experience, even when practicing teachers know the theory, it often doesn't help very much, for a variety of reasons."
458,"At a guess is say that there's a term for predicted grades, or the poorer kids etc that lay people won't know?

My housemate for example is a teacher and drops the odd term. SEN for example, so a lot of lay people isn't necessarily known, but is perfectly understandable to those in the industry.

The theory practice gap absolutely applies, and is important to bridge, but there's also a theory-lay person gap which is even bigger.

Within research contexts I'd absolutely say being concise and using correct terminology to prevent confusion is more important than bridging that gap."
459,I find it interesting that you use jargon (theory-practice gap) and have to contextualize it before carrying on. It would be exhausting to do this constantly. For writer and reader.
460,Depends on the field. I refuse to believe that there's any significant amount of people outside the field reading catalytic electrochemistry papers.
461,"Personally I prefer short and extremely dense articles with easy to digest abstract and conclusion. Then you get it both ways. A 40 page paper takes too long to read when you have a 100 papers to read. And when I write a paper I prefer short and concise. I absolutely only write to my peers. But the abstract, posters, perhaps figures, and 50% of the discussion/introduction I try to make more general. Even then papers tend to be over 20 pages long. But yes, it's important to communicate out from the ivory tower but time and money. Too little of either."
462,"Within-field academic writing should be short and to the point even if it includes jargon. Scientists have to read and digest an insane amount of material to keep up in their field, and when you know the material it's much easier and quicker to read the jargon.

For example, I unfortunately read many papers adjacent to my field (math) which are written by people slightly outside my field (CS). Mathematical writing becomes long, clunky, and cumbersome when it includes all computational steps without omitting obvious ones, and when it and avoids using words like ""functor"" and ""colimit"" except as an aside. Most of the 40 page papers I've read shortened into digestible 3-5 pages of mathematics that would have taken me significantly less time to read and communicated the point more clearly to people in the field."
463,Why would you not want the average person to understand the article?
464,"I agree, but there are definitely niche scientific fields that rely on jargon for concision. There’s also the argument that the vocabulary used in niche fields is ubiquitous in their individual communities, so any reader will likely already be familiar with the jargon. This isn’t always the case, though."
465,I think he means that if every research paper had to explain everything in plain English it would get a crazy amount bigger. Like behind a lot of the jargon are some very complex ideas and theories that could take a paper themselves to explain in plain English.
466,"I just joined the field of catalytic electrochemistry, and have to look up stuff very often. I look through some of the articles and don't see how the articles could be written without jargon, without seeming almost ironically dumbed down. And I don't see why they would remove the jargon, because the only time someone without at least a bachelors degree in the field would read the papers, is when the university PR department want to overhype a new release."
467,"In many scientific fields, the concepts being talked about, the prior research being treated as a given and known to the audience, is so vast and so complex that it is just not feasible to make it readable to a lay audience. You don't just go and make a physics paper ""easily digestable"". It's full of math! You don't just ""put in extra work"" to make a genetics paper easily digested. It's just not feasible and not necessary.

These papers are so specific, if you broke them down in simple language, they would stop being useful to scientists who speak the language of science. At least in the hard sciences, being understandable to laymen is not a desireable goal."
468,"Yes, that is where scientific journalism comes in, to translate the study for the lay person. 

If every single academic paper had to be readable to the common person, they would basically be statistics text books"
469,Coherent to a lay person is not the same as coherent to someone in the field.
470,"In order to be precise and accurate, you almost always need to use jargon, which is what you're arguing against. Dumbing down research papers isn't going to do anyone any good."
471,Publishing papers is 20% writing and 80% cutting and condensing (which is where the use of jargon comes in).
472,This is the second time I've heard the solo thing with regards to working in two days. I'm assuming it's referring to work groups that don't really interact with other teams?
473,Yes it's no different.
474,Im enjoying the use of jargon to explain why jargon is bad.
475,"I think the findings are generally valid but I don't think the OP study simulates reading a technical paper very well.  The participants only read 1 paragraph which does not mimic the mental pacing and focus of reading a paper.

I think there is a ""focus budget"".  People will hang with you for a couple of definitions but more than that and you lose them."
476,I agree.  A lot of readers will hang with you for 2-3 new definitions but more than that and poof.
477,Because the use of jargon killed their interest.
478,">Shocking that you have to know and write for your audience ...

I don't think he was advocating everyone writing for 5th graders."
479,Player ooc: I’ll check John’s journal!
480,"And it contains no information a person who would otherwise be interested in reading scientific journals doesn't already know, or can't find out within minutes."
481,And it's a complete pain to read because it's so verbose
482,[removed]
483,[removed]
484,[removed]
485,[removed]
486,[removed]
487,[removed]
488,[removed]
489,[removed]
490,"It _is_ necessary, though. The medical field uses latin because you can describe _exactly_ where and what an injury is with just two or three complicated words.

When you replace one or two _sentences_ with a couple words, it makes catching someone else up _a lot_ faster, notes shorter, diagnosis far more difficult to misconstrue when it's an exact term instead of a loose description, etc, etc. It also helps a lot when working in other countries. Instead of a doctor going, ""crap, I don't know the French word for infection, how do I say this...""

Unified terms also make international R&D infinitely easier for similar reasons.

Latin/Greek in the medical field does make sense. Though journalists are still fully capable of overusing the terms, of course. Though that's a question of a journalist's ability to write about complicated topics for a target audience. If they can't at least explain the terms in an article meant for plebs, maybe they shouldn't be writing on the topic for plebs..."
491,"I personally love the greek roots used in medicine--once you learn the ""code,"" its really easy to describe symptoms or novel discoveries. 

For example, once you learn that ""brady"" means slow, then you can deduce that ""bradykinin"" does something slow, ""bradycardia"" has to do with a slow heart (slow heartbeat in this case), and ""bradypnea"" has something to do with ""slow lungs"""
492,">in my experience (as a college science instructor) students have a big issue with the idea of ""scaling"".

I think that's probably due to how math is often stigmatized as hard or ""I'm never gonna use this stuff anyways"""
493,"Where are laypeople reading articles with jargon? Some laypeople do read actual journals, others read ‘vice science’. 

That last bit has a lot to do with ‘changing jargon for an audience’ while still remaining true to the actual meaning and specificity of terms.

At the end of the day, if seeing scientific jargon puts you off of science, you really aren’t meant for science. If one is truly curious jargon is easy to understand after background. Up until college level really standardized testing of ‘science’ melts down to basic reading comprehension."
494,"What you're describing is science journalism, like National Geographic. It's totally a thing and has been a thing for ages, which is good.

The only problem, highlighted by the article, is when NatGeo in some effort to be more scientific, forgets who their audience is and packs it's pages with jargon such that readers are turned away and care less in general about science as a result (the opposite of their goal). 

You're absolutely right, both types of work need to exist, one for the professional scientific community and one for the lay community. This study is simply a critique of certain possible methods of disseminating the scientific information to the latter effectively."
495,You mean like research papers versus reports about research papers?
496,"There usually is. There's the original journal article, and then if it's picked up by a pop science website the version intended for the general public. My preference is to read the original journal when possible because I find pop science journalists can at times skew the original meanings the researchers presented. However, pop science reporting of journal articles is important for the proliferation of new research into more of a general, uninformed audience. This study seems specifically aimed at science journalism, or pop science writers. Something I think a lot of people missed because, surprising to no one, most only read the title."
497,"And you have to be really careful to not lose your audiences attention when going through the explanation, especially verbally. Five minutes to explain something to me just so I can continue to have a conversation about the topic is too much."
498,You don't have to do worry about such accurate verbiage for a non-technical audiences. The explanation has complete different context and goals.
499,"I think a significant amount of it is gatekeeping, more than specialist would like to admit, I can vouch it is true in accounting and finance at times"
500,">while the scientific meaning is about two steps shy of a Law of Nature.

I would call law and theory on the same step or perhaps on two completely different sets of stairs. Since a law is something we know happens and we can make an equation that describes it(gravity for example), but we don't know why that something happens. That's where a theory comes in. To use gravity again as an example, Issac Newton made a law of gravity. He made an equation to explain it. But a theory of gravity would be developed much later as the result of research by Einstein and other scientists that tried to explain why gravity exists and how it works."
501,"Lots of terms work like that.  ""Cyborg"" and ""Hacker"" are two that I bump into a lot in my work, where the common view of these words leads to terrible jokes and  the occasional threat to call the police..."
502,"A law of nature is a different class of thing than a theory. A law of nature is an observation. An observation that always holds true, but still an observation. Laws are things like: stuff falls, heat moves from hot to cold, gasses expand when you heat them.  

A theory tells us why something happens. Curvature of space-time, hot molecules bounce harder off the walls.  Theories take all of the relevant observations and weave them into a story that explains why the things we saw happened. 

If I see something happen once (a better joke in the comments), it isn't a law of nature. If I see the same thing every time across multiple scenarios (the real joke is always in the comments) it starts to gain acceptance as a law. I can now use that law to support (or invalidate) other ideas, because it is accepted that it will always happen. 

I have a hypothesis (an unsupported explaination) that better comedians don't submit, but only comment. There is a competing hypothesis that commenters have the ability to improve on the OP because they have a chance to respond to feedback in the comments.

I can make observations to test my hypothesis, (looking to see if ""real joke"" commenters ever submit jokes) if I find examples where my hypothesis doesn't work, I refine it, or outright reject it.  Eventually, with enough evidence the community will accept one of the explanations. At some point we start calling it the theory of the real joke, because it accurately (to the best of current evidence) explains why this law always holds true."
503,Speaking as someone in science...you’re having an unusual experience
504,"I've seen a similar thing in my field (infosec) but for a different reason. Most of the time they use the jargon because they don't understand the issue and not necessarily to hide that lack of knowledge. 

An over simplistic example: new analyst sees a threat in a tool related to SMTP communication. They contact the user and ask ""hey, I noticed an application using SMTP is being blocked by our firewall from your computer. Any idea what might cause that?"" Of course, user has no idea what that is. The analyst doesn't know that SMTP is simply email. They could have asked the user (had they known) ""hey, is your email acting funny? We noticed something being blocked from your computer.""

Hopefully my analysts know about smtp, but I've seen this with more esoteric protocols."
505,The thing about BuzzFeed is that it is actually purer than the real science. Just ask any scientist and they’ll tell you. (Shh! It’s a huge conspiracy.)
506,"I'm an avid NPR listener, but I have to disagree with your statement of ""no sensational puff."" I may be misunderstanding what you mean by it, but there are some topics they really hammer home all day and really lay on a hard spin. The spin often aligns with my own viewpoint, but it's still there."
507,"It's far more common for an entity that wishes to see a specific kind of result out of a research paper to simply find a scientist with strong personal bias than pay them off, cheaper and has more plausible deniability. This is why it's always a good idea to be aware of a scientist's background and factor that into perception of their work. Even just as a matter of time dedication. Someone who has literally spent their entire lives studying, trying to understand and possibly even teaching others about a given theory or model are not going to be eager to disprove it and will not uncommonly go to rather comical lengths to deny any attempt to do so. The Great Debate in astronomy and astrophysics is a fantastic example of this. 

That said there are also matters of maintaining access to research resources to keep in mind as well. Whether or not someone is directly told to come to a certain conclusion there may be pressure to do so out of fear that they will lose access to critical resources for further research. Most research scientists operate on very minimal budgets and every penny counts, losing access to what little funding they have can be disastrous."
508,Dump em all? Then anyone passing by might catch some they like!
509,"Wait do it for me instead, I like history and current news, as well as celebrity hosted shows. Current ones im listening to that fit into each category are American Elections: Wicked Games, NPRs politics podcast (not the best but short enough to quickly listen to), Armchair Expert and You Made it Weird!!! I have a good list to run through but still find myself af least once a week out of something to listen to."
510,"I would only use the term ""theory-practice gap"" in conversations with other academics and maybe with principals/superintendents.  The only reason I mention it here is because we are on /r/science and I wanted to use the actual term that would produce hits on Google Scholar or EBSCO or what have you."
511,"It's not that you don't want an average person to understand. But at some point you can't just keep reminding people how to plug numbers into functions at the start of every math class, you can't keep reminding people what a chemical formula means at the start of every chemistry class, you can't remind people that gravity follows an inverse square law , or you'd never get  anything communicated, you'd have to start from square 1. That's just within one undergraduate degree. Now consider that scientists have worked within their field through at least their master's and are primarily concerned with figuring out what is true and disseminating that information efficiently to others who will make use of that information, as well as absorbing new information efficiently. They're not going to go back and review chemical formulas or even the distinction between Ab initio and Newtonian molecular dynamics simulations (that would be mentioned and left as a reference). Communication would grind to a halt otherwise."
512,"It depends on context. Sometimes ""jargon"" will contain levels of nuance relevant to the paper. To completely break it down - note that explaining jargon is not sufficient according to the article, usage of jargon even when explained still dissuades your average reader - would bog down the paper especially in regards to its target audience. It's a tradeoff between accessibility and efficiency in that frame."
513,[deleted]
514,"> almost ironically dumbed down

Did you mean 'almost comically'? :)

In any case, I agree, the point of 'jargon' is that you can carry a whole paragraph of meaning (or even way more) in a single word. This is bad for people not in the field, but that's not who research papers are aimed at - it is however very good for efficient communication between people in the field.

Sometimes, there is a tendency to make sentences sound more complicated than they need to be, I have noticed that before - it makes your argument sound more learned e.g. in a paper. In my opinion, that's a bad thing - but most of the 'jargon' discussed by OP's article is not unnecessary complication, it's just technical terms without which science can't really function."
515,"> At least in the hard sciences, being understandable to laymen is not a desireable goal.

Neither is it in the not-so-hard sciences. *Every* science relies on using a set of defined terms that each would take quite a while to explain to a layperson, if they could even understand it by itself without first having to learn a whole host of other terms.

Science just can't be simplified and still be useful for scientists in the same field. It can be simplified so it's more understandable to laypeople, which is of course perfectly fine, or rather, definitely necessary, but that's not how state-of-the-art or cutting-edge research is conducted."
516,For sure! Totally agree.
517,"It's silo. Imagine [grain silos](https://i.imgur.com/ifXgvwn.png), they are right next to each other but the grains are completely separated from other silos. I've seen this analogy used to describe Twitter social circles. Everyone is on twitter, but a far left leaning individual will have a completely different twitter feed compared to a right wing individual, to the point where their information and the people they interact with are completely separate despite all taking place on the same platform."
518,"This explains it in an ok way: [https://en.wikipedia.org/wiki/Information\_silo#Silo\_mentality](https://en.wikipedia.org/wiki/Information_silo#Silo_mentality) 

And yes, it's a term for the various structures that divides workgroups and hinder interaction."
519,"A silo is any situation in which information is stored within a specific subgroup/sublocation as opposed to being stored in a location that is shared by the entire group. Putting information in silos limits the accessibility of the information, and severely limits how easily that information can be integrated with information that's held in a different silo."
520,"Jargon isn't used for fun, it's used for precision of language. Big, technical words are important to accurately convey a concept in technical writing. Technical writing isn't meant for laypeople, and that's fine."
521,The jargon is necessary to quickly communicate complex topics without overly descriptive prose.
522,It's not written for them. It's written for experts and the jargon is necessary. The press release version is the one that needs to mind the jargon.
523,"If they read at a 5th grade level, were they ever interested to begin with?"
524,Source?
525,"Read the context of the comments. It was in reference to someone talking about writing science journal articles, not popular media."
526,[removed]
527,[removed]
528,"Aren't meant for science?  Sorry, but thats ridiculous. And harmful, you need to understand how toxic that idea is when you look at how people from underserved communities often suffer from imposter syndrome and a lack of confidence when beginning their college careers. Little things like scary, big words setting that off may sound stupid from someone who cant relate, but we dont research topics like what the article is about so that we can look at who to judge."
529,"The very article that you're reading is an article meant for public consumption. It is not a journal article, but is reporting on the detailed results for the public."
530,">Where are laypeople reading articles with jargon? 

In Pubmed, among other places. I’m a non-scientist layperson who accesses tons of scientific articles through Pubmed."
531,"Good scientific articles (those that could equally be explained verbally) focuses more on what we know about a process through causation than on simply describing the different components (of which there'll be many to memorize) and observations. I refer to papers describing causation in a process as knowledge papers and the other as observational papers that basically describe the data.

Knowledge papers provide insight into the process rather than just describing different categories of events/data typified in observational papers. An observational paper will typically have a lot of technical jargon. It makes sense that such papers are hard to read, since the gist of the paper is clouded by terms instead of a description of the causative process.

The vast majority of scientific papers are observational papers, mostly because it's much easier to write and publish given publish or perish academic environment. Knowledge papers are extremely difficult to write since everything you write must be falsifiable and evidenced. The same does not hold for observational papers (just needs some evidence interpreted using some peer-accepted approach)."
