,comment
0,The *Nature* paper: [https://www.nature.com/articles/s41586-020-1976-7](https://www.nature.com/articles/s41586-020-1976-7)
1,"If you're paid min wage, a $0.50 raise isn't gonna get you better healthcare, but it will feed you better and help your psyche a little when the check arrives.

Feels like one of those ""It doesn't fix everything so it's worthless"" fallacies."
2,"Study: [https://academic.oup.com/aje/advance-article/doi/10.1093/aje/kwaa018/5731781](https://academic.oup.com/aje/advance-article/doi/10.1093/aje/kwaa018/5731781)

Abstract: States adopt minimum wages to improve workers’ economic circumstances and wellbeing. Many, but not all, studies find evidence of health benefits from higher minimum wages. This study used a rigorous “triple difference” strategy to identify the associations between state minimum wages and adult obesity, body mass index (kg/m2), hypertension, diabetes, fair or poor health, and serious psychological distress. National Health Interview Survey data (2008–2015) on adults ages 25-64 (n = 131,430) were linked to state policies to estimate the prevalence odds ratio or mean difference in these outcomes associated with a $1 increase in current and two-year lagged minimum wage among less-educated adults overall and by gender, race/ethnicity, and age. In contrast to prior studies, there was no association between current minimum wage and health; however, two-year lagged minimum wage was positively associated with the likelihood of obesity (prevalence odds ratio: 1.08, 95% confidence interval: 1.00, 1.16) and with elevated body mass index (mean difference: 0.27, 95% confidence interval: 0.04, 0.49). In subgroup models, current and two-year lagged minimum wage were associated with a higher likelihood of obesity among male and non-White or Hispanic adults. The associations with hypertension also varied by gender and the timing of the exposure."
3,Along the same lines... enough money to buy disinfectant and some fresh vegetables is a big step up for alot of people's healthcare.
4,"Given that our minimum wages are well below proper living wages, a $1 increase isn't going to suddenly change your life significantly-you're still not making a living wage"
5,"Title: The Tyranny of the Single Minded: Guns, Environment, and Abortion

Authors: Laurent Bouton, Paola Conconi, Francisco Pino, and Maurizio Zanardi

Journal: Review of Economics & Statistics *(Forthcoming; Posted Online Jan 23, 2020)*

Abstract: We study how electoral incentives affect policy choices on secondary issues, which only minorities of voters care intensely about. We develop a model in which office and policy motivated politicians vote in favor [of] or against regulations on these issues. We derive conditions under which politicians flip flop, voting according to their policy preferences at the beginning of their terms, but in line with the preferences of single-issue minorities as they approach re-election. To assess the evidence, we study U.S. senators' votes on gun control, environment, and reproductive rights. In line with the model's predictions, we find that i) election proximity has a pro-gun effect on Democratic senators and a pro-environment effect on Republican senators; these effects arise for senators who ii) are not retiring, iii) do not hold safe seats, and iv) represent states where the single-issue minority is of intermediate size. Also in line with our theory, election proximity does not affect votes on reproductive rights, due to the presence of single-issue minorities on both sides.

DOI: https://doi.org/10.1162/rest_a_00897

Direct PDF Link: https://www.mitpressjournals.org/doi/pdf/10.1162/rest_a_00897"
6,"The write-up misses the main point of the article, which has to do with the spatial and temporal statistical nature of singling in the neocortex during 'consciousness'. The stimulation is a way to drive the particular frequency (50Hz) across cortical regions. The idea that the thalamus supports wakefulness and sleep is not new, nor is the idea that stimulation can wake up an animal. For instance, you can get a partial awakening with tactile stimulation (pinch). Nurses use the sternal rub to arouse people. This information goes through that thalamus before the cortex. The thalamus is involved in consciousness like a router is involved in the internet - a necessary relay, but not the source of content."
7,Cool. They should experiment with psychedelic mushrooms
8,Central lateral thalamus is the room and there is a homunculus sitting in it.
9,Just don’t do it to a chimpanzee called Caesar.
10,The monkeys or the scientists?
11,Bof of em
12,Smol T-Rex only 8ft tall
13,"Orginally from the southern region's of Texas, they would only stop to rest with the raptors a brief moment in Canada  before migrating home to LA."
14,This is awesome. It always bugs me that we give things such boring titles. I feel like if stuff had badass names like this life would just a little more enjoyable. Gives color to the world.
15,I cant believe I read 5 pages of ancient potato study. Cool info though.
16,"From the article:

**Native peoples of the** American Southwest are believed to have cultivated corn, squash, and beans as early as 4,000 years ago. Known as the “three sisters,” these crops were originally domesticated in Mesoamerica and later brought north. Now that archaeologists have uncovered millennia-old evidence that potatoes, which are indigenous to the Southwest, were consumed in the area as well, they are trying to learn whether the tubers were cultivated in addition to being harvested from naturally occurring stands."
17,"Found this article and the studies really interesting - my parents speak something like 12 languages between the two of them, and I struggled and ultimately failed to learn a second language..."
18,I think this is probably similar to an olympic running using less energy than Joe AverageMan to run.
19,"Marijuana made me want to invest my mental energy in becoming a poly glot.

I, by no means am intelligent, but was able to pick up a few languages quite well when I changed my desires.  It came easier.

Could a willing mind be more relaxed than a struggling mind?"
20,"If you speak two languages, you are bilingual.

If you speak three languages, you are trilingual.

If you speak many languages, you are a polyglot.

If you speak one language, you are an American."
21,"Paper: https://ascopubs.org/doi/abs/10.1200/JCO.19.01203

**Dietary Supplement Use During Chemotherapy and Survival Outcomes of Patients With Breast Cancer Enrolled in a Cooperative Group Clinical Trial (SWOG S0221)**

>CONCLUSION

>Associations between survival outcomes and use of antioxidant and other dietary supplements both before and during chemotherapy are consistent with recommendations for caution among patients when considering the use of supplements, other than a multivitamin, during chemotherapy."
22,"It's not a specialized language, it's vocabulary.  Anyone with access to the internet can use it to help them learn the new words that come up in science they might not be familiar with.  I do it all the time when I run into a word I don't yet know."
23,"The first part of the title seems off. 

Between

> People who use more scientific words are more likely to post on r/science

And

> People who post on r/science are more likely to use more scientific words 

The latter would probably have been more fitting."
24,"Is it also the case that people who use musical words are more likely to post on r/music? Or art words on r/art? 

If only there was a solution to these linguistic barriers to public discourse. Could we set up an alternative sub where ignorance of technical language was the bar of qualification? Because I would rather read from people who aren’t versed in the complexities and technical nuances of any particular topic; especially science."
25,Where is it written that the public must be scientifically illiterate? People say the dinosaurs went extinct because their tiny brains couldn't cope with the changes that happened 65mya--as if our brains were doing any better with the changes happening now.
26,"Every area of human endeavour has specific terms. Science is no exception. Just as a sports-person, an engineer, a quilter ('fat quarter' is not the 3 months after Christmas, okay?) etc have their terms, scientists have detailed terms that define things. 

If you can learn to fix a car, or garden, or program a computer, you can learn science. There's no barrier.  There is an effort required, if you want to get to PhD level, but citizen science is available to everyone and there are websites, publications and major institutions there to encourage participation."
27,All this says to me is that you're asking scientists to learn an additional level of nomenclature instead of learning what is required to participate in expanding the knowledge of science
28,You're not wrong. :)
29,"That's a good thesis. It has great potential. It is particle-ly good.

I can't think of any more scientific words. Apart from eigenvector, but I don't know how to make that into a pun."
30,You're describing r/explainlikeimfive
31,"Nah, it takes really qualified people who are excellent communicators to explain things to five year olds. I want a sub for science- and a myriad of other topics that require expertise- to be populated by people who don’t even know how to communicate the core and basic concepts of the topic. 

Maybe I’m describing Facebook... I think I’m describing Facebook."
32,"Definitely Facebook, possibly also Twitter"
33,"> ""Specific to heterosexual relationships, girls may use more violence on their boyfriends to try to solve their relational problems, while boys may try to constrain their aggressive impulses when trying to negotiate discord with their girlfriends,"" said Sameer Hinduja, Ph.D., lead author and a professor in the School of Criminology and Criminal Justice within FAU's College for Design and Social Inquiry, and co-director of the Cyberbullying Research Center. ""It's unfortunate to be thinking about dating abuse as we approach one of the most romantic days of the year, Valentine's Day. However, it is clear that digital dating abuse affects a meaningful proportion of teenagers, and we need to model and educate youth on what constitutes a healthy, stable relationship and what betrays a dysfunctional, problematic one."" 

Considering that women have been found to be equally aggressive towards their male partners or even more aggressive (there's not enough research to say which it is yet), it makes sense that males will get the brunt of it. 


> Results of the study, published in the Journal of Interpersonal Violence, showed that more than one-quarter (28.1 percent) of teens who had been in a romantic relationship at some point in the previous year said they had been the victim of at least one form of digital dating abuse. These included: whether their significant other looked through the contents of their device without permission; kept them from using their device; threatened them via text; posted something publicly online to make fun of, threaten, or embarrass them; and posted or shared a private picture of them without permission.

> In addition, more than one-third (35.9 percent) had been the victim at least one form of traditional (offline) dating abuse (i.e., they were pushed, grabbed or shoved; hit or threatened to be hit; called names or criticized, or prevented from doing something they wanted to do).

> Interestingly, males were significantly more likely to have experienced digital dating abuse (32.3 percent) compared to females (23.6 percent), and more likely to experience all types of digital dating abuse, and were even more likely to experience physical aggression. No other differences emerged with respect to demographic characteristics such as sexual orientation, race and age. 

Female aggression is normally believed to be less physical than male aggression by researchers, so this certainly is an interesting result."
34,"As the parent to a 15 year old girl, I can attest to this being the wild-f-ing-west when it comes to the integration of tech into their lives. I can't say I've seen her be abusive to her romantic interests online, but I've definitely seen it pointed at her. There is so much happening online with this generation that we dumb ass X'ers are not aware of that it would be amusing were it not terrifying. Things happen instantly with them, and the effects of those instantaneous actions can go across an entire school within literally ~~5 minutes~~ seconds. In that time, if you ask the kid involved, their lives can ""be ruined"".

Dating, in particular, is an entirely different ballgame from when I was in HS. You have a disagreement at school with your bf/gf? Gotta wait till you can get phone permission to continue it, or table it until the next day - when cooler heads prevail. Now? You're always in touch (until the parents shut the phone down for the day) so those interactions are constant and ever changing. And when they go sideways, they go very, very sideways. Their texted conversations under duress are brutal because they're not looking at each other face to face. 

Anyone that has ever parented a young teenage girl knows firsthand how f-ing crazy those people are emotionally. I have little doubt that she's lashed out at a boy that she feels treated her in a way she didn't appreciate and I can only imagine what that lashing out entailed. Again - it's the instant-access that social media allows that is the issue here. There is no 'cooling off' period and it's 24/7

It sucks for kids today. Tech hasn't made their lives easier. IMHO, its made it harder, and its made them far more susceptible to damage from peers."
35,"Also studies on violence in relationships show that men are the victim more often.

What saddens me about it, and tell me if you feel otherwise, is that it appears to be seen less of a problem if men are the victims than if something happens to women.

Especially for young boys today that must be devastating. And I would not be surprised if it was one of the reasons why boys commit suicide 4 times more often than girls."
36,"One third got hurt by offline dating, and one quarter got burnt online.  Take your pick."
37,“With February being Teen Dating Violence Awareness Month” TDIL
38,From other boys or from girls or what?
39,"Couldve told you that, anyone in the dating is burned, usually the guy is"
40,"No no no, this is stupid. 


Girls have things happen to them.


Boys have agency."
41,I know I feel really bad for kids now.  I can’t imagine what growing up would have been like with all this internet.  I literally played with sticks outside for fun
42,"I believe more men die of suicide each year due to being a dv victim than there are adults dying of dv. 

No sources available to explore this though."
43,"Or we could teach everyone how to respect each other on a relationship.  Boys have been hearing it for years, now we have to start telling the girls as well."
44,From the article I gather that would be girls.
45,"> Interestingly, males were significantly more likely to have experienced digital dating abuse (32.3 percent) compared to females (23.6 percent), and more likely to experience all types of digital dating abuse, and were even more likely to experience physical aggression. No other differences emerged with respect to demographic characteristics such as sexual orientation, race and age.
> 
> ""Specific to heterosexual relationships, girls may use more violence on their boyfriends to try to solve their relational problems, while boys may try to constrain their aggressive impulses when trying to negotiate discord with their girlfriends,"" said Sameer Hinduja, Ph.D., lead author and a professor in the School of Criminology and Criminal Justice within FAU's College for Design and Social Inquiry, and co-director of the Cyberbullying Research Center. ""It's unfortunate to be thinking about dating abuse as we approach one of the most romantic days of the year, Valentine's Day. However, it is clear that digital dating abuse affects a meaningful proportion of teenagers, and we need to model and educate youth on what constitutes a healthy, stable relationship and what betrays a dysfunctional, problematic one."""
46,"I am not sure I follow. Maybe there is a misunderstanding? The suicides are not due to domestic violence, if that is what you thought I was connecting here?"
47,">And I would not be surprised if it was one of the reasons why boys commit suicide 4 times more often than girls.

I was confirming that anecdotally you are right. I run a support service for men and have had many victims of DV disclose a suicide attempt or suicidal ideation.

This is partly due to them being denied care and harmful interventions by the police and child protection services, due to the men being the presumed perpetrators.

My country has about 600 make success each year. There are on average 10 adult male and 14 adult female family violence deaths. 

I'm claiming that there are at least 24 men killing themselves annually due to being the victim of DV, with that being about 5 percent of annual suicide deaths. Seems very likely to me."
48,"Great case study of a traditional, subsistence based economy which result in environmental stewardship and natural resource protectionism.

>Abstract
>	Strategies to reduce, halt, and reverse global declines in marine biodiversity are needed urgently. We reviewed, coded, and synthesized historical and contemporary marine conservation strategies of the Kitasoo/Xai’xais First Nation in British Columbia, Canada to show how their approaches work. We assessed whether the conservation actions classification system by the Conservation Measures Partnership was able to encompass this nation’s conservation approaches. All first‐order conservation actions aligned with the Kitasoo/Xai’xais First Nation’s historical and contemporary marine conservation actions; hereditary chief management responsibility played a key role. A conservation ethic permeates Kitasoo/Xai’xais culture, and indigenous resource management and conservation existed historically and remains strong despite extreme efforts by colonizers to suppress all indigenous practices. The Kitasoo/Xai’xais’s embodiment of conservation actions as part of their worldview, rather than as requiring actions separate from everyday life (the norm in nonindigenous cultures), was missing from the conservation action classification system. The Kitasoo/Xai’xais are one of many indigenous peoples working to revitalize their governance and management authorities. With the Canadian government’s declared willingness to work toward reconciliation, there is an opportunity to enable First Nations to lead on marine and other conservation efforts. Global conservation efforts would also benefit from enhanced support for indigenous conservation approaches, including expanding the conservation actions classification to encompass a new category of conservation or sacredness ethic."
49,"PENGUINS. 

Change the picture, there are no penguins in the Northern Hemisphere outside of zoos."
50,"Haha that’s just the journal cover for the issue, has nothing to do with the publication."
51,"Personally I'm disgusted by the unscrupulous use of the word ""scrupulosity."" I know some of you think it's scruptastic and others go so far as scrupulicious, but it's just plain scruponymous if you ask me."
52,"Paradoxically? 

Someone who needs a CCTV in the sky to do the right thing can't have strong inherent morals to start with. Now can he?"
53,"[Graph from the study](https://www.frontiersin.org/files/Articles/462572/fpsyg-11-00051-HTML/image_m/fpsyg-11-00051-g001.jpg)

More specifically, there was a correlation between the fear of sin and disgust towards cold sore, dog feces and vomit. (Among other things)

One thing that stood out to me was that participants seemed to put great value on biblical truth. This could just be me interpreting things incorrectly but that seems to play a significant role, as in, scripture enhancing disgust for specific objects or activities and playing in on natural instinct of people's disgust."
54,It's also strongly associated with political orientation.
55,"This explains  ""frothy fecal matter"""
56,"Morality has numerous dimensions. [Moral foundations theory](https://en.wikipedia.org/wiki/Moral_foundations_theory) counts Care/altruism, Fairness, Sanctity/purity, Authority/respect, Loyalty, and sometimes Liberty. One can certainly care deeply about a subset of these but less for others, as our political affiliations indicate. And different religions focus on different moral axes:  Haredi Judaism focuses on sanctity and loyalty, whereas Quakerism on care and liberty.

There's a extensive literature about disgust, the ""behavioral immune system"", and its relation to politics, though less on Purity-axis religious morality.

Many atheists/agnostics rate high on the care, fairness and liberty axes. The nature of their (*our*) self-selection means that in more religious nations they (*we*) aren't representative of the general population on the authority and loyalty axes. They become blind spots (to the extent I have difficulty comprehending them as moral axes at all). Maybe despite no doubt proportionate number of obsessive hand-washers among non-believers, the Purity axis is a blind spot too."
57,Causality is always a big question. I've often been surprised at the loathing Muslims feel for dogs.
58,"Its maybe not just the sitting in itself, but the not having friends or activities to do part."
59,classic case of the chicken - egg dilemma
60,Maybe depressed kids tend to sit still.
61,"It's not term limits we need but more parties. In other countries you have several parties so the extremists on both ends get their parties and don't fill up the two major ones like we have it right now. If we would have a right winged party, your current president would be the head of it but wouldn't be president as he would have no chance to get the moderate Republicans into the boat. Since there is only one party option for them, they all go with it."
62,The goal of term limits is not reduce polarization.  It's no reduce the ability of career politicians to monetize their positions.
63,I don’t think this is true. Countries with multi party systems don’t seem less prone to corruption and fascism than single dual party countries. Until very recently the USA had remarkably robust public institutions.
64,"I am not talking about the corruption part but the hate in politics part. Look for example in Germany where the right winged parties are at the moment are not that strong as the conservative Christian party CDU and CSU. In a two party system the CDU/CSU would be like the Republicans but since they have more parties, Trump and other extremists would be in the AfD or even worse and with that wouldn't have a chance to become nthe head of the country."
65,"# Abstract

>This study finds that the online “fake news” game, *Bad News*, can confer psychological resistance against common online misinformation  strategies across different cultures. The intervention draws on the  theory of psychological inoculation: analogous to the process of medical  immunization, we find that “prebunking,” or preemptively warning and  exposing people to weakened doses of misinformation, can help cultivate  “mental antibodies” against fake news. We conclude that social impact  games rooted in basic insights from social psychology can boost immunity  against misinformation across a variety of cultural, linguistic, and  political settings.

# Questions about inferring causation from the data:

1. Was this a pre-post design (in which everyone receives the “treatment” and there is no random assignment to a control group) or a randomized controlled design (randomly assigning people to a “treatment” and “control” condition)?
2. If this is pre-post rather than randomized, then can one conclude that the game can “confer"", ""help"", or ""boost"" anything?
3. If we cannot infer such causation, then what can we infer instead?"
66,"My biggest issue is not the pre-post design, but that they ignore basic tenants of learning and skill acquisition literature.

>We showed participants (*n*= 134 to *n*= 379 for the full pre-post survey) 3 fake and 3 credible (control) Twitter posts before and after playing the game and asked them to rate their reliability on a 1-7 Likert scale

There are transient practice and true learning effects. Transient effects of practice influence measurements immediately after practice but then fade. We don't know from this study if these effects persist into the future when reading fake news. If not, then we'd have to play a game before reading the news everyday. They need to conduct a transfer test to understand how ingrained these results are to participant reading/understanding strategies."
67,American conservatives really need to play this game
68,Someone please guild this
