,comment
1001,"yeah that's what's lost in all these studies. Moving school to be an hour later means school busses are running at rush hour now. Traffic would become a nightmare. Or jobs would also just shift to later in the day to compensate, and now parents are getting home at 6pm having to cook dinner. School doesn't just start at 8:30 because it's tradition, it's because family life is built around that schedule. All that would happen is kids would still get dropped off at 8am and just wait there an extra hour for school to start because parents can't go to work later and can't leave their kids at home."
1002,Don't forget all extra curricular activities will end later too
1003,"with TV, computers, phones, games, etc, kids sleep much later. 

Ever have the power go out in the evening? usually end up going to sleep soon after the sun goes down, waste time and battery running candles/flashlights vs just going to bed."
1004,[removed]
1005,[removed]
1006,[removed]
1007,[removed]
1008,"I don't think the late start was what had them out until midnight or 1. I spent many a night watching tv or playing on the computer until 3 AM falling asleep and having to drag my ass to school at like 6 am. 

Generally speaking I'd say most states have laws for kids work schedule. I think it was until 10 PM on school nights in my area maybe 11PM."
1009,"In my district we start late (9am for high school) but it’s illegal in my state (Texas) for employers to allow employees under 18 to work past 10:30 pm on a school night.  Maybe passing/enforcing those protections for teen employees would be the place to start?

Honestly though I doubt that teens who needed the money wouldn’t work as late as they were allowed (by parents or employers) even with a 7:20 am school start time.  Teenagers have a sleep-wake cycle that is different from adults’ or younger kids’ so even when they don’t work late they will generally not fall asleep early enough to get enough sleep for an early start time."
1010,"Yes, but fixing one thing will force us to consider and fix the next thing.

Unfortunately we can't just scrap our school system and start over, especially with the worst leeches in the entire education system trying to convert the whole thing to ~~a massive money giveaway to the rich~~ Charter Schools so it is what it is."
1011,"This was my case back in school. Class started at 7, got out at 230, at work by 3 or 5 and worked till 10 to as late as 230, though usually on weeknights was out shortly rafter midnight. Worked 5 nights a week, with 4 usually being before a school day. School was for sleeping. I was a bit of a strange performer in school, low GPA (2.5), and high absences/tardiness, but among the highest test scores in the school and got excellent grades in my AP courses and a few others that were actually interesting or challenging. Most teachers didn't get it. Don't know how many lectures I got about work ethic."
1012,Idk where you are but in CA it's illegal for minors to work past 10 on a school night.
1013,Man. Capitalism is such a failure.
1014,I assume one factor would be between sleep and adolescent development? Correlating adequate sleep (notably during REM) with an increase in pubertal growth over time?
1015,There’s a podcast called The Drive hosted by Peter Attia and he has a three part series interviewing Matthew Walker. Really good listen
1016,I have had 5-3 rhythm for about half a year now... I go to sleep at 5AM and wake up at 3PM. :/
1017,[removed]
1018,[removed]
1019,"Recently switched shifts for a short job.

Always been a night owl and my job normally had us get there at 7 am. This job I'm on right now starts at 4 pm.

Last night, at 2 AM, when everyone else was exhausted, I was as energetic as most people are during the day.

I hate being a night owl though. Most people aren't up late at night and the ones that are... Well theres reasons most of them work at night.

Its physically exhausting to be up during the day but mentally exhausting to be up at night"
1020,This is why I work third shift.
1021,"I dropped out of HS because I couldn't get up early. Then I redid it and just skipped the first 2 classes every day. Despite not attending a third of my classes and having my grades docked by some teachers I tied for first in my class at the end. Most of that probably came from being in my twenties, but I'm sure some of it came from actually getting some sleep."
1022,That’s just horrible
1023,"This is beautifully explained in ""Why we sleep"" by M. Walker. Has to do with the fact that your sleep buildup and sleep rhythm are in fact 2 different things."
1024,"This is my sleep pattern almost exactly. I have tried ""fixing"" it many ways but nothing sticks. Interestingly, I wake up earliest naturally on the weekends by a large margin."
1025,"Remember my very first class of the day in 9th grade was something having to do with maps. Every morning when I'm still barely awake, the teacher would shut off the lights and project maps on a screen to discuss parts of the world in a very slow, monotone voice the entire period. I would literally be passed out in a lake of drool within 3 minutes of the lights going off and sleep till the teacher woke me up after the bell rung."
1026,"> Lots of kids need motivating to get to school on time. Hardly any need motivating to find their way back home

They don't need motivation to get to school, they need motivation to get up. Going home is easy because you're already up."
1027,"One of my kids is an athlete, and grades 7-12 switched to a later start time starting in his sophomore year. The teams just accommodated it. Probably the biggest hardship was having to leave school early for some games and meets - he would occasionally have to make up a test or assignment during lunch. But he loved loved loved the extra 45 min in the morning - he felt it made all the difference, and his grades shot up. He was quite jealous of his younger brother."
1028,"Sounds like schools should get out of the sports game. If sports, which serve a minority of students, dictate the rest of the school, something is broken. Time for weekend sports and city leagues. This is getting ridiculous. Every study shows that we are shortchanging students to cater to athletes."
1029,"There are alternatives, including before school athletics. And don’t say that defeats the purpose, because that would only affect the small number who would participate in them at that time. There could (and would) still be both after school and during the school day athletics."
1030,Has the article taken into account how much they sleep? I can imagine the students just sleeping less if they have early classes because they are students and stay up too late. Thus decreasing performance
1031,They are called EXTRAcurriculars for a reason. If they are so important they can come in before school. Why make the many suffer for the few?
1032,"I did theater after school, and when my school considered switching to a late start time we would have had rehearsals starting at 6:30am instead of 2:30pm. It would have been awful and would probably have severely impacted the amount of people willing to participate. My school didn’t have sports but it’s the same idea - you either have to be up incredibly early or out very late to practice. Late start times are logistically difficult."
1033,"One rebuttal I can have for this, is to schedule the athletics in the middle of the day (by breaking for a few hours and doing the sports things), or schedule it a bit earlier in the day, and have classes following."
1034,"Later start times (for middle and high school only) have worked fine in NEISD, a consistently high performing and well regarded (and ethnically/socioeconomically diverse) school district in San Antonio, Texas.  Being Texans they still take their school sports VERY seriously, they just do a significant portion of the practices in the morning (when it’s cooler anyway) and use more lights for evening practices.  

Morning practices don’t work for everyone of course — some gifted athletes unfortunately don’t participate in the school sports and some gifted musicians don’t participate in the band because they can’t adjust to the early morning practice time.  But because the true point of school is, y’know, the school part, it’s more important to start the mandatory school day at a time that benefits the most students.

Most students (again at the middle and high school level) are plenty motivated to get to school without their parents’ supervision.  It’s a social experience and most adolescents do truly want to finish high school and want to avoid the consequences of truancy even if those consequences are at the end of the week rather than in the form of a parent nagging you out the door."
1035,Exact same case with me.
1036,"It's definitely the ""early bird gets the worm"" mentality. It's not going to go away either."
1037,"For me changing it from 7 to 8 am wouldn’t do much, but changing it from 7 to 10 am would."
1038,You do realize teenagers can’t fall asleep due to their circadian rhythm usually till 11 pm.  This has been established for a while.  In regards to test scores there are plenty of studies that show improvement from graduation rates to performance improvement in standardized testing.
1039,"Our school did this two years ago too! We saw a huge decrease is the number of 1st period tardies and just anecdotally, I almost never have kids fall asleep. 

What’s funny though is the kids HATE it!! They all complain about getting out later. I love it though. I have so much time to sleep in and relax and enjoy my coffee when the sun is already up each morning."
1040,"I don’t get how starting school so early when you’re younger is comparable. People have to adjust their sleep schedule so often in adult life, whether it’s for a few days at a time or adjusting to an entirely new lifestyle. Also not every job starts at 8am.

The only thing that can prepare you for that is the experience itself because it’s unique to each person and you get better at it as you get older."
1041,"Except you don't because your circadian rhythm shifts back after your teenage years, IIRC."
1042,"Teenagers require more sleep than adults. With early morning starts, most kids aren't going to bed earlier so they are just getting less sleep. With late starts, kids can sleep for longer hours.

I think it's better that kids get their needed sleep for development and then get shocked later in life, than not getting enough sleep all through school years but no shock later."
1043,They controlled for bedtime and sleep duration.
1044,that's not the point as I understand it. not the amount of Sleeptime rather then the daytime is the point in this discussion. so it would be okay to stay up until 2am and stand up again at 8am.
1045,"Some other research has shown that moving back school starting time by 1 hour leads to 20 min more sleep on average. So the kids do stay up later, but not enough to negate the sleeping in."
1046,All of which are specifically designed to captivate our attention for as long as humanly possible.
1047,"I don't think anyone focuses on one particular aspect of Reddit for 8 hours; the site as a whole can capture attention for long periods because it allows people to flit from subject to subject as their interest dictates, rather than forcing their interest to  conform to one particular task for 8 hours.

Ditto for games and TV."
1048,[removed]
1049,"I feel like you and I have different definitions of the word ""concentrate""... mindlessly scrolling through reddit, or binge watching a TV show cannot be said to be intellectually stimulating or require much concentration at all."
1050,"That’s consumption, not production."
1051,"That's not really concentrating, though. You're probably mind-wandering and watching TV while browsing Reddit at home."
1052,I rarely can do that.  As someone who loves to play video games I rarely can play one for more than 2 to 3 hours.  Only a really interesting TV show (anime) or book can keep my attention for over 4 and even the best of those have me swapping when the story gets to a slow point.
1053,That's not exactly focused attention.
1054,[removed]
1055,8 hours?! I can't do any of those for 8 hours
1056,That’s not ONE thing tho ;)
1057,"I’ve played video games my entire life, and I can’t play them for long that a few hours at a time.  I’m envious of anyone who can honestly."
1058,"Even video games and TV need a break for me.
I once played Twisted Metal Small Brawl for 6 hoirs straight, because I didn't have a memory card, but wanted to play as trapper.
It was not worth it haha."
1059,"Hey, I don’t concentrate on those, either. I’m usually checking Reddit or playing mobile games while also playing a video game on my PS4. Or at least watching YouTube. I switch between multiple forms of entertainment, basically. I doubt I could even watch the Marvel Movie Marathon that I want to watch without messing around on my iPod at points."
1060,"But that's entertaining, it's different.

If your job is entertaining 8 hours a day, sure.

But even Twitch streamers struggle to stay interested on a 8 hours stream. They get fatigue."
1061,"I mean, you're joking.  But even with those leisure and entertainment activities, people are only devoting peak attention to each for a limited amount of time.  You may be on reddit all day but you're not constantly replying and actually consuming content that requires some brain power.  Cat photos and dumb meme images are easy to consume.  But if you have to read an article, there's only so much that people actually pay attention to.

Or with videogames.  Even back in the days of WoW and Evercrack, people aren't taking on in-game activities that are strenuous for their entire time playing.  They're often doing other more laid back stuff like socializing, etc.  And how often do you hear about people speaking of their backlog of games as if it's some chore they have to clear out.

And with TV, with the availability of ready access to endless number of shows and entire seasons, people aren't binge watching as much you'd like to think.  Unless it's a particularly compelling show like Breaking Bad or Fargo or something, people actually get fatigued and overwhelmed by what they have to watch.  Most of my Netflix-ing consists of playing The Office in the background while I do other stuff.  Much how like I handle the work at my actual office.

So my point is, we may sit around and constantly be redditing, playing videogames and playing TV shows for hours at a time, but we're not always actively engaging in those activities."
1062,Doesn’t explain middle and high school
1063,"I'm gonna just say it isn't ""free"" you pay taxes. Also parents would probably be ok with it if kids didnt come home with 5 to 6 hours of homework every night, I'm basically working 10 hours a day and then doing home work till 8 or 9pm. To me the system is broken I'm basically the teacher and I dont get paid to do it."
1064,"I’m not exactly pro 12hr work days, but my dad worked with a semiconductor company in the U.S. that moved their production to a 10hr day, 4 days a week. Because the startup/shut down time remains the same day to day they were productive for more hours over 4 days than they had been at 5.  Overall operating costs dropped since they didn’t have lights/environmentals on as much and the staff liked the 3-day weekends."
1065,"Ah. But there's a big trade off.

I LOVE 12 hour shifts. Always get a 3 or 4 day weekend because you get your 40 hours in, in about 3 days."
1066,Some people really like working 3-12 one week and 4-12 the next. They only work 7 days out of every 14.
1067,[removed]
1068,I'm a nurse and I have been working 12 hours shifts since the start of my career. I actually prefer 12 hours over 8 hours. I get more days off in exchange.
1069,"I’m more shocked at finding out that they were illegal in the past. Whats wrong with 12 hour shifts? Just because they are legal doesn’t mean you yourself have to work 12 hours, but if someone wants the extra money they should have the option to work longer."
1070,"It only gets worse once you enter the workforce, assuming you’re in the US. What I would give to only have to work 7-3 every day."
1071,"This is a serious reply,  I think the measure of the student IS the measure of the student. Or a strong correlation. 

Dammit I can't string together the words to be more concise.  

The students can't be doing better if their instructors are doing worse?"
1072,"You measure teacher performance by student performance right? If the students are doing better, then the teachers should be part of the reason why. Or at least that was my original thought; I also didn't read the study but I imagine it's hard to tell specifically whether the adjusted schedule helped better student performance or the teachers did, or both, and to what extent did each help?"
1073,">But to answer your question with a question, how could you even begin to measure teacher performance?

Fellow teacher here. One easy way is through performance. Others could be homework completion, kids coming in for extra help, class averages?"
1074,"This argument is a self-fulfilling prophecy. If all the parents in the workforce suddenly told their bosses they had to start working an hour later, then all the employers would adjust shift times."
1075,And that mindset is why we still treat schools as daycares. Were 14-18 year-olds incapable of taking care of themselves a century ago?
1076,Right.  It's always been timed to working parents schedules and that's why it sucks
1077,Eh but then who’s picking them up? Problem still exists.
1078,My ass was on the bus and my parents had time to drop me off
1079,"Yeah that saying implies that the worm doesn't have to be there for good stuff to happen..But in truth its critical to the whole metaphor.  If worms all of the sudden changed their schedule, English teachers nationwide would be confused about how to incentivize people to be more attentive in the morning."
1080,They specifically said that people that sleep later never outperform those that naturally wake earlier. There is no designed advantage. It is what it is.
1081,"Also, it's not good to be an early worm."
1082,"As a ""night owl"" this rings so true. Like sure I can work on my assignments during the day, but man, inspiration sure seems to strike later at night. This can be problematic as a chronic procrastinator, but man do I submit some damn fine work."
1083,That might not work so well because the night owls in the US still operate in an early bird world. School would be the only thing adjusted.
1084,And people wonder why online charter schools are so popular...
1085,"I mean they don't say that you absolutely *can't* change your chronotype, they're just kind of identifying it as a thing."
1086,"And then run schools at all hours of the day to accommodate, apparently"
1087,[removed]
1088,">but seeing the sun set while I'm in an office is kind of depressing.

That happens from october to march up here in the north."
1089,"My parents left work before I left for school like my entire childhood. They woke me up got me ready and then I waited for the Bus after they left. The school times are actually pretty stupid because they have older kids (middle school and high school) go to school first and come home last. So the natural cheap childcare of family friend or older sibling is lost. If anything Elementary kids should go to school first and come home last. Make up the time by having longer session of Music, Art, Gym, and Recess."
1090,[removed]
1091,Before school care.
1092,Frequently those kids are in some sort of after school program.
1093,"> I mean kids are out about 3:00 but parents aren't home until 5-6, what's the difference?

Imagine an 8 year old getting out of bed and to the bus on time by themselves, that's significantly more difficult than asking them to play at a friends house after school."
1094,"A lot of kids wait. They do their homework or hangout with friends or clown around until they either 1. Walk home 2. Their parents pick them up 3. They’re homeless so w/e 4. They stay at a friends house for the day.

I went to a private school and there were multiples of each of my categories at any given time."
1095,[removed]
1096,"Nope it should be about using every advantage you have to grab all you can while screwing over as many as possible in the process. Oh wait, sorry that's how it IS."
1097,This is the least progressive thing ever
1098,Extracurriculars should never be in a discussion about academics at a school. I say this as both a teacher and a coach of 3 sports.
1099,[removed]
1100,"That's just based on my conversations with them - they'd work 4-12. I personally worked 3 hour shifts in high school, but it was for money to buy, like, ice cream at Friendly's. 

I agree that New York had very strict laws for minors, but Georgia was a whole other country it seemed. You could start working and driving younger there. Even working til 11, if you still have homework, you're not getting much sleep."
1101,But they still do. My students tell me all the time how they have to work late.
1102,[removed]
1103,[removed]
1104,We transitioned from a species that always had different group members of the tribe awake to keep watch into a rigid one size must fit all system  that pits the individual's own genetics against the society's demands
1105,"You can’t pass high school by never showing up to your first two periods unless those periods are electives. And even then, your GPA would be fucked."
1106,"I think plenty of people have trouble leaving on time to get anywhere, regardless of how awake they are. Nobody wants to stop whatever they're doing (whether that is sleeping, watching tv, playing video games, whatever) to go someplace, especially if they don't *really* want to be there."
1107,"I would have never gone to school if I wasn’t forced to. I definitely needed motivation. If my parents didn’t pay attention, I would never have shown up.

When I was in-between girlfriends, I found that my motivation to go to school was terrible. Or if I was looking forward to a class, I found that I would feel a lot more awake and wanted to go to school. It only took one class that I was looking forward to to get motivated. 

My 7th grade year was the best year I had in school. Because in my 4th period, which was a study hall before lunch, the teacher let me play his guitar all period. My grades reflected well, which was a surprise to my parents because I was never an academic during K-12."
1108,"I think they need both. As a kid, I would’ve ate poison before I’d willingly go to school."
1109,"Honestly don't get the bag. But what if the kids had to start and end practice a little bit later? Well they all got an extra hour of sleep so they are probably doing ok. Like all we are doing is shifting the schedule not adding or removing an hr from the day.

The only issue I can see is with elementary schools but they already start later than jr/sr high anyways."
1110,"And even then, starting your day with exercise instead of ending the day with it would provide a much needed energy boost for your initial classes. I've never felt as good and productive as when I would go to gym before class on days that I start around mid-day. Sadly, I can't afford to do the same on normal days as that would mean I'd need to be up and running by 4-5AM just to be able to get back home and shower/get ready by 7:30.(My gym doesn't even open that early to begin with).

I think starting the school day later would be beneficial EVEN if you're doing extracurricular activities like sports. Lord knows how many times I've gone to the gym after school only to come back home physically energized but too mentally out of it to do any assignments or catching up on reading material."
1111,Got a great idea keep the theatre practice after school... Even if you shift from 2:30 to 4:30 you can still put in 1.5 hrs and it would be 6PM which I would venture to guess is around the time parents would be fully capable of picking a kid up if needed or be able to start dinner.
1112,For me the last year or two of highschool I was struggling to fall asleep by 3am most nights and that problem has continued on to this day.
1113,"Exactly. Read ""Why we Sleep"" by Matthew Walker. That book goes into detail about how it matters WHEN you sleep and are awake as much as it matters how much you are asleep and awake. Our circadian rhythm causes us to be more wakeful or drowsy depending on the time of day, regardless of how much sleep we actually get."
1114,And which aren't very productive...
1115,"They’re also elective activity. There’s something to be said for society dictating where you spend your time. When you want to, you spend more there. 

For example, when i wanted to write code for work. 10 hour days weren’t trying.  Now because i don’t see the value in it 1 hour behind the screen is enough to make me want to get up and lose my mind. 

Makes me wonder if TV and reddit are captivating or it’s just because i don’t have to be there doing that.. I want to. Chicken before the egg type thing."
1116,Then maybe they (I don't know who 'they' is) should make jobs that are designed to captivate our attention for as long as humanly possible so that wage slavery doesn't suck. Or just tear down the whole system.
1117,"And even then, how often are we ACTUALLY actively focusing on those things for 8 nearly consecutive hours at a time? At least for me, even if I'm really interested in a game, I can only really concentrate on it for maybe 3 or 4 hours at a time before I notice myself getting worse, missing details, etc."
1118,Which even on adderall I can't do haha.
1119,Which is why reddit went from pages to infinite scroll.
