,comment
1829,"These changes are far more likely to relate to their isolation from predators than climate change. Since they arrived on the islands, they have seen a massive increase in population. FTA:

>> Unburdened with the threat of predators, the island mongooses live in densities 66 times higher than they do in their ancestral India. The island mongoose dating scene had to be dramatically different than that of their native counterparts."
1830,"most likely related to sexual competition, not to climate changes

[https://www.nationalgeographic.com/news/2010/3/100323-bigger-better-testes-competition/](https://www.nationalgeographic.com/news/2010/3/100323-bigger-better-testes-competition/)"
1831,[removed]
1832,Drop testes because no predators are hanging around waiting to rip them off. Shrink glass because female mongooses are nearer due to population density. Now let’s see if I guessed right!
1833,It has nothing to do with climate changes.
1834,Is anything like this potentially possible for humans? (For example we have an ice age and our testes go up over a quick period of time)
1835,[removed]
1836,There are no factors that seem to be limiting humans ability to reproduce.  Without this I doubt we will change as a species in any direction.
1837,"It might be easier to think of the interaction of the environment with the organism when thinking about its evolution. There is always a interaction between the ecology of a species and its evolution, and in a lot of cases their ecology is what drives their evolution.

Sample size is an important feature of these sorts of questions because an incomplete sampling can bias your interpretation (imagine sampling only mongooses on islands, instead of including the paper's original comparison of native mainland mongooses to island ones).

For humans, these same factors are relevant. Human ecology is a weird concept, but in a sociocultural lens it might be more clear. The sampling aspect becomes much more important though because with humans, there is a lot of gene flow between populations. Gene flow just means that mating pairs can disrupt the accumulation of environmental adaptations.

In the mongoose example, the sexual traits (anal pads and testes size) are tenable targets of selection because the isolation from mainland populations (where the target of selection is the opposite than on islands, due more male competition) relaxes mainland targets, giving way to change the direction of evolution.

Without isolation, its difficult for evolution to proceed rapidly because it keeps getting mixed into a new genetic background. That's sort of the case in humans, where there may be a large range of different traits, but there's no strong enough selection on any particular range (with height we have a large variance but the particular range might be people taller than 6 feet) to overcome the high degree of gene flow.

That's not to say there aren't human adaptations to the environment though. Melanism, lactose tolerance, high altitude hypoxia tolerance all are sort of classic cases. "
1838,"Species centrism is a tough hurdle for every relevant scientific field to navigate.

That said, anthropologist Alan Walker dedicated his career to studying humans as animals, and wrote books worth reading that address your questions."
1839,"Diet most certainly effects our physiology. Our food industry is kinda fucked up atm, trying to maximise profit and minimise work... The amount of soy that is stuffed into almost every food item in the grocery store is having an accumulative effect on people's bodies... The amount of hormones pumped into animals that become the flesh we eat, its full of steroids and hormones and hormone blockers...

Humans hormones are most certainly being affected by our environment."
1840,"My anal pads are hardly even visible at this point, so you might be on to something.

But seriously, there are certainly correlations between ecology, environment and evolution working on human beings but we don't have a long-distance scent-based or pheromonal mating system to lose in an island setting. Technically speaking scent *does* play some role in human mating habits, but we don't go around engaging in marking behavior as part of a mating strategy. Only around 10% of humans have the vestigial organ in the nose related to detecting pheromones so it doesn't seem to be especially important and probably hasn't been for hundreds of thousands of years or longer."
1841,Yes. We are just hairless taking apes. We could breed superior humans just like we breed superior anything else. Hitler took it too far and now everyone is scared shitless of it. And or their egos can't take it. Nobody wants to be obsolete.
1842,"No. It would be founder's if the mongooses that were originally introduced had these reduced sexual traits. Instead, these introduced mongooses experienced relaxed selection from their native area, and so stopped investing in a trait they no longer needed over time. This paper is looking at about 120 years since their introduction."
1843,"Species in which females commonly have multiple male partners, such as chimpanzees and bonobos, tend to have bigger testicles.  Species prone to monogamy, like gibbons, or in which multiple adult  females tend to mate with a single male, like gorillas, tend to have  lower sperm-competition rates and smaller testicles.

[https://www.sapiens.org/column/animalia/sperm-competition-testicle-size/](https://www.sapiens.org/column/animalia/sperm-competition-testicle-size/)"
1844,[removed]
1845,[removed]
1846,"Umm...

>> Their findings—[published recently in the journal Evolution](https://onlinelibrary.wiley.com/doi/abs/10.1111/evo.13934)—reveal that generations of easy island living have resulted in rapid changes to the mongooses’ anatomy, a rare find in mammals."
1847,"Untrue, they link the research paper halfway through:
>[This article has been accepted for publication and undergone full peer review](https://onlinelibrary.wiley.com/doi/abs/10.1111/evo.13934)"
1848,"It's Gizmodo, not Gizmoto, whatever that is, you uneducated heathen. ;-)

If you actually read the article, you'd see this paragraph...  ""Their findings—[published recently in the journal *Evolution*](https://doi.org/10.1111/evo.13934)—reveal that generations of easy island living have resulted in rapid changes to the mongooses’ anatomy, a rare find in mammals."""
1849,"The author was trying to study sexual selection, but it might be a bit of both based on the description."
1850,"Both. Environmental because islands are smaller and increase chances of encounters (eliminating the need for long-distance signaling), and sexual selection because more males increases sperm competition leading to larger testes."
1851,Yeah but environment influences which traits are selected for
1852,"I think this is why they tested on 4 different islands, to help rule out the possibility of testing an island that had been populated from the start with small butts and big nuts."
1853,[removed]
1854,[removed]
1855,[deleted]
1856,Scent glands used for mating and such.
1857,"""It's a device used to not suffer the long toilet lines at events such as music festivals"" would be my Jeopardy! answer."
1858,"I assume you're referring to jokes. If so, ""no jokes"" is rule one for comments on this sub. They can take their jokes to any other non-academic sub on this site."
1859,how do you interpret those two to be different?
1860,"In college the prof referred to it as micro-evolution (just sayin, not sure if correct)"
1861,"Yeah, it's the first step. And Evolution is the escalator it's on."
1862,Nope
1863,"That’s what I thought, TIL I guess"
1864,[removed]
1865,[removed]
1866,They are on Hawaii islands
1867,Glands for building Teslas and space rockets
1868,[removed]
1869,"Ok, so maybe at higher population densities there are more females around (easier to find, not so dependent on smell to successfully find a mature), and the competing male pressure is meaning that some or all are more likely to ignore the scent markings, making the anal pads less useful?"
1870,Easier to find a mate (anal pads shrunk) and easier to have a higher chance at procreation with the big ol balls (big ol balls)???
1871,"r/science is very particular on top level comments and the moderators delete the ones that are too short, don't contain any information or are off topic."
1872,Big balls if true
1873,[removed]
1874,[removed]
1875,[removed]
1876,[removed]
1877,[removed]
1878,[removed]
1879,[removed]
1880,That right there looks like an anal pad.
1881,"Ah yes, my asshole."
1882,[removed]
1883,[removed]
1884,[removed]
1885,[removed]
1886,[removed]
1887,[removed]
1888,[removed]
1889,But implying it’s climate related gets the clicks
1890,"I was going to reply by sarcastically formulating a more ridiculous study...

Unfortunately I could not.  Either by chance or pure incompetence your ice age cave man testicle theory is the most difficult to study, least useful and most ineffective method of gaining any insight into climate change.   I hope this was an attempt at a joke and that you don't actually divert scientific funds for any real studies in any field."
1891,"As an aside, a reduction in reproduction isn't really needed for speciation to occur. As an extreme example, if you managed to eliminate any mating between people living in the tropics and people in the arctic for the next 100,000,000 years you'd likely see speciation occur without any reduction in reproduction. Obviously there are other modes of speciation besides allopatric speciation (geographically isolated populations), but none that required changes in reproduction."
1892,"But that is exactly what is causing these mongooses to change: the removal of their ancestral constraints on reproduction (mostly predators). But humans are harder to study, as we don't have any massive but totally isolated populations that have remained for as many generations as these small mammals."
1893,"Oh there's absolutely people not reproducing. Or, better said, reproducing less. You just have to find their common traits, and that's the actual evolutive pressure"
1894,"Interesting, thanks!"
1895,[removed]
1896,"I never said it didn't, just simply stating my opinion"
1897,"Especially when the title says "" a rare fiding "" implying that 

1. It is not new 

2. It is still intersting because it is rare"
1898,"Mmhmm.

https://onlinelibrary.wiley.com/doi/full/10.1111/jeb.13130"
1899,"you mean question.... The answer would be "" what are butt pads"""
1900,[removed]
1901,[removed]
1902,[removed]
1903,That’s how he churns out production so fast. His rocket glands are huge
1904,"which also require huge balls, apparently"
1905,"And then to explain the balls...maybe lady mongooses just love big balls, like peacock feathers but balls"
1906,"This is more or less what I was thinking. 

Beyond that, I can only guess at other implications, so this is based on a lot of assumptions: maybe due to more available and less competitive mating, males are at least complicit in the females mating with multiple males. It would be interesting to see what future behavioral effects this could have on the population."
1907,"I think it’s so he can mate with as many females as possible m. If there is a large population, no need for the scent glands but definitely needs more spunk for the multitude of females he’s breeding with"
1908,[removed]
1909,[removed]
1910,[removed]
1911,[removed]
1912,[removed]
1913,[removed]
1914,[removed]
1915,"I'm a different person and not joking when I say that our understanding of genetic expression, epigenetics, and evolutionary theory could be massively disrupted if a non-catastrophic event showed a statistically significant phenotypic expression greater than runaway selection. What you look at and why you look at it are two different things. Usually grant money dictates at least one of those."
1916,"Trust me, I can think of so many more ideas that are less useful. Also, because apparently this was not clear, I’m simply if something like this is at all possible in humans."
1917,100 million years and not only could speciation occur but entirely new orders of animals would arise. Placental mammals didn't even exist 100 million years ago.
1918,"Monogamy in humans reduces sperm competition, and so reduces selection for traits such as large testes.

We know that monogamy is a relatively new trait in humans because (along with other evidence) we have quite large testes. We also know we've been physiologically adapting towards monogamy for some time - this is the leading explanation for some unique-among-primates traits such as concealed ovulation and female sexual ornamentation (i.e. permanently big breasts), as well as (iirc) relatively poor sperm quality.

And of course, humans aren't completely monogamous - few animals are. Nevertheless most people who have children will do so with only one partner, or at any rate, few partners. There are exceptions, of course."
1919,[removed]
1920,[removed]
1921,[removed]
1922,"Perhaps climate could explain this, not sure"
1923,It’s all about the balls
1924,[removed]
1925,[removed]
1926,[removed]
1927,"Yep, I just wanted to set in the extreme example on some long time scale."
1928,I would argue that humans are becoming less monogamous in recent years.
1929,[removed]
1930,I asked the climate but it didn’t reply. I don’t think it can answer our calls
1931,Well you said you would but what’s stopping you from arguing that? Is it because that’s completely anecdotal and you have no sources? If so then why comment?
1932,[removed]
1933,The climate likes big balls too.
1934,I have sources.
1935,"Current estimates is the sun will last another 5.4 billion years on its hydrogen reserves, at which point it “begins dying” and switch’s too this growing stage. The red-giant stage is what this is describing, and in fact this high luminosity is at the END of the red giant stage as it’s shedding all Iayers. 

6 billion years is within the ballpark of when this will happen. 

Then it’ll become a white dwarf and spends a few trillion years cooling down, accompanied only by the remains of Mars, Jupiter, Saturn, Uranus and Neptune, as everything else according to this research would be reduced to dust by the outbursts."
1936,"
Break-ups form a vast asteroid debris field much like the classic arcade game, including fragments which revolve around each other as “double asteroids”
Scientists predict that the Solar System’s asteroid belt will be pulverised by the Sun’s light in 6 billion years
The majority of stars in the universe will become luminous enough to blast surrounding asteroids into successively smaller fragments using their light alone, according to a University of Warwick astronomer.

Electromagnetic radiation from stars at the end of their ‘giant branch’ phase – lasting just a few million years before they collapse into white dwarfs – would be strong enough to spin even distant asteroids at high speed until they tear themselves apart again and again. As a result, even our own asteroid belt will be easily pulverized by our Sun billions of years from now.

The new study from the University of Warwick’s Department of Physics, published in Monthly Notices of the Royal Astronomical Society, analyses the number of successive break-up events and how quickly this cascade occurs.

The authors have concluded that all but the most distant or smallest asteroids in a system would be disintegrated in a relatively short one million years, leaving behind debris that scientists can find and analyse around dead white dwarf stars. Some of this debris may be in the form of ‘double asteroids’ which revolve around each other while they orbit the Sun.

After main sequence stars like our Sun have burnt all their hydrogen fuel, they then become hundreds of times larger during a ‘giant branch’ phase and increase their luminosity ten-thousand-fold, giving out intense electromagnetic radiation. When that expansion stops, a star sheds its outer layers, leaving behind a dense core known as a white dwarf.

The radiation from the star will be absorbed by orbiting asteroids, redistributed internally and then emitted from a different location, creating an imbalance. This imbalance creates a torque effect that very gradually spins up the asteroid, eventually to break-up speed at one full rotation every 2 hours (the Earth takes almost 24 hours to complete a full rotation). This effect is known as the YORP effect, named after four scientists (Yarkovsky, O'Keefe, Radzievskii, Paddack) who contributed ideas to the concept.

Eventually, this torque will pull the asteroid apart into smaller pieces. The process will then repeat itself in several stages, much like how in the classic arcade game ‘Asteroids’ they break down into smaller and smaller asteroids after each destruction event. The scientists have calculated that in most cases there will be more than ten fission events – or break-ups – before the pieces become too small to be affected.

https://academic.oup.com/mnras/article-abstract/492/2/2437/5682494?redirectedFrom=fulltext"
1937,Arent the majority of stars red dwarves? They have lives closing in on a trillion years.
1938,"It will not and nobody said that. Especially not scientists.
I call bs.
Why?
Our sun will go supernova in approximately 4.5 billion years."
1939,"What about Ceres, which is large enough to gravitationally pull itself into a spherical shape?"
1940,Our sun isn’t large enough to go supernova.
1941,"Well it will become a red giant then...
Still it won't live 6 billion years from now."
1942,"The part of the study that is important is not the date, it is the luminosity of red giants and how many will obtain given luminosity. From this and models of our own solar system, we can figure out what probability already happened elsewhere.

It doesn't matter if the red giant phrase is 1 billion or 10 billion years from now because it'll still produce a large emission of light several thousand times it's current production. The test it proposes is to look at systems that have already completed their main sequence."
1943,"Science says it'll turn gradually to a red giant in about a billion years.
While expanding it'll have ""eaten"" Mercury and Venus by then and Earth will be a scorched dead hell and will also be gone later.
So to say it will take 6 billion years is just wrong which is my point."
1944,"Did you not understand my point?

The article does not care about *when*, they are giving a date so people understand the content better. The article cares about happens *after* that occurs."
1945,Apparently I did not understand. Thanks for clarifying.
1946,What an amazing discovery.
1947,"Folks, this is a nifty discovery about a unique lifeform, no need to resort to viral apocalypse hysterics over it."
1948,"The title is misleading; the virus has six genes that they were able to match to homologs, accounting for about 10% of the genome. This is still interesting and places it far apart from other known viruses."
1949,"When I saw the same story posted [here](https://news.ycombinator.com/item?id=22276105), people were saying that discovering new viruses like this is incredibly common. So while cool, it probably doesn't mean anything."
1950,Oh no. Its coming from both sides of the world now
1951,Viruses like this are often the only link to shadow ecology and the areas of vastly unresearched soil and sediment bacteria
1952,"There's a lot of genes scientists are yet to identify, but what is special about this is simple life tends to be the easiest to study, meaning we have already mapped the genes of single-cell organisms and generally they all have a lot in common, to find one without known genes is quite frankly alien level rare. But to be fair, Brazil has many mysteries waiting to be discovered."
1953,They have enough DNA points to evolve transmission?
1954,Holy crap! I grew fishing on that lake!
1955,It was only 1 or 2 years ago that we discovered a new branch in the family of life that's so bizarre we didn't even know it was alive (talking about the lining of cells on the ocean floor that take half a decade for 1 round of cellular division). It doesn't strike me as odd to find something with no known genes. The tree of life is not done being mapped. Perhaps we'll never finish discovering.
1956,[removed]
1957,"Can we please undiscover this?

Thanks - *everyone*"
1958,"This is getting out of hands, now there is two of them."
1959,Oh yea it’s all coming together
1960,"Ashavirus in the books, and the books are better."
1961,Andromeda Strain is a great read/watch
1962,"This thing makes amoebas sick, can we give it to the brain destroying amoeba so you have more than a 1% survival chance as now??"
1963,Amoeba viruses are so interesting.  Recently they found a virus that attacks the modification another virus makes to an amoeba to hijack it to make itself.  A virus attacking a virus attacking an amoeba.
1964,God dropping the worst DLCs now
1965,"Have they tried the Red Poison Dart Frog?

Edit: whooooosh"
1966,[removed]
1967,But we need a new viral apocalypse hysteria since the current one is a bummer.
1968,But should we even call virus a life form?
1969,"Lifeform? Bruh, we gonna have the virus life debate?"
1970,But maybe it's from another planet. That would be kinda awesome
1971,Panspermia
1972,"Lifeforms

You tiny little lifeforms

You precious little lifeforms

Where are you?"
1973,28 days later
1974,But maybe it's from spaaaaaace...
1975,"Yeah, we still got 3-4 weeks of coronavirus hysteria left."
1976,"> no need to resort to viral apocalypse hysterics over it

""Don't bother me with trifles!"""
1977,But are you positive it is not an alien?
1978,"On the other hand, bats tend to be reservoirs for the really nasty stuff, so I get the fear."
1979,Can we cross it with measles and coronavirus to make it airborne with a 1 week silent infection lead time?
1980,Not to mention that I think it's no accident that the title allows people to believe it infects people rather than amoebae.
1981,This is not a single-celled organism. This is a virus.
1982,"Unrelated to viruses but there is a lot more diversity between single cell organisms than between most multicellular life.  We have most certainly not mapped all the genes of all (or most) unicellular life and they are not necessarily easier to study either.  There are a lot of microbes that we aren't even able to grow in a dish.  

What is most exciting about a discovery like this is the differences.  When you find a piece of cellular machinery that has no realtion to mammalian genes, it has potential to be used as a genetic tool.  CRISPR is probably the most notable example.  It is a bacterial defence mechanism against viruses that we found useful for gene editing."
1983,Can you link to an article? Haven't heard of that. Sounds interesting.
1984,Aliens probably won't have RNA or DNA.
1985,"Stop letting yourself get worked up by sensationalist reporting. You didn't get SARS, you won't get this. Wash your hands and go for the supplies you need for school."
1986,"If your young enough to go to college, the virus (in the miniscule chance you get it) will give you a nasty fever for a few days. That's it. I don't know why you're so scared."
1987,it is?
1988,"Yeah, we need a real virus not this bunk ass Corona virus. 

My wife is a nurse and told me this virus has been known for years amd should never have been a cause for panic. Apparently only 5-3 % of cases need serious care. More propaganda/clickbait/distractions!"
1989,it undergoes evolution and reproduces itself using nucleic acids. that’s good enough for me
1990,"No we shouldn't. By the scientific definition of alive, since it does not metabolize, its not alive."
1991,As long as it has a cell with organelles and DNA then it is a life form.
1992,"Yes, as some people think they are living creatures. They are just replicating entities that need a host organism to manipulate its genetic information!"
1993,Maybe were all from another planet and it's from here?
1994,"Why on Earth would a virus (highly specific in requirements for a host cell) from another planet have the ability to infect life on Earth? What evolutionary pressures would result in the ability to infect life on another planet (something that an alien would hardly encounter)?

This idea gets posed all the time, but it’s complete nonsense. There’s a zero percent chance this is from another planet. The majority of the virosphere has no cellular homologs. Viruses are discovered all the time with very few *known*(including other viruses) homologs, this just happens to be the one with the least. Knowing that every species on Earth (including bacteria) has at least a dozen different viruses, this is not even close to surprising. There’s *a lot* of genetic diversity out there."
1995,This kills the amoeba
1996,Perfect!
1997,... and then?
1998,Title-only reader here. You nailed it.
1999,"Amoeba can mess people up pretty bad on their own. I don't want alien-infected amoeba, thanks!"
2000,There are a lot of amoebae on Reddit
2001,"Dumb question: does it make the amoebae ""sick""? How do you even realise an amoeba has a virus?"
2002,"I mean unless your job involves the study of viruses, or use of viral vectors etc, the only time you hear the word ""virus"" outside of the context of computers is when someone is sick, so I guess it's reasonable for 95% of people to hear ""virus"" and think ""sickness that will make me ill""."
2003,Titles can't account for assumptions. There's no mention in the title at all about what it infects
